,Unnamed: 0,videoId,publishedDate,title,videoUrl,description,channelId,channelTitle
1423,53.0,OZvmu1wI5TI,2022-08-26T19:00:11Z,Zai1k &quot;Dump It Dummy&quot; feat. 2Rare (Official Music Video),https://www.youtube.com/watch?v=OZvmu1wI5TI,Official video for тАЬDump It DummyтАЭ by Zai1k feat. 2Rare Best Free Software https://exp-soft.org/category/software/ Listen ...,UC7XYy5fXWv7dP8Oq7rs3J-A,Zai1k
1424,54.0,iTBW6jbHgX0,2021-06-09T19:30:03Z,Playtime,https://www.youtube.com/watch?v=iTBW6jbHgX0,The ultimate twitch stream. donkey store https://dunkeyscastle.com/ donkey twitter https://twitter.com/vgdunkey donkey twitch ...,UCsvn_Po0SmunchJYOWpOxMg,videogamedunkey
1425,55.0,4FWLDMgw3QQ,2022-04-20T03:08:13Z,Donkey Ya DunkiЁЯШВ| Shahrukh Khan Ye Kaha Aa Gaye Tumред,https://www.youtube.com/watch?v=4FWLDMgw3QQ,Dunki nam ki kovie rajkumar hirani la rhe haiред 22 dec 2023 ko aane wali hai jisme tapsee pannu v haiред #dunki #shahrukhkhan ...,UCF1U5SIhWF-3d96iQICDzaQ,Rockey Review Adda
1426,56.0,rUyoOUUE4YE,2016-07-28T19:30:00Z,Dunderwatch,https://www.youtube.com/watch?v=rUyoOUUE4YE,My last overwatch video for real this time. http://www.impawards.com/2007/posters/no_country_for_old_men.jpg thumb art by ...,UCsvn_Po0SmunchJYOWpOxMg,videogamedunkey
1427,57.0,6Q6qHRHTTPg,2021-01-11T16:15:02Z,SHREK Clip - &quot;Talking Donkey&quot; (2001),https://www.youtube.com/watch?v=6Q6qHRHTTPg,"Watch the official SHREK Clip - ""Talking Donkey"" (2001). Let us know what you think in the comments below! SHREK is the ...",UC2sxxXRBL5SgY0fI58BrOCA,JoBlo Animated Videos
1428,58.0,Y6TGsEUNhJE,2022-05-25T13:30:13Z,Best of Comedy Scenes | Aaja Mexico Challiye | Ammy Virk | Zafri Khan | Naseer Chinoyti | Watch Now,https://www.youtube.com/watch?v=Y6TGsEUNhJE,"Watch latest Punjabi Movie "" Aaja Mexico Challiye "" starring Ammy Virk , Nasir Chinyoti , Zafri Khan , Sukhwinder Chahal , Honey ...",UCH3FAffJyp6RBYLSZsYnKdQ,Chaupal
1429,59.0,ww6gLKWRSXo,2022-05-06T16:00:13Z,Skilla Baby - Tim Dunkin (feat. Sada Baby) (Official Music Video),https://www.youtube.com/watch?v=ww6gLKWRSXo,3AM IN ATL OUT NOW! https://ffm.to/sadababy-3aminatl Skilla Baby - Tim Dunkin (feat. Sada Baby) (Official Music Video) Directed ...,UC4OWd0CnbvaiaozgLZO-L4Q,Skilla Baby
1430,60.0,WhfdC_EIyMc,2022-07-19T14:41:58Z,"3 Upcoming Films of Shahrukh Khan | Pathan, Jawan, Dunki #pathan #jawan #dunki",https://www.youtube.com/watch?v=WhfdC_EIyMc,"3 Upcoming Films of Shahrukh Khan | Pathan, Jawan, Dunki #pathan #jawan #dunki #shahrukhkhan #movie #upcomingmovies.",UCOq6RSkl97NSLxvwClv84fw,Thirsty Nick
1431,61.0,qOI7eD_po2s,2022-04-19T11:07:37Z,DUNKI .... GOES ON FLOOR,https://www.youtube.com/watch?v=qOI7eD_po2s,,UC8LHaSZjNRgYc8YsPLzy7tA,Bobby Bhai The Matinee Idol
1432,62.0,BO8PWF7AlYU,2022-04-21T13:30:01Z,Dunki | Title Announcement | Shah Rukh Khan | Taapsee Pannu | Rajkumar Hirani |,https://www.youtube.com/watch?v=BO8PWF7AlYU,Dunki | Title Announcement | Shah Rukh Khan | Taapsee Pannu | Rajkumar Hirani | #dunki #shahrukhkhan #srk WATCH NEXT ...,UCf7ulBnxmRsoUoJY4Yt977A,THOUGHTCTRL
1433,63.0,InuQD8-as1w,2017-10-25T08:57:46Z,The Wonky Donkey,https://www.youtube.com/watch?v=InuQD8-as1w,"The Wonky Donkey is a children's book, and song written by New Zealander Craig Smith and illustrated by Katz Cowley. The book ...",UCvhyBFWPb8WKpYDREqVPZ9w,Bonza Books
1434,64.0,Qtt9Qn1GlMo,2022-06-25T13:25:12Z,"ShahRukh Khan Speaks About His Three Upcoming Movies | Pathan, Jawan &amp; Dunki | Live",https://www.youtube.com/watch?v=Qtt9Qn1GlMo,"ShahRukh Khan is making a huge comeback after years with his amazing upcoming movies, Pathan, Jawan & Dunki. For the ...",UCdILIiuXr2UQUhc5SFVbKtw,Bollywood Now
1435,65.0,EIE8xUbIEAQ,2022-05-20T16:00:05Z,Shrek Meets Donkey | Shrek | Extended Clip | Animated Cartoons For Children,https://www.youtube.com/watch?v=EIE8xUbIEAQ,Click here to watch more videos: https://www.youtube.com/SaturdayMorningTV/videos #AnimatedCartoonsForKids #Shrek.,UCstwnmjrH6CX63UNqo0Mh5A,Animated Cartoons for Children
1436,66.0,Ymu9wVN7pWs,2022-03-02T06:03:23Z,Pathaan | Date Announcement | Shah Rukh Khan | Deepika Padukone | John Abraham | 25 Jan 2023,https://www.youtube.com/watch?v=Ymu9wVN7pWs,"Make. Some. Noise! PATHAAN is here. Watch the date announcement video! In cinemas on 25th January, 2023. Releasing in ...",UCbTLwN10NoCU4WDzLf1JMOA,YRF
1437,67.0,nlLT2SHL_lg,2022-09-14T19:00:17Z,Nintendo Direct vs Sony Direct,https://www.youtube.com/watch?v=nlLT2SHL_lg,"Whoever wins, xbox loses. donkey store https://dunkeyscastle.com/ donkey twitch https://www.twitch.tv/dunkstream.",UCsvn_Po0SmunchJYOWpOxMg,videogamedunkey
1438,68.0,pvo4nLI7GGE,2018-03-27T02:00:01Z,The Lazy Donkey in English | Stories for Teenagers | @EnglishFairyTales,https://www.youtube.com/watch?v=pvo4nLI7GGE,The Lazy Donkey in English | Stories for Teenagers | @EnglishFairyTales Parental Guidance: Some material of this video may not ...,UC8mWYDxedkJmUReAiA3ze9w,EnglishFairyTales
1439,69.0,ToO78xm0wlI,2022-05-30T02:50:17Z,SRK as Donkey or Dunki ? | Dunki | Title Announcement | Shah Rukh Khan | Rajkumar Hirani |,https://www.youtube.com/watch?v=ToO78xm0wlI,"SRK as Donkey or Dunki ? | Dunki | Title Announcement | Shah Rukh Khan | Rajkumar Hirani | Credit JIO Studios, Red Chillies ...",UCXAGCefVTHm7GqX0ngfPYGw,pb's Entertainment World
1440,70.0,D1H4o4FW-wA,2022-03-23T19:00:07Z,Elden Ring (dunkview),https://www.youtube.com/watch?v=D1H4o4FW-wA,You think this game is crazy? Wait till you play Elden Wing. donkey store https://dunkeyscastle.com/ donkey twitter ...,UCsvn_Po0SmunchJYOWpOxMg,videogamedunkey
1441,71.0,eqZ6kU0zQwc,2022-08-29T19:30:05Z,Xenoblade Chronicles 3 : Never Ending Game,https://www.youtube.com/watch?v=eqZ6kU0zQwc,"Dunkydunky has to find the xenosword from anime, but watch out for the alphabet. donkey store https://dunkeyscastle.com/ ...",UCsvn_Po0SmunchJYOWpOxMg,videogamedunkey
1442,72.0,vJ9P4y-6HRE,2022-09-05T07:21:18Z,Dunki Donkey Farm,https://www.youtube.com/watch?v=vJ9P4y-6HRE,dunki #donkey #donkeykong #donkeysquad #farm #shorts #shortsvideo #shortvideo #short.,UCFUzYCypCvi5CAHhMewRubw,Wisdom Prime
1443,73.0,MJEj9HaU4zU,2018-09-13T14:24:54Z,FOOLISH DONKEY STORY | Stories For Teens | Fairy Tales in English | Moral Stories By TinyDreams,https://www.youtube.com/watch?v=MJEj9HaU4zU,Best animated moral stories in English for Teens. The Foolish Donkey Story. Watch and enjoy cartoon stories and popular fairy ...,UCZi_0SXONQu-7gQzJ0eI0_w,TinyDreams Stories
1444,74.0,kZcR97bp-Co,2022-06-17T20:59:25Z,I Hosted the Worlds Greatest Dunk Contest,https://www.youtube.com/watch?v=kZcR97bp-Co,"Today we compete in 4 different dunk contest's including minihoop, trampoline, pool and regular height to see who is the best ...",UCQIUhhcmXsu6cN6n3y9-Pww,Jesser
1445,75.0,MIQKlHSD89E,2018-03-23T21:00:01Z,Tiny Donkey Thinks He&#39;s Actually A Dog  | The Dodo,https://www.youtube.com/watch?v=MIQKlHSD89E,Tiny Donkey Is Pretty Sure He's Actually A Dog | This tiny donkey's so small he lives in the house тАФ he even knows how to go ...,UCINb0wqPz-A0dV9nARjJlOQ,The Dodo
1446,76.0,Pdnz_GEwzR8,2022-10-11T03:31:01Z,Doaba | Garry Sandhu ( Official Video Song ) | Fresh Media Records | Jind Dhillon,https://www.youtube.com/watch?v=Pdnz_GEwzR8,Singer - Garry Sandhu ft Jind Dhillon Lyrics / Composer - Garry Sandhu Music - Daddybeats Dop / Director - Harry rai Editor ...,UCQjHoPr0kqN83Mmihy7nsWw,Fresh Media Records
1447,77.0,EQRuWJT0MLI,2018-01-19T20:30:00Z,Beasts of Rage,https://www.youtube.com/watch?v=EQRuWJT0MLI,Tonight on Smackdown Booker T. must defend his tag team title but will Ra's Al Ghul make good on his threat from Summerslam?,UCsvn_Po0SmunchJYOWpOxMg,videogamedunkey
1448,78.0,zfGd2vXyuK0,2019-11-07T17:00:17Z,Young Lions Mercilessly Attack Donkey Herd | Natural World: Desert Lions | BBC Earth,https://www.youtube.com/watch?v=zfGd2vXyuK0,Two young lions enter the firing line when they brutally kill several donkeys from a local village herd. Ranger Flip is left with the ...,UCwmZiChSryoWQCZMIQezgTg,BBC Earth
1449,79.0,TiWerhFYJZU,2022-07-22T15:25:11Z,Shahrukh Khan Upcoming Movies (Confirmed) 2023/2024 | Dunki | Don 3 | Pathaan &amp; Jawan,https://www.youtube.com/watch?v=TiWerhFYJZU,05 Shahrukh Khan Upcoming Movies (Confirmed) 2023/2024 | Dunki | Don 3 | Pathaan & Jawan #filmystudios #srk ...,UCx9DeOxWMMyYBXEmfYq1-xw,Filmy Studioss
1450,80.0,oUdz-c4X7ek,2022-07-23T18:54:00Z,DUNKI OR DONKEY ILLEGAL BORDER CROSSING || Never go behind Short Cuts #border #illegal #dunki,https://www.youtube.com/watch?v=oUdz-c4X7ek,Instagram: Eatsleeptravel_ahq watsapp: 00971 55 126 25 81 -------------------------------- So firends this video is in special request of ...,UCM1jWS-HqBfzZIVVSJ3GMcQ,EatSleepTravel
1451,81.0,vGdAg6pphHA,2022-12-03T12:31:23Z,Shahrukh Khan releases new video on his upcoming film Dunki,https://www.youtube.com/watch?v=vGdAg6pphHA,,UC0emPaV3JaCZ8YAVhLaaKOg,Facts World
1452,82.0,UFZPJSo6oWc,2022-04-20T23:15:25Z,Latest hindi movie Dunki | Shahrukh Khan new hindi film Donkey || #shorts #viralshorts #india #news,https://www.youtube.com/watch?v=UFZPJSo6oWc,Latest hindi movie Dunki | Shahrukh Khan new hindi film Donkey || #shorts #viralshorts #india #news #aamerhabib #newvideo.,UCKYVUuK3TRwpX_JlK_OIXRg,Aamer Habib: News And Information 
1453,83.0,axu6PavHqdc,2022-04-19T13:12:13Z,"Dunki Title Annoucement Reaction, Shah Rukh Khan, Dunki Boycott Kyu? What is Donkey Fighting",https://www.youtube.com/watch?v=axu6PavHqdc,"Dunki Title Annoucement Reaction, Shah Rukh Khan, Dunki Boycott Kyu? What is Donkey Fighting Dunki,Dunki shah rukh khan ...",UC4mXkTC36RDayzpN1hVlRaA,Movie Shuvie (Positivity Zinda Hai!)
1454,84.0,HT9rmrIe0pU,2022-04-19T12:29:41Z,"Dunki Announcement, SRK",https://www.youtube.com/watch?v=HT9rmrIe0pU,,UCfonH1HlmzQ7G8tLbfLjJug,Cine Hatke
1455,85.0,Vn6HPJOaqGo,2022-07-14T06:24:38Z,"Dunki - Official Teaser News | Shah Rukh Khan, Taapsee Pannu, Boman Irani | Rajkumar Hirani",https://www.youtube.com/watch?v=Vn6HPJOaqGo,Welcome to the another Video of 'Bollywood Rozana' If you Liked the Video Please Share our Valuable Comments on this Video.,UCPw2q4BmNXC5xHhcd3YAMrg,Bollywood Rozana
1456,86.0,WXIewCMep64,2013-12-14T05:52:25Z,Dunk Souls,https://www.youtube.com/watch?v=WXIewCMep64,Soul'd.,UCsvn_Po0SmunchJYOWpOxMg,videogamedunkey
1457,87.0,aaLiLRVeaZA,2019-11-10T18:00:00Z,Metal Gear Solid Explained,https://www.youtube.com/watch?v=aaLiLRVeaZA,It's actually very simple. dunk store https://dunkeyscastle.com/,UCsvn_Po0SmunchJYOWpOxMg,videogamedunkey
1458,88.0,wPXTlLdLrZI,2020-11-25T05:03:29Z,Japan&#39;s Biggest Discount Store: DON QUIJOTE уГЙуГ│уВн | JAPANESE STORE TOURS,https://www.youtube.com/watch?v=wPXTlLdLrZI,"This is a 1-hour tour inside of a Don Quijote, which is a discount chain store in Japan. Don Quijote (уГЙуГ│уГ╗уВнуГЫуГ╝уГЖ) is usually ...",UCAQLIhgbZGo1GgyONrKHuWw,Cory May
1459,89.0,SaBZwFkDZ70,2019-01-17T22:58:11Z,El verdadero origen de Dunkin Donuts,https://www.youtube.com/watch?v=SaBZwFkDZ70,"Hola amigos! ┬┐Sab├нas del origen de uno de los grandes de la comida r├бpida? Dunkin Donuts no solo tiene deliciosas rosquillas, ...",UCgltr7AvpfGf-sEnIdBKZXQ,Upsocl
1460,90.0,YzGVuNbqV3g,2022-08-27T06:30:04Z,рдбрд┐рдЯреЗрдХреНрдЯрд┐рд╡ рдбреЛрдВрдХреА | Detective Donkey in Hindi | @HindiFairyTales,https://www.youtube.com/watch?v=YzGVuNbqV3g,рдбрд┐рдЯреЗрдХреНрдЯрд┐рд╡ рдбреЛрдВрдХреА | Detective Donkey in Hindi | Kahani | Fairy Tales in Hindi | @HindiFairyTales тШЖ SUBSCRIBE us ...,UCsyoNsqE37tZIkuvqVPTa7g,Hindi Fairy Tales
1461,91.0,PZSYZKvrKVk,2022-06-22T09:30:11Z,Shahrukh Khan Upcoming Movie | Dunki | Pathaan | #shorts,https://www.youtube.com/watch?v=PZSYZKvrKVk,Shahrukh Khan Upcoming Movie | Dunki | Pathaan | #shorts I hope you're useful content I am very excited and comment down ...,UC98-eex-S9K8SSAGX8F7Smg,JASEEM FACTS
1462,92.0,oAdIGcNCaus,2022-07-12T10:50:06Z,Dunki | trailer review | Shah Rukh Khan | Rajkumar Hirani | review by ravi,https://www.youtube.com/watch?v=oAdIGcNCaus,Dunki dunki announcement dunki srk Shahrukh khan shah rukh khan rajkumar hirani films srk new film 2023 dunki trailer dunki ...,UC7mhEyrX61EzoperL1iYaiw,THE MOVIE REVIEWER
1463,93.0,xWaaMV1WQLo,2020-05-26T21:00:26Z,Best Of INCREDIBLE Kids Dunk Contest Moments,https://www.youtube.com/watch?v=xWaaMV1WQLo,Check out the BEST kids dunk contest moments from over the years! Drop your favorite one in the comments! Subscribe to the ...,UCWJ2lWNubArHWmf3FIHbfcQ,NBA
1464,94.0,RxScSdSXErM,2022-04-20T06:57:10Z,Dunki | Title Announcement Reaction | By 3 Idiots Of Mumbai | Bade Miyan Chote Miyan CLASH | SRK,https://www.youtube.com/watch?v=RxScSdSXErM,DunkiTitleAnnouncement #DunkiMovieAnnouncement #ShahRukhKhan Dunki Movie Title Announcement Video Teaser Trailer ...,UCjJV9QfAYC4Zusg8v5oTmvg,Bollywood Premee
1465,95.0,hi74dn8I7_g,2022-04-20T03:30:15Z,DUNKI Title Announcement - Reaction! | Shah Rukh Khan | Taapsee Pannu | Rajkumar Hirani,https://www.youtube.com/watch?v=hi74dn8I7_g,Reaction Gear: https://amzn.to/2QgTwk2 (affiliate link). Intro music by DAVIS Youtube - http://bit.ly/30OK7RR Spotify ...,UCwV_A5L1hhEVfld6Wbxn3jg,CineDesi
1466,96.0,__zGnZtL53Q,2016-02-04T20:30:00Z,Dunkuza 3,https://www.youtube.com/watch?v=__zGnZtL53Q,Rated R for Guns. featuring https://www.youtube.com/Edmantium.,UCsvn_Po0SmunchJYOWpOxMg,videogamedunkey
1467,97.0,eQ5jinengH0,2023-01-08T14:20:56Z,"Shahrukh Khan&#39;s Movies Budget Will SHOCK You ЁЯШ▒ Pathaan, Jawan &amp; Dunki",https://www.youtube.com/watch?v=eQ5jinengH0,"Shahrukh Khan's Movies Budget Will SHOCK You Pathaan, Jawan & Dunki #shahrukhkhan #pathaan #jawan #dunki ...",UCeEke72xNJOOZRrN4JWB0_A,Honest Bollywood
1468,98.0,uwI9qmu4A5k,2022-08-15T17:00:30Z,Dunkuza Kiwami,https://www.youtube.com/watch?v=uwI9qmu4A5k,Big big spoilers alert even though you won't read this and will get mad anyway. donkey store https://dunkeyscastle.com/ donkey ...,UCsvn_Po0SmunchJYOWpOxMg,videogamedunkey
1469,100.0,QySjGUMZdTM,2022-10-18T16:32:49Z,How Drinks Helped Dunkin&#39; Become a $9 Billion Empire | The Economics Of | WSJ,https://www.youtube.com/watch?v=QySjGUMZdTM,Dunkin' started out as a small doughnut-and-coffee shop in Massachusetts in 1948 and has grown to over 12000 stores in 40 ...,UCK7tptUDHh-RYDsdxO1-5QQ,Wall Street Journal
1470,101.0,fPX0C-g5xpU,2022-06-03T08:30:04Z,JAWAN | Title Announcement | Shah Rukh Khan | Atlee Kumar | 02 JUNE 2023,https://www.youtube.com/watch?v=fPX0C-g5xpU,Red Chillies Entertainment presents Shah Rukh Khan in and as #JAWAN An Atlee film Red Chillies Entertainment announces ...,UCjJKg01HAP01xCLVhDmnLhw,Red Chillies Entertainment
1471,102.0,fv0KbiUyqNI,2021-02-06T11:00:14Z,We OPENED A DUNKIN DONUTS In Our House!! **YUM** | JKREW,https://www.youtube.com/watch?v=fv0KbiUyqNI,We turned our HOUSE into a Dunkin' Donuts drive thru! Everyone knows we already opened up a McDonalds and Starbucks in ...,UCDOK9vaq3FN2rOhfUiZvNuw,JKrew
1472,103.0,Vd-Ls1uJEG8,2022-10-15T11:55:16Z,Dunki New Actor Join GurpreetGhuggi with SRK #shorts,https://www.youtube.com/watch?v=Vd-Ls1uJEG8,,UCTpJ4ZL_Cogq2mUNLj4YZHg,Filmy imran Ali
1473,104.0,6i3PdffHW8A,2022-12-18T16:42:47Z,Bade Miyan Chote Miyan vs Dunki - Kon H Jyada Powerfull..? |Dunki Vs BMCM#akshay#srk,https://www.youtube.com/watch?v=6i3PdffHW8A,"Bade Miyan Chote Miyan vs Dunki - Kon H Jyada Powerfull..? |Dunki Vs BMCM#akshay#srk Bade Miyan Chote Miyan, Akshay ...",UCh-1ZDeOXCzoKhAKM7swFvQ,Haq Se Review
1474,105.0,7uirnCbEMsc,2021-02-11T18:00:13Z,(NR) Tzgwala x YA x Lucii - Dunkin Donuts (Music Video) Prod. By SvOnTheBeat | Pressplay,https://www.youtube.com/watch?v=7uirnCbEMsc,PRESSPLAY The First Drill Album | Out Now!! https://empire.ffm.to/firstdrill SUBSCRIBE NOW: https://goo.gl/OtAv6E FACEBOOK: ...,UCwxK6Ba2IzJXw8gW2ZPjHSw,Pressplay Media
1475,106.0,M4YUJhtimLo,2022-09-23T20:22:03Z,USA Dunki in panama jungle ЁЯдгЁЯдг #shorts #dunki #donkey #usadonkey #usa #funny #america #mexico #dunkey,https://www.youtube.com/watch?v=M4YUJhtimLo,,UC5Ke3jctXOT2k0sgBcYUzyA,Shourya Syal
1476,107.0,nb1zZ5tVHDk,2023-02-03T11:20:21Z,dunki trailer shahrukh khan | dhunki trailer | dunki trailer srk #shorts  #viral #dunki #srk,https://www.youtube.com/watch?v=nb1zZ5tVHDk,dunki trailer shahrukh khan | dhunki trailer | dunki trailer srk | dunki t shahrukh khan #dunki #srk Jawan Box Office 1000Cr | Dunki ...,UCuy7d0VBjRqj0rVTFDDbnxQ,Filmi Fever
1477,108.0,MWNPKzEcboE,2022-10-19T13:40:26Z,Career рдЦрддрдо Shah Rukh Khan | Pathaan Movie | Jawan Movie| Dunki Movie Srk | Shahrukh khan | #shorts,https://www.youtube.com/watch?v=MWNPKzEcboE,"shah rukh khan, shah rukh khan songs, shah rukh khan movies, shah rukh khan brahmastra, shah rukh khan interview, shah rukh ...",UC06KDDbkbvOpH-hve4uUQRw,Crazy Sick
1478,109.0,SZUlKmk-wBI,2022-04-26T17:50:00Z,Dunki | Title Announcement | Shah Rukh Khan | Taapsee Pannu | Rajkumar Hirani | PAKISTAN REACTION,https://www.youtube.com/watch?v=SZUlKmk-wBI,"Dunki | Title Announcement | Shah Rukh Khan | Taapsee Pannu | Rajkumar Hirani | 22 Dec 23 PAKISTAN REACTION Dunki, ...",UCBh30NFGt4uXbzNMnqfYU0Q,Namkeen Sach
1479,110.0,j5RWzXp1Puk,2010-09-01T09:03:57Z,Wonky Donkey Vid,https://www.youtube.com/watch?v=j5RWzXp1Puk,,UCEqLYpD2W7XwDxbFnvyEmoQ,Munro Media
1480,111.0,mcN9mmQxK2A,2022-04-19T15:54:55Z,Shah Rukh Khan Announces His Next. &#39;Dunki&#39; To Release in December 2023,https://www.youtube.com/watch?v=mcN9mmQxK2A,"Shah Rukh Khan announced his next, which will release on December 22, 2023. Dunki will be directed by Rajkumar Hirani and ...",UCZFMm1mMw0F81Z37aaEzTUA,NDTV
1481,112.0,9sG8ennun6g,2022-05-22T13:10:13Z,Dunki kya hai ? What is Dunki ? @learnwithshrey2412,https://www.youtube.com/watch?v=9sG8ennun6g,Dunki #Dunki fly #Dunki fly to America #illegalimmigration #dangerous fly рдбрдВрдХреА рдлреНрд▓рд╛рдИ рдЯреВ рдЕрдореЗрд░рд┐рдХрд╛ #dunki flight ...,UCPBb9_pzxkTMP_frN76Nu0g,Learn with Shrey
1482,113.0,_DCsrRmQGTQ,2022-05-30T16:30:08Z,The Legend of Zelda : Link&#39;s Awakening (dunkview),https://www.youtube.com/watch?v=_DCsrRmQGTQ,And that's the bottom line because that's what Stone Cold said. donkey store https://dunkeyscastle.com/ donkey twitch ...,UCsvn_Po0SmunchJYOWpOxMg,videogamedunkey
1483,114.0,RRDMdVkoL1A,2022-04-19T14:19:34Z,SHAH RUKH KHAN vs AKSHAY KUMAR &amp; TIGER SHROFF | DUNKI vs BADE MIYAN CHOTE MIYAN | CHRISTMAS 2023 |,https://www.youtube.com/watch?v=RRDMdVkoL1A,,UCUadC_zUyXiKhMMzAQY66vg,Aamir Ansari
1484,115.0,kyadkLznN-U,2022-02-12T09:33:02Z,Aaja Mexico Challiye | Official Trailer | Ammy Virk | Thind Motion Films | Releasing 25th Feb 2022,https://www.youtube.com/watch?v=kyadkLznN-U,"Ammy Virk Productions and Thind Motion films present you the Official Trailer of ""Aaja Mexico Challiye"" going to release ...",UCmSHlTXTeRBhkAKQTC7wPXA,Burfi Music
1485,116.0,Q38fjcyP1IQ,2022-02-24T20:00:06Z,Horizon Forbidden Game,https://www.youtube.com/watch?v=Q38fjcyP1IQ,"How you gonna name the main character after a metal made by combining two or more metallic elements, especially to give ...",UCsvn_Po0SmunchJYOWpOxMg,videogamedunkey
1486,117.0,8fu9Co8GBW8,2022-01-30T14:47:32Z,Dunkey New Route for Europe| Europe Dunkey 2022| Dunki for Europe| Europe ki Danki|,https://www.youtube.com/watch?v=8fu9Co8GBW8,in this video you will know about Dunkey New Route for Europe| Europe Dunkey 2022| Dunki for Europe| #europe ...,UCc8bq39_XVMJ4MJ7pRKtbkQ,RTF Travel System 
1487,118.0,IYQMDexlYek,2022-04-27T12:47:06Z,DUNKI N BMCM ....BIG CLASH,https://www.youtube.com/watch?v=IYQMDexlYek,,UC8LHaSZjNRgYc8YsPLzy7tA,Bobby Bhai The Matinee Idol
1488,119.0,d97XsNAvKAo,2020-03-30T22:15:00Z,Nioh 2 Fun Game,https://www.youtube.com/watch?v=d97XsNAvKAo,Make it stop. Go to https://buyraycon.com/Dunkey for 15% off your order! Brought to you by Raycon.,UCsvn_Po0SmunchJYOWpOxMg,videogamedunkey
1489,120.0,q6yHoSvrTss,2015-03-12T19:30:01Z,Ultimate Skyrim,https://www.youtube.com/watch?v=q6yHoSvrTss,Dedicated to Bogan the Majestic. High Lord of the Brogan Isles.,UCsvn_Po0SmunchJYOWpOxMg,videogamedunkey
1490,121.0,GScLQwe1ydc,2020-04-25T15:00:10Z,Convert├н mi CASA en un DUNKIN DONUTS - Mimi Land reto extremo,https://www.youtube.com/watch?v=GScLQwe1ydc,Convert├н mi CASA en un DUNKIN DONUTS - Mimi Land reto extremo. Como les ha gustado tanto los videos de pedir comida ...,UCEGDmibN9Dv5Lr3dKNEiWfQ,Mimi Land
1491,122.0,gbsZohEMn38,2018-08-31T03:07:50Z,The Wonky Donkey,https://www.youtube.com/watch?v=gbsZohEMn38,"For licensing or usage, contact licensing@viralhog.com) Buy the book here - https://amzn.to/3BulTjI Affiliate link disclosure ...",UC2nrfcuuGwXDrEA14wDqILg,The Scottish Granny
1492,123.0,gxZ9aARaACU,2022-08-27T11:00:22Z,El Detective Donkey | Detective Donkey in Spanish | @SpanishFairyTales,https://www.youtube.com/watch?v=gxZ9aARaACU,El Detective Donkey | Detective Donkey in Spanish | @SpanishFairyTales тЦ╗ Parental guidance: Some material of this video may ...,UCY0TNnnoZMapIQ3cXv1M1rg,Spanish Fairy Tales
1493,124.0,vj7VveXmM68,2021-10-18T20:22:08Z,WE OPENED A DUNKIN in our HOUSE to Catch a LIAR,https://www.youtube.com/watch?v=vj7VveXmM68,"We opened a real dunkin in our house to catch a liar ghost. It all started when Rebecca Zamolo created ""KIDS Turn Into ADULTS ...",UCX-EPC5_NsFmRFkfzTFaP9Q,Game Master Network
1494,125.0,0tkJDb0eX64,2023-01-25T18:00:00Z,сКасИнсЙе сКисИЭсИ╜сЙ▒ 3 сИ░сКасЙ╡ сЛнсМасЙесЙБсКХ @comedianeshetu #children #mensud #dinklejoch #ethiopian,https://www.youtube.com/watch?v=0tkJDb0eX64,"Comedian Eshetu Believes Parents Should Be Very Careful About What They Speak, Hear And Do IN Front Of Their children.",UCqGE-jrAMzhipIWivRsaI5A,Donkey Tube
1495,126.0,m5P24B-s7ks,2021-08-28T01:00:07Z,Dunkey Leaks Donda,https://www.youtube.com/watch?v=m5P24B-s7ks,You didn't hear it from me. donkey store https://dunkeyscastle.com/ donkey twitter https://twitter.com/vgdunkey donkey twitch ...,UCsvn_Po0SmunchJYOWpOxMg,videogamedunkey
1496,127.0,WChk1_O8osY,2022-06-01T10:11:02Z,Dunki || vyom Skeleton || Donkey Se Romance @shah rukh Khan roasting   || Dunki trailer roasting ЁЯР┤ЁЯР┤ЁЯР┤,https://www.youtube.com/watch?v=WChk1_O8osY,Donkey || vyom Skeleton || Donkey Se Romance @shah rukh Khan roasting @ dunki roasting || Dunki trailer #vyomskeleton ...,UCR1qirx0wdZkQbRZCvtpgmw,Vyom Skeleton
1497,128.0,S_OcotuY8-s,2022-04-28T04:00:08Z,Pathaan &amp; Dunki Announcement | Shah Rukh Khan | German Reaction,https://www.youtube.com/watch?v=S_OcotuY8-s,"Presenting my reaction to the date announcement of Pathaan starring Shah Rukh Khan, Deepika Padukone and John Abraham ...",UCHA5J_m9-1HnmKjSrTzeejw,Miss Real Bolly
1498,129.0,h1fiPIhGXYA,2012-06-09T03:34:35Z,Humpty Dumpty - 3D Animation English Nursery Rhyme songs For Children with Lyrics,https://www.youtube.com/watch?v=h1fiPIhGXYA,"Humpty Dumpty - 3D Animation English Nursery Rhyme songs For Children. Lyrics: Humpty Dumpty Sat on a wall, Humpty ...",UCsPF3cApzCohxPp5oKdoWSQ,CVS 3D Rhymes & Kids Songs
1499,130.0,PuSkiaqRmP4,2023-01-18T02:46:23Z,Pushpa 2 vs Dunki #shorts #srk #alluarjun #pushpa2 #dunki #pathan,https://www.youtube.com/watch?v=PuSkiaqRmP4,dunki shorts shahrukh khan pushpa 2 pathan allu arjun srk trending dunki official trailer jawan dunki trailer dunki movie trailer ...,UC6AMR7HU1DdMPhRorKxGq5g,FILMYMINE_07
1500,131.0,P3ZhthFG3y8,2022-12-07T13:13:14Z,5 Upcoming movies of Shahrukh khan #jawan #pathaan #dunki,https://www.youtube.com/watch?v=P3ZhthFG3y8,,UCUexKzx-mNfZSsi5mgDLYlg,Movily
1501,132.0,ywABkdOX8kk,2022-01-28T03:35:11Z,How To Properly Make Dunkin Donuts Coffee,https://www.youtube.com/watch?v=ywABkdOX8kk,Purchase Here: https://amzn.to/3rUjgCc Affiliate link.,UC8dDHNEA21ehG6qr2mBX--w,Samsung Delivered
1502,133.0,FaJSCq__1hA,2023-02-06T02:00:21Z,Dunki movie update 2023 | sarukhKhan | a rajkumar Hirani film | #sarukhkhan #dunki #update,https://www.youtube.com/watch?v=FaJSCq__1hA,"dunki,dunki trailer,dunki teaser,dunki srk,dunki announcement,dunki 2023,dunki first look,dunki official trailer,dunki movie trailer ...",UCMvcQ-5QxUc8Z6n72bL5KsQ,Harish RAWAT
1503,134.0,A1rgCQLmBVM,2022-04-19T11:11:37Z,SRK RAJU HIRANI DUNKI ANNOUNCEMENT REACTION,https://www.youtube.com/watch?v=A1rgCQLmBVM,DunkiTitleAnnouncement #srk #rajkumar hirani.,UCnI-30_0olZdR4wjwjFb_3g,Sahil Ahmed Khan
1504,135.0,Z8qphplzk-c,2023-01-05T02:30:09Z,Dunki VS Tiger 3 Comparison #shorts #bollywood #salmankhan #sharukhkhan #ytshorts #short,https://www.youtube.com/watch?v=Z8qphplzk-c,Dunki VS Tiger 3 Comparison #shorts #bollywood #salmankhan #sharukhkhan #ytshorts #short Dunki Box office collection Tiger ...,UCtFkV-2suOfv-musmmxlIPQ,Filmi Anil
1505,136.0,KuvDsT4sRzU,2021-12-01T20:30:03Z,Donkey Kong December,https://www.youtube.com/watch?v=KuvDsT4sRzU,Get ready for an entire month of Donkey Kong uploads. donkey store https://dunkeyscastle.com/ donkey twitter ...,UCsvn_Po0SmunchJYOWpOxMg,videogamedunkey
1506,137.0,o99la6YqjvU,2022-05-10T06:00:51Z,Shahrukh Khan Ki DUNKI Movie Ka Matlab Kya Hai ? ~ Random BOB #Shorts,https://www.youtube.com/watch?v=o99la6YqjvU,,UC3MhDC0IgN0UvmapdjdoGIw,Random BOB
1507,138.0,QN29kI4UeJ4,2022-04-20T14:04:44Z,DUNKI story n meaning explained! Pathaan Shahrukh Khan upcoming Blockbuster film details ! Story out,https://www.youtube.com/watch?v=QN29kI4UeJ4,Dunki #ShahRukhKhan #RajKumarHirani #TaapseePannu ShahRukh Khan film Dunki produced by Rajkumar Hirani and Gauri ...,UC2RTDBpBkHNX6G0fFFp65hA,Telly Khazana
1508,139.0,48W2FYQ5svY,2022-10-06T12:31:12Z,NEW MOVIE OF SRK AND RAJUHIRANI &#39;DUNKI&#39; IS REMAKE #srk #remake #shorts,https://www.youtube.com/watch?v=48W2FYQ5svY,,UCR0VuuR9zRvDiT51Gtlhz5A,Surprises Ahead
