,Unnamed: 0,videoId,publishedDate,title,videoUrl,description,channelId,channelTitle
961,151.0,ozIc_kagCCw,2023-01-27T02:00:28Z,India ЁЯЗоЁЯЗ│ To USA ЁЯЗ║ЁЯЗ╕ | Part 13 | Panama ЁЯЗ╡ЁЯЗж Jungle Ki Tyaari Hogyi ЁЯЩВ| USA ЁЯЗ║ЁЯЗ╕ Donkey |,https://www.youtube.com/watch?v=ozIc_kagCCw,Jai Mata Di America #usa     #usa #america #trending #reels #reelitfeelit #trend #explore #explorepage #usa     ...,UC1X4PBVhNsyavmtdy2XOZFA,Ankush Malik Vlogs
962,158.0,G3miXVzprok,2021-12-11T12:19:05Z,India To USA ЁЯЗ║ЁЯЗ╕ Donkey Update Good News ЁЯЗ║ЁЯЗ╕ | western punjab,https://www.youtube.com/watch?v=G3miXVzprok,usa #mexico #donkey #barzil.,UC7F7msJkNzOD415ENYrPilw,western punjab
963,162.0,ArHzWbx77vk,2022-11-28T12:00:05Z,USA DONKEY ЁЯЗ║ЁЯЗ▓ VIDEO || BRAZIL TO RIO BRANCO MEXICO BORDER CROSSING TO USA DONKEY #trending,https://www.youtube.com/watch?v=ArHzWbx77vk,USA DONKEY VIDEO || BRAZIL TO RIO BRANCO MEXICO BORDER CROSSING TO USA DONKEY #trending 2 Numabri ...,UCtLr-VlUjuxh4zUQA6pu_zg,2 Numbari USA Wala
964,163.0,lf0T1ZSQqv0,2022-11-28T00:42:41Z,USA DONKEY I INDIA TO USA I #shorts,https://www.youtube.com/watch?v=lf0T1ZSQqv0,shorts #usadonkey #freevisaadvisor #indiatousa USA Donkey I India to USA I #shorts Free Visa Advisor don't promote illegals ...,UC4mifYMs39uMhHSBeP64dCg,Free Visa Advisor
965,167.0,ZNwIIaXG1X0,2022-10-16T05:10:35Z,Amerika Donkey | USA Donkey | India To USA Donkey 2022 #usadonkey,https://www.youtube.com/watch?v=ZNwIIaXG1X0,USA Donkey | India To USA Donkey 2022 #usadonkey #usadonkey2022 #amerikadonkey #yourimmigrationchannel Full Details ...,UCp9cJSP1E9QGI24QKQFkRcw,Your Immigration Channel
966,168.0,CDJd1V8naQY,2021-09-14T09:03:49Z,INDIA TO AMERICA 2NO | AMERICA DONKEY #shorts #trending #usa #virel #funny #trending,https://www.youtube.com/watch?v=CDJd1V8naQY,,UCppBxJlCJO4mFiPY-dUa1pA,Tanuj Jangra
967,169.0,At1AAx1uVSM,2022-05-22T19:50:09Z,USA Pankaj Narwal America wale bhai ne America jaane ka Sahi Tarika Bataya India to USA donkey,https://www.youtube.com/watch?v=At1AAx1uVSM,"рдЬрдВрдЧрд▓реЛрдВ рдХреЗ рд░рд╛рд╕реНрддреЗ рдЧрдпрд╛ рдерд╛ рдЕрдореЗрд░рд┐рдХрд╛, рдХреИрд╕реЗ рдмрдЪрдХреЗ рд╡рд╛рдкрд┐рд╕ рдЖрдпрд╛ рд╣рд░ рдмрд╛рдд рдмрддрд╛рдИ, рдЖрдк ...",UClbpwhVGcCXVol2i5hZNGnA,Haryana AaleЁЯТк
968,170.0,24cHGK8Loo4,2021-01-25T14:15:01Z,How Indians Bangladeshi Pakistanis Enter USA From Bolivia Through Mexico Illegally. DONT DO THIS.,https://www.youtube.com/watch?v=24cHGK8Loo4,I was 15 Days in The Capital of Bolivia La PAZ when I meet few Pakistanis and Bangladeshis in a Supermarket and In A ...,UCpn2TLtZwefGrJXcgk3BL9Q,EXPLORER RAJA
969,171.0,HVN9HsV_9I8,2022-07-09T14:01:12Z,рдЕрдореЗрд░рд┐рдХрд╛ рдЬрд╛рдиреЗ рдХреЗ рд▓рд┐рдП AGENT рдХрд╣рд╛ рдорд┐рд▓реЗрдЧрд╛ ?,https://www.youtube.com/watch?v=HVN9HsV_9I8,"I am Shubham Tyagi , USA returned Software engineer. I am a Senior software engineer by profession but YouTuber by passion.",UCH8NckJGxrTpZlR6fHvSSJw,SoftBeast
970,172.0,cIeQjL7Uskw,2022-05-22T04:00:11Z,Portugal to usa visa or donkey || full information || punjabi portugal || donkey or tourist visa ||,https://www.youtube.com/watch?v=cIeQjL7Uskw,portugalimmigration #portugaltousa #usadonkey #harryprincezira #america #americantrucksimulator To contact me Instagram ...,UCN2NOlepC1ZiDGFSgJGgqaw,Punjab 47 Harry
971,173.0,Ep1jFiVoLjw,2021-03-22T13:33:08Z,New information #USA #Donkey Europe visa #Portugal #TRC,https://www.youtube.com/watch?v=Ep1jFiVoLjw,New information USA Donkey Europe visa Portugal TRC mexico travel visa.,UCjj9Rtf2GquenO-LX0Wkd1w,Hello india
972,174.0,hEbaSPNnO_g,2022-01-26T05:45:00Z,ЁЯзНтАНтЩВя╕П Visa Agent in Pakistan India | DONKEY FLIGHTS --- UK USA CANADA EUROPE,https://www.youtube.com/watch?v=hEbaSPNnO_g,Visa Agent in Pakistan India | DONKEY FLIGHTS --- UK USA CANADA EUROPE #donkey #DONKEYFLIGHTS #VisaAgent ...,UCEFJ74BQdQ7kGHXX2D8nfRA,Teach visa Punjabi
973,175.0,E4Mr-yeOnvA,2023-01-25T04:28:29Z,India to usa Donkey ЁЯШ▒ЁЯШ▒ #trending  #usadonkey #india #trendingvideo #shortsvideo,https://www.youtube.com/watch?v=E4Mr-yeOnvA,India to usa Donkey India to America #india to Dubai India to uk India to Africa #india #donkey #jungle #dubai #uk #portugal ...,UCrWMPeLwcw6GJcclfWZPXpw,AZ Pardeep
974,176.0,hg12mdeKgkU,2022-11-16T01:45:16Z,America Donkey Via Sea I India to USA I #shorts,https://www.youtube.com/watch?v=hg12mdeKgkU,usadonkey #usadonkey2022 #freevisaadvisor #shorts America Donkey Via Sea I India to USA I #shorts Free Visa Advisor don't ...,UC4mifYMs39uMhHSBeP64dCg,Free Visa Advisor
975,177.0,w8Lm8LPMSWI,2022-09-09T07:43:17Z,USA Donkey Update 2023 | USA Illegal Entry Punjabi | US10 Years Visa without Documents\US TO CANADA.,https://www.youtube.com/watch?v=w8Lm8LPMSWI,USA Donkey Update 2023 | USA Illegal Entry Punjabi | US10 Years Visa without Documents\US TO CANADA. 2022-23.,UCEFJ74BQdQ7kGHXX2D8nfRA,Teach visa Punjabi
976,178.0,VGiLob0gNSM,2023-02-05T05:25:55Z,Title 42 US | Usa Mexico Donkey | USA Mexico Border Update | India To USA Donkey#usadonkey#mexico#us,https://www.youtube.com/watch?v=VGiLob0gNSM,My channel:-https://www.youtube.com/channel/UCn7K... Press The BELL ICON For Get Next Video Information. For Daily Live ...,UCn7KrefotvouJeYXzwRBpfw,Rohit Backpacker
977,179.0,L5g58L4qbeM,2022-10-18T04:08:00Z,USA DONKEY | INDIA TO USA | INTERNATIONAL STUDENTS CANADA | MEXICO BORDER,https://www.youtube.com/watch?v=L5g58L4qbeM,,UCjH5UKrX0ZUfXv8d0IpAB-Q,Punjab Update
978,180.0,SzJhfhDM3H0,2022-12-10T04:42:56Z,India ЁЯЗоЁЯЗ│ se direct America ЁЯЗ║ЁЯЗ╕ ( USA ) Full details in this video @DonkeyAmericaki #donkey #trend,https://www.youtube.com/watch?v=SzJhfhDM3H0,India se direct America ( USA ) Full details in this video тАО@DonkeyAmericaki #donkey #trend donkey america america ...,UCgsSAyzq8dgIJ3FT8DEtGYQ,Donkey America ki
979,181.0,XTzECUR1fsc,2022-11-17T04:00:15Z,Why Indians cross US Mexico border? Donkey process Explained!!#usa #illegal  #dangerous #immigration,https://www.youtube.com/watch?v=XTzECUR1fsc,Why Indians cross US Mexico border? Donkey process Explained!! India se America ki donkey USA illegal kese ate hai / USA ...,UC6SQCkJ5oLbA_aQ-SEoCHRw,Vikas modi & family vlogs
980,182.0,Rgd0HRI-SgY,2022-11-23T02:02:42Z,USA Donkey I India to USA I Panama k Jungle I #shorts,https://www.youtube.com/watch?v=Rgd0HRI-SgY,shorts #usadonkey #freevisaadvisor #indiatousa USA Donkey I India to USA I Panama k Jungle I #shorts Free Visa Advisor don't ...,UC4mifYMs39uMhHSBeP64dCg,Free Visa Advisor
981,183.0,NAi5EgJw5ho,2016-02-05T00:38:43Z,Punjabi enters in USA Illegal | entry | Immigration | Tragic story | Donkey | Punjab Mail USA TV,https://www.youtube.com/watch?v=NAi5EgJw5ho,Punjab Mail USA TV Channel #IllegalUSAEntry #PunjabMailUSA #PunjabMailUSATV #GurjatinderRandhawa Subscribe to ...,UCRMVy1BLasZpueNKaV-TLkg,Punjab Mail USA TV
982,184.0,GtqQUBG9CPA,2022-01-07T10:51:51Z,usa donkey ЁЯЗ║ЁЯЗ╕ | India To Bahamas Visa | western Punjab,https://www.youtube.com/watch?v=GtqQUBG9CPA,usa #donkey #mexico #goodvibes #bahamas.,UC7F7msJkNzOD415ENYrPilw,western punjab
983,185.0,uxswvcbgrAg,2022-11-17T07:29:23Z,India to USA Donkey Route || USA Border Crossing,https://www.youtube.com/watch?v=uxswvcbgrAg,India sy America Donkey Ka Tarea #india #america #donkey.,UCYFn_5TvEdWJht1s7FpbK9A,WiT NiD
984,186.0,4X0wZXrffhs,2021-04-16T10:03:34Z,usa visa india to Europe and mexico by air тЬИя╕Пя╕Пnot donkey vg visa point spain to Mexico and BelgiumЁЯЗзЁЯЗк,https://www.youtube.com/watch?v=4X0wZXrffhs,usa #visa #mexico.,UC4AIjFOvCSN0-L0u4bkfFUg,VISA advisor
985,187.0,9nHm5Fv9_KI,2022-10-23T01:30:06Z,USA Donkey I india to usa donkey I #shorts,https://www.youtube.com/watch?v=9nHm5Fv9_KI,shorts #usadonkey #usadonkey2022 #usa #freevisaadvisor USA Donkey I india to usa donkey I #shorts Free Visa Advisor don't ...,UC4mifYMs39uMhHSBeP64dCg,Free Visa Advisor
986,188.0,a3smPlBgNEY,2022-12-15T12:28:57Z,Usa donkey or 40 lakh scholarship | рибрйМриВриХрйА ридрйЛриВ риорйБрй░рибри╛ риХри┐ри╡рйЗриВ римриЪри┐риЖ риири╛ри▓рйЗ риори┐ри▓ри┐риЖ ри╡рйАрйЫри╛ риири╛ри▓рйЗ 40 ри▓рй▒риЦ,https://www.youtube.com/watch?v=a3smPlBgNEY,Usa donkey or 40 lakh scholarship | рибрйМриВриХрйА ридрйЛриВ риорйБрй░рибри╛ риХри┐ри╡рйЗриВ римриЪри┐риЖ риири╛ри▓рйЗ риори┐ри▓ри┐риЖ ри╡рйАриЬри╝ри╛ риири╛ри▓рйЗ ...,UCSklZCssqrKL-qmuaWEVXAg,Gsingh vlogs
987,189.0,4iz_cavPWVE,2020-05-13T10:01:12Z,Brazil ki Donkey | India-Pakistan to Brazil || Punjabi in  Brazil,https://www.youtube.com/watch?v=4iz_cavPWVE,India-Pakistan to Brazil ki Donkey in Punjabi.Brazil to USA ki donkey.Brazil visa for Indian & Pakistani.Brazil ki Donkey ...,UCEFJ74BQdQ7kGHXX2D8nfRA,Teach visa Punjabi
988,190.0,Aow6HMUEB-4,2022-03-03T14:25:11Z,рдХреИрд╕реЗ рдЬрд╛рддреЗ рд╣реИ рджреАрд╡рд╛рд░ рдХреВрдж рдХреЗ рдЕрдорд░реАрдХрд╛ ред India to USA donkey | Gaurav Maan,https://www.youtube.com/watch?v=Aow6HMUEB-4,рднрд╛рд░рдд рд╕реЗ рдЕрдореЗрд░рд┐рдХрд╛ рдЬрд╛рдиреЗ рдХреЗ рд▓рд┐рдП рдмрдЪреНрдЪреЗ рдбреЛрдВрдХреА рдХрд╛ рд╕рд╣рд╛рд░рд╛ рд▓реЗрддреЗ рд╣реИрдВ рдкрд░ рдЗрд╕ рдбрдВрдХреА ...,UCp9ABGKxojZ9MIpCurKFXCQ,Gaurav Maan
989,191.0,FDZIqPQbyvg,2022-10-17T10:30:03Z,USA Border Donkey | India To USA | USA Truck Driver,https://www.youtube.com/watch?v=FDZIqPQbyvg,,UCjH5UKrX0ZUfXv8d0IpAB-Q,Punjab Update
990,192.0,jv8h347Ojyc,2022-02-11T02:30:25Z,El Salvador visa for Indians | Donkey Route To USA from india,https://www.youtube.com/watch?v=jv8h347Ojyc,"el salvador, el salvador visa, india to el salvador, central america, el salvador visa not required, san salvador, el salvador visa free ...",UC-CBQChrXvLzYc9oxpMfFPg,Naa Anveshana
991,193.0,skLQWjXBoDE,2022-11-04T01:30:09Z,USA Donkey I India to USA donkey I #shorts #part2 #yt20 #ytshorts,https://www.youtube.com/watch?v=skLQWjXBoDE,shorts #usadonkey #usadonkey2022 #usa #freevisaadvisor USA Donkey I India to USA donkey I #shorts #part2 Free Visa Advisor ...,UC4mifYMs39uMhHSBeP64dCg,Free Visa Advisor
992,194.0,N2xEPQyLALc,2021-11-10T05:16:25Z,ЁЯЗ║ЁЯЗ╕ USA Donkey Real Video Border Crossing 2022 Mexico Donkey Punjabi USA DONKEY Aaja Mexico Challiye,https://www.youtube.com/watch?v=N2xEPQyLALc,,UCUeGW7O1qzL_mN7fO8XNXGg,Pendu In England
993,195.0,CUk_GCVJGPg,2022-10-19T02:23:35Z,#donkey vidio#hungry city#going spain #donkey #india ta usa wala bhai# sport karo bhaiyo,https://www.youtube.com/watch?v=CUk_GCVJGPg,,UCKiog0ropxCNdCdXk9Yev3w,india to usa wala bhai
994,196.0,UbEeWBD6OY8,2022-09-26T01:10:00Z,usa donkey I india to usa I #shorts,https://www.youtube.com/watch?v=UbEeWBD6OY8,shorts #usvisa #usdonkey #usdonki #freevisaadvisor usa donkey I india to usa I #shorts My other Youtube Channel for : Shorts ...,UC4mifYMs39uMhHSBeP64dCg,Free Visa Advisor
995,197.0,XSiQ076ylwg,2018-12-11T02:48:50Z,USA||риЕриори░рйАриХри╛ Donkey рижри╛ риЕри╕ри▓ ри╕рй▒риЪ риХрйА ри╣рйИ ЁЯСЙриори╛рилрйАриЖриВ ридрйЛриВ риХри┐риЙ рибри░рижрйЗ риирйЗ рикрй░риЬри╛римрйАЁЯШв2019,https://www.youtube.com/watch?v=XSiQ076ylwg,"Copyright Disclaimer Under Section 107 of the Copyright Act 1976, allowance is made for ""fair use"" for purposes such as criticism, ...",UCiCiyw4RnMBl7ti41GzJqHA,Love Forever
996,198.0,95w9wZaOUZo,2022-12-26T11:51:49Z,INDIA ЁЯЗоЁЯЗ│ TO USA ЁЯЗ║ЁЯЗ╕ DONKEY | USA рдХреА рджреАрд╡рд╛рд░ рдХреВрджрдиреЗ рдХреЗ рдмрд╛рдж рдХреНрдпрд╛ рд╣реЛрддрд╛ рд╣реИ | USA Donkey Full Details,https://www.youtube.com/watch?v=95w9wZaOUZo,americadonkey #usadonkey #usadiwarkudnekebad INDIA TO USA DONKEY | USA рдХреА рджреАрд╡рд╛рд░ рдХреВрджрдиреЗ рдХреЗ ...,UCp9cJSP1E9QGI24QKQFkRcw,Your Immigration Channel
997,199.0,Q31K8s0CrI0,2019-04-26T08:01:51Z,|| India To USA Donkey 2019 ||,https://www.youtube.com/watch?v=Q31K8s0CrI0,"India to usa donkey | Plz subscribe my channel, Thanks for watching video, My Copyright Disclaimer: Copyright Disclaimer Under ...",UCdVTy3JQ5oTCw_49HTS_vUw,Knowledge 360
998,200.0,yqYJAmpm5TI,2018-08-07T17:39:02Z,Never Ever Use Donkey Flight For Illegal Immigration,https://www.youtube.com/watch?v=yqYJAmpm5TI,"Guys never ever take donkey flight to fulfil your abroad dream, there could be very bad circumstances when you take donkey flight ...",UCy7XGBPyMLP-h6rZ4pr5EeQ,Mission Abroad
999,201.0,4ZzCN6UqKfI,2023-02-06T04:44:44Z,#2numabri #haryanaale #india #jind #jind #punam #usa #donkey #america #haryana,https://www.youtube.com/watch?v=4ZzCN6UqKfI,Insta= honeymaan05 Insta=rishideswal USA рдореЗрдВ рдХрд╛рдо рдХреНрдпреЛрдВ рдирд╣реАрдВ рдорд┐рд▓ рд░рд╣рд╛ рдХреИрд╕реЗ рдорд┐рд▓реЗрдЧрд╛ ...,UCbxP5ppeghypksQtdbMSzog,Deswal & Maan
1000,202.0,-_ae4Vds3Zc,2022-08-03T10:32:52Z,USA DONKEY || 2022 || India to usa,https://www.youtube.com/watch?v=-_ae4Vds3Zc,,UCaKNxU0tt_09z1gsQcm87nA,JS vlogs
1001,203.0,ukctX-Hdot0,2022-03-20T09:43:09Z,usa donkey 2022ЁЯЩПЁЯП╗ЁЯе╡ new update full information in hindi MEXICO USA DONKY,https://www.youtube.com/watch?v=ukctX-Hdot0,usa donkey 2022 new update full information in hindi MEXICO USA DONKEY.,UCjj9Rtf2GquenO-LX0Wkd1w,Hello india
1002,204.0,vvElvkKFStc,2022-01-31T09:46:07Z,USA donkey camp  ..  Indian #india #usa #donkey #jaibabaki,https://www.youtube.com/watch?v=vvElvkKFStc,,UCUz-i2lQUYoVgepzb0HBUFg,SB Jadola
1003,206.0,VcTuIGts9fA,2022-07-31T07:52:11Z,India to usa donkey ||HONDRUS CAMP || Punjabi boys maxico  border| usa donkey,https://www.youtube.com/watch?v=VcTuIGts9fA,donkey americaa || donkey 2022 ||Usa donkey america ||donkey ||mexico border crossing to usa punjabiIndia to USA donkey ...,UCQYpiNF3eKxJ3fUVFRMEseg,рдорд╣рд╛рджреЗрд╡рд╛ ЁЯФ▒
1004,207.0,ZgXG3F5J4X4,2022-01-02T15:00:17Z,El Salvador Visa free entry  | India to El Salvador Flight route  | El Salvador to USA Donkey flight,https://www.youtube.com/watch?v=ZgXG3F5J4X4,El Salvador Visa free entry | India to El Salvador Flight route | El Salvador to USA Donkey flight @teachvisa #HASSANVISAINFO ...,UCEFJ74BQdQ7kGHXX2D8nfRA,Teach visa Punjabi
1005,208.0,O8C15GVaIqg,2022-07-19T07:30:10Z,India to USA donkey | рджреАрд╡рд╛рд░ рдХреВрджрдиреЗ рдХреЗ рдмрд╛рдж рдХреНрдпрд╛ рд╣реЛрддрд╛ рд╣реИ | Gaurav Maan,https://www.youtube.com/watch?v=O8C15GVaIqg,"India to usa donkey рдорд╛рд░ рдХреЗ рдЬрд╛рдиреЗ рдХреЗ рдмрд╛рдж, рдЕрдорд░реАрдХрд╛ рдХреА рджреАрд╡рд╛рд░ рдХреВрджрдиреЗ рдХреЗ рдмрд╛рдж рдХрд╛ рд╕рдлрд╝рд░ ...",UCp9ABGKxojZ9MIpCurKFXCQ,Gaurav Maan
1006,209.0,B-3cg9SnlQo,2020-05-21T04:49:08Z,Journey India to Usa ( Donkey ale jatt ),https://www.youtube.com/watch?v=B-3cg9SnlQo,Follow on Instagram @deep1_official . . .#trending #foryoupage #foryou #trending #Canada #usa #covid19 #lockdown ...,UCibZHKBfHFe5kqdqJP-TnrA,Harshpreet karnal
1007,210.0,HCdOqj6Qw3Y,2022-08-12T12:52:32Z,USA DONKEY#india to usa donkey#reels#pakke usa wale California#pakke amrica wale#Mexico bordar#,https://www.youtube.com/watch?v=HCdOqj6Qw3Y,,UCKxtKddBhN0JUbYptQBUtpA,Usa Donkey Wale CALIFORNIA
1008,211.0,QAW3CjICgrk,2022-05-12T17:01:52Z,Donkey India to USA #donkey #donkeykong #jaat #haryana #mexico #india #usa,https://www.youtube.com/watch?v=QAW3CjICgrk,,UCpiLg20Tmit5KlmUvek13TQ,Manish Kumar
1009,212.0,wbeMgnJbGjA,2022-08-10T06:38:42Z,USA donkey || Mexico to USA Texas border crossing today ЁЯШ▒,https://www.youtube.com/watch?v=wbeMgnJbGjA,donkey americaa || donkey 2022 ||Usa donkey america ||donkey ||mexico border crossing to usa punjabiIndia to USA donkey ...,UCc3JmivcpjAGnd1-p-ldtaQ,Technical gill
1010,213.0,ObVq0cpnLok,2022-12-23T01:30:05Z,India ЁЯЗоЁЯЗ│ To USA ЁЯЗ║ЁЯЗ╕ | Part - 02| Donkey 2022| Second Flight| 2 Numbari тЬМЁЯП╗| America ЁЯЗ║ЁЯЗ╕,https://www.youtube.com/watch?v=ObVq0cpnLok,Jai Mata Di America #usa     #usa #america #trending #reels #reelitfeelit #trend #explore #explorepage #usa     ...,UC1X4PBVhNsyavmtdy2XOZFA,Ankush Malik Vlogs
1011,214.0,EXN_qODiPAQ,2022-07-21T11:42:43Z,#america #americandollar #shorts #donkey #2numberi #usa#usaale  india to americaЁЯЗ║ЁЯЗ╕ЁЯМОЁЯЧ╜,https://www.youtube.com/watch?v=EXN_qODiPAQ,,UCm5T_zgOOH-6c62reLfs9ZA,Kadyan  vlogs canadaЁЯЗиЁЯЗж
1012,215.0,a4tKIInNxtc,2018-10-23T15:42:05Z,El salvador to usa illegal [ india pakistan afghanistan ]USA KI DONKEY PARTS 5 2018 in URDU&amp;HINDI.,https://www.youtube.com/watch?v=a4tKIInNxtc,El salvador to usa illegal [ india pakistan afghanistan ]USA KI DONKEY PARTS 5 2018 in URDU&HINDI. El salvador visa info in ...,UCYyk3C5bP0IVvukAnGibl7w,TEACH VISA
1013,216.0,MgbiD1vWPCs,2022-09-21T08:18:51Z,TEXES NEW UPDATE#USA DONKEY #USA DONKEY MEXICO#INDIA TO USA US IMMIGRATION NEWS LATEST,https://www.youtube.com/watch?v=MgbiD1vWPCs,Pl subscribe our chennal for more information Jassi Backpacker Vlogs Gmail.jasvindersingh46664@gmail.com Pl follow ...,UCdO_wi4TJhvMynJcUOw6UBQ,Jassi backpacker vlogs
1014,217.0,0aWuPT0JQKE,2023-01-10T12:46:36Z,Today Mexico to America border crossing boys girls and baby || usa donkey || Mexico to America,https://www.youtube.com/watch?v=0aWuPT0JQKE,donkey americaa || donkey 2022 ||Usa donkey america ||donkey ||mexico border crossing to usa punjabiIndia to USA donkey ...,UCc3JmivcpjAGnd1-p-ldtaQ,Technical gill
1015,218.0,3CsoUYEVnpQ,2022-05-10T08:05:17Z,Can we go USA from UK by donky | Your Question answers | Copyright again #usa #uk #vlog #indianinuk,https://www.youtube.com/watch?v=3CsoUYEVnpQ,Can we go USA from UK | Your answers | Copyright again #usa #uk #vlog #indianinuk Insta-neenauk89.,UCpXKhHmiqRBqbFdPYiiCmXQ,neena uk
1016,219.0,yQbQGu6s-IM,2018-01-07T00:27:41Z,USA Donkey .india to usa donkey,https://www.youtube.com/watch?v=yQbQGu6s-IM,2 number ma America Haryana to America . India to America do number ma. Haryanvi boyz going to America by illegally.,UC0gtwjto7g-NAc8_MeHkYbA,Gaurav Mehla
1017,220.0,zjbDe3RbhUQ,2022-10-05T05:30:13Z,"india to usa donkey, usa donkey 2022 #shorts",https://www.youtube.com/watch?v=zjbDe3RbhUQ,"shorts #usdonkey #usvisa #usimigration #freevisaadvisor india to usa donkey, usa donkey 2022 Free Visa Advisor don't promote ...",UC4mifYMs39uMhHSBeP64dCg,Free Visa Advisor
1018,221.0,EW5BAza5es0,2022-10-03T05:51:20Z,HONDURAS TO GUATEMALA USA MEXICO BORDER || usa donkey 2022 || india to usa donkey part 2,https://www.youtube.com/watch?v=EW5BAza5es0,mexico border crossing to usa...|| usa donkey 2022 || usa donkey border crossing || donkey || your queries: queries:Mexico to USA ...,UCu44xaLCz6wnRT3gendMcUw,vinu lifestyle
1019,222.0,n9LuWC9jifo,2022-09-28T07:15:01Z,usa donkey 2022 I india to usa I #shorts,https://www.youtube.com/watch?v=n9LuWC9jifo,shorts #freevisaadvisor #usa #usadonkey usa donkey 2022 I india to usa I My other Youtube Channel for : Shorts Free Visa ...,UC4mifYMs39uMhHSBeP64dCg,Free Visa Advisor
1020,223.0,_FUE2oRXFcQ,2022-10-24T02:21:31Z,USA DONKEY 2022 | INDIA TO USA DONKEY | AMERICA DONKEY | 2 NUMBER ME AMERICA,https://www.youtube.com/watch?v=_FUE2oRXFcQ,USA DONKEY 2022 | INDIA TO USA DONKEY | AMERICA DONKEY | 2 NUMBER ME AMERICA Copyright Disclaimer Under ...,UCzUuSLnlDg59Zs0Qi2h_QlA,TRUE INDIAN RD
1021,224.0,mM3UKrL0QAM,2023-01-01T04:00:11Z,USA DONKEY ЁЯЗ║ЁЯЗ▓ VIDEO || PANAMA JUNGEL  || Part- 6 рдкрдирд╛рдорд╛ рдЬрдВрдЧрд▓ рдбреЛрдВрдХреА рд╡реАрдбрд┐рдпреЛ рдЬрдВрдЧрд▓ рдЦрддреНрдо ЁЯе│ЁЯе│ !  #tranding,https://www.youtube.com/watch?v=mM3UKrL0QAM,USA DONKEY VIDEO || PANAMA JUNGEL || Part- 6 рдкрдирд╛рдорд╛ рдЬрдВрдЧрд▓ рдбреЛрдВрдХреА рд╡реАрдбрд┐рдпреЛ рдЬрдВрдЧрд▓ рдЦрддреНрдо !,UCtLr-VlUjuxh4zUQA6pu_zg,2 Numbari USA Wala
1022,225.0,OmfitjGjxnc,2023-01-09T04:35:57Z,India to America |Indian Asylum seekers in USA | immigration life USA | US visa @DonkeyAmericaki,https://www.youtube.com/watch?v=OmfitjGjxnc,India to America |Indian Asylum seekers in USA | immigration life USA | US visa тАО@DonkeyAmericaki.,UCgsSAyzq8dgIJ3FT8DEtGYQ,Donkey America ki
1023,226.0,gWt-q_dsc8c,2022-11-24T02:30:14Z,(Part 2) Usa Donkey ЁЯЗ║ЁЯЗ▓ | India to Usa Donkey | Illegal Mexico Usa Border Crossing,https://www.youtube.com/watch?v=gWt-q_dsc8c,(Part 2) Usa Donkey | India to Usa Donkey | Illegal Mexico Usa Border Crossing | Donkey 2022 #usadonkey #panamajungle ...,UCJ2YrlSSzLlLPpHLvlM4dUg,Donkey Update 2.0
1024,227.0,kqU-8yhvjKE,2018-09-02T20:05:27Z,Donkey india to usa ||ROTI||,https://www.youtube.com/watch?v=kqU-8yhvjKE,This video are copyright act...,UCP57seAsZQVhveLuq3Xvh9w,Vicky multani
1025,228.0,jWQwPEvoSWA,2020-04-27T18:32:59Z,USA Donkey From India To America | Punjabi Family | Mexico Border Crossing Part - 2,https://www.youtube.com/watch?v=jWQwPEvoSWA,This is the part - 2 of our video named as тАФтАФ USA Donkey From India To America | Punjabi Family | Mexico Border Crossing ...,UCd7JnWUKwTxVJHi4oWEPA8A,Real Life Records
1026,229.0,pAVLfkfNsjA,2023-01-16T03:30:17Z,Usa Mexico Donkey | USA Mexico Border Update | India To USA Donkey#usadonkey#mexicoborder#border#usa,https://www.youtube.com/watch?v=pAVLfkfNsjA,My channel:-https://www.youtube.com/channel/UCn7K... Press The BELL ICON For Get Next Video Information. For Daily Live ...,UCn7KrefotvouJeYXzwRBpfw,Rohit Backpacker
1027,231.0,eRQ7c-kRPU8,2021-03-11T17:12:17Z,LATEST USA DONKEY UPDATE || US ki #donkey Information Punjabi || риЕриори░рйАриХри╛ риХрйА рибрйМриХрйА || INDIAN se US .,https://www.youtube.com/watch?v=eRQ7c-kRPU8,LATEST USA DONKEY UPDATE || US ki #donkey information punjabi || INDIAN se US . риЕриори░рйАриХри╛ риХрйА рибрйМриХрйА. #usadonkey ...,UCEFJ74BQdQ7kGHXX2D8nfRA,Teach visa Punjabi
1028,232.0,fcTQZCs7Dlw,2019-03-26T11:24:06Z,Donkey India to america/New short film/Latest Punjabi movie/Hollywood movie,https://www.youtube.com/watch?v=fcTQZCs7Dlw,"director - simar_virk__ producer - Arsh josan special thanks to gurinder guraya cast- Amrit virk, angrej thind, lovdeep virk, lovpreet ...",UC0uQuOpcqSm7V8s5TafqZPw,ReFugeee
1029,233.0,RJh8_uFsgm8,2022-11-11T08:00:10Z,usa donkey camp jail ЁЯЗ║ЁЯЗ▓| Usa Donkey 2022 | America Jail | Mexico to Usa Border Crossing,https://www.youtube.com/watch?v=RJh8_uFsgm8,America Donkey Jail ( риири░риХ рижри╛ риШри░ ) Usa Donkey 2022 | usa donkey camp jail #indiatousa #usadonkey ...,UCJ2YrlSSzLlLPpHLvlM4dUg,Donkey Update 2.0
1030,234.0,AHE40T3ruHc,2021-07-18T06:26:09Z,Q&amp;A Video - USA ki donkey | under 18 year |  India to Brazil flights-Mexico donkey - Asylum in USA.,https://www.youtube.com/watch?v=AHE40T3ruHc,Q&A Video - USA ki donkey | under 18 year | India to Brazil flights-Mexico donkey - Asylum in USA. Hassan Visa Info ...,UCEFJ74BQdQ7kGHXX2D8nfRA,Teach visa Punjabi
1031,235.0,J7JqyeBkC7c,2022-10-10T09:44:12Z,Usa donkeyЁЯЗ║ЁЯЗ╕||America donkeyЁЯЗ║ЁЯЗ╕||Panama donkeyЁЯПХя╕П||Usa ЁЯЗ║ЁЯЗ╕To IndiaЁЯЗоЁЯЗ│ donkey|| Full Video,https://www.youtube.com/watch?v=J7JqyeBkC7c,usadonkey #panamadonkey#maxicodonkey#india to america donkey.,UCEaVLTk3MN1kBClMF6K6GBw,R Lathwal Vlog
1032,236.0,mVb597qO5ks,2022-08-05T14:27:03Z,Usa Donkey ЁЯЗ║ЁЯЗ╕ Panama Jungle to America Journey Real Story | Circle Punjabi,https://www.youtube.com/watch?v=mVb597qO5ks,Usa Donkey Panama Jungle to America Journey | Real Story | Circle Punjabi Panama Jungle to America Journey Real Story ...,UC-R_DQUHnEOd0JNhZkzpzZQ,Circle Punjabi
1033,237.0,9hLKuv0PhHs,2023-01-24T07:27:53Z,Usa donkey indian haryana,https://www.youtube.com/watch?v=9hLKuv0PhHs,,UCdO_wi4TJhvMynJcUOw6UBQ,Jassi backpacker vlogs
1034,238.0,cJDPsyEbWq8,2021-06-17T10:15:00Z,india to Brazil flight | America di Donkey flight | Flight UPDATE 2021.,https://www.youtube.com/watch?v=cJDPsyEbWq8,india to Brazil flight | America di Donkey flight | Flight UPDATE 2021. Usa ki Donkey Information in Punjabi.#usakidonkey ...,UCEFJ74BQdQ7kGHXX2D8nfRA,Teach visa Punjabi
1035,239.0,d6xqY-v29vQ,2022-10-21T09:30:09Z,USA Donkey I india to usa donkey I,https://www.youtube.com/watch?v=d6xqY-v29vQ,usa #usadonkey #usadonkey2022 #freevisaadvisor USA Donkey I india to usa donkey I Free Visa Advisor don't promote illegals ...,UC4mifYMs39uMhHSBeP64dCg,Free Visa Advisor
