,Unnamed: 0,videoId,publishedDate,title,videoUrl,description,channelId,channelTitle
0,28.0,jcVx8KQDT8A,2022-09-04T06:04:11Z,рдбреЛрдВрдХреА ko рд▓реЗрдХрд░ aapke рд╕рд╡рд╛рд▓реЛрдВ ke рдЬрд╡рд╛рдм рееINDIA to USAЁЯЗ║ЁЯЗ╕ #haryanviinusa #donky #indianinamerica,https://www.youtube.com/watch?v=jcVx8KQDT8A,"india to usa donkey,usa donkey,india to america donkey map,india to usa,india to usa donky,#india to usa donky,#india to usa ...",UCyORkzQuHawChmz_QII3QXA,Jakhar vlogs
1,44.0,R2JoXWzjPDE,2022-11-10T09:33:58Z,mexico to usa border crossing 2022 ЁЯЗ║ЁЯЗ▓| Usa Donkey | usa border crossing video(Part 2) #shorts,https://www.youtube.com/watch?v=R2JoXWzjPDE,"america illegal entry punjabi | mexico to america donkey #shorts mexico to america donkey, Punjab NEws, Punjab news live, ...",UCJ2YrlSSzLlLPpHLvlM4dUg,Donkey Update 2.0
2,53.0,EQmKCvEO6T8,2022-08-21T22:55:14Z,INDIA TO USA DONKEY ЁЯЗ║ЁЯЗ▓,https://www.youtube.com/watch?v=EQmKCvEO6T8,,UC0hbO6CYJZ2czXuyl74Rdng,2 NUMBERI
3,68.0,m3e4Tm8iIA0,2022-01-06T08:39:48Z,"America ki donkey, india se. #america #mexico #usa #india #donkey #2022  #punjab #haryana #delhi..",https://www.youtube.com/watch?v=m3e4Tm8iIA0,,UCBvz-N3G4BiFJHxk9_DXvdw,Haryanvi vloggers
4,91.0,aYl6jls8FAQ,2022-10-23T08:39:19Z,USA DONKEY 2022 || America Donkey video | 2 Number Vich America | Donkey video,https://www.youtube.com/watch?v=aYl6jls8FAQ,,UCzUuSLnlDg59Zs0Qi2h_QlA,TRUE INDIAN RD
5,92.0,I6LIV6ZSreU,2022-10-30T09:30:03Z,USA Donkey I india to usa donkey I #shorts,https://www.youtube.com/watch?v=I6LIV6ZSreU,shorts #usadonkey #usadonkey2022 #usa #freevisaadvisor USA Donkey I india to usa donkey I #shorts Free Visa Advisor don't ...,UC4mifYMs39uMhHSBeP64dCg,Free Visa Advisor
6,93.0,b3npD8sHU-8,2022-01-22T02:49:30Z,Cuba Visa for ЁЯЗ╡ЁЯЗ░ ЁЯЗоЁЯЗ│ Citizen | Cuba to USA Donkey Flight | Cuba Embassy | Visit visa latest update.,https://www.youtube.com/watch?v=b3npD8sHU-8,Cuba Visa for Citizen | Cuba to USA Donkey Flight | Cuba Embassy | Visit visa latest update. Cuba Visa after ...,UCEFJ74BQdQ7kGHXX2D8nfRA,Teach visa Punjabi
7,108.0,IGaw_HeVD1Q,2022-12-19T05:19:41Z,USA CAMP FULL VIDEOS || usa donkey || America border crossing punjabi || Mexico to USA,https://www.youtube.com/watch?v=IGaw_HeVD1Q,donkey americaa || donkey 2022 ||Usa donkey america ||donkey ||mexico border crossing to usa punjabiIndia to USA donkey ...,UCc3JmivcpjAGnd1-p-ldtaQ,Technical gill
8,110.0,G86xszBOi4k,2022-02-26T11:51:00Z,Donkey India To America Funny Video Must WatchЁЯШВЁЯШВЁЯШВ,https://www.youtube.com/watch?v=G86xszBOi4k,shorts #ComedyVideo #OpTarun.,UCh9sKM3ljmKb22hW8fkfgpQ,Op; Tarun
9,114.0,KeiX38mey2w,2021-03-08T16:07:18Z,#USA #Donkey #information #UK #visa information Punjabi boy Europe visa kaise lgwaye,https://www.youtube.com/watch?v=KeiX38mey2w,USA #Donkey #information #UK #Visa information Punjabi boy Europe visa kaise lagwaye indin boy any country how to apply ...,UCjj9Rtf2GquenO-LX0Wkd1w,Hello india
10,130.0,919Qjc6wwis,2021-05-26T08:09:38Z,usa donkey entry by haryanvi,https://www.youtube.com/watch?v=919Qjc6wwis,,UCp9_hn-3i1_M9U11p6zEyCw,Shivam._. Jaat
11,155.0,sUrXg0LdXx0,2020-09-14T03:56:31Z,USA  New Route 2021 | Donkey Flight America di | Brazil to Mexico Route.,https://www.youtube.com/watch?v=sUrXg0LdXx0,USA Donkey new route 2020 | Donkey Flight America di | Brazil to Mexico route. usa ki donkey/Donkey Flight.Pakistan India to ...,UCEFJ74BQdQ7kGHXX2D8nfRA,Teach visa Punjabi
12,161.0,3-yur9Db78M,2022-10-26T14:15:07Z,USA Donkey I india to usa donkey I #shorts,https://www.youtube.com/watch?v=3-yur9Db78M,shorts #usadonkey #usadonkey2022 #usa #freevisaadvisor USA Donkey I india to usa donkey I #shorts Watch the full video of ...,UC4mifYMs39uMhHSBeP64dCg,Free Visa Advisor
13,164.0,cfABbCdGrrQ,2022-10-23T05:21:40Z,Donkey America ЁЯЗ║ЁЯЗ▓ | Donkey 2022 | Usa Donkey | Mexico Border Crossing to Usa,https://www.youtube.com/watch?v=cfABbCdGrrQ,Donkey America | Donkey 2022 | Usa Donkey | Mexico Border Crossing to Usa #usadonkey #indiatousa #usaborder ...,UCJ2YrlSSzLlLPpHLvlM4dUg,Donkey Update 2.0
14,174.0,y5sLk7PUVQI,2021-03-12T15:18:56Z,New Update USA Donkey 2021 and how to apply usa visa punjabi boy in USA indian in USA mexico,https://www.youtube.com/watch?v=y5sLk7PUVQI,New Update #USA #Donkey #2021 and how to apply usa visa #punjabi boy in USA #indian in USA #mexico to USA donkey.,UCjj9Rtf2GquenO-LX0Wkd1w,Hello india
15,185.0,crzYbnkMUTU,2022-10-04T14:30:13Z,USA Donkey I india to usa donkey I #shorts,https://www.youtube.com/watch?v=crzYbnkMUTU,shorts #usadonkey #usa #usvisa #freevisaadvisor USA Donkey I india to usa donkey I #shorts Free Visa Advisor don't promote ...,UC4mifYMs39uMhHSBeP64dCg,Free Visa Advisor
16,186.0,L0RkOYbx-3I,2019-01-03T13:14:13Z,India to Usa (Donkey),https://www.youtube.com/watch?v=L0RkOYbx-3I,Ror Boys.,UC4vR9QSRXrWYQ5kTT10U_tg,Flop blogger
17,188.0,Aqhbw7N4_qQ,2022-12-29T02:47:56Z,Usa Donkey 2023 | Donkey Life India To America ЁЯТ▓ #donkey #visa #america || new america visa rule,https://www.youtube.com/watch?v=Aqhbw7N4_qQ,usa donkey 2023 #Donki #border #panama #usa USA Donkey 2023.,UCYJ8fRExSOfpWWJhzyRPxJg,illegal Jaat
18,190.0,O40W8JpXRwY,2022-10-05T07:30:12Z,LAST VIDEO - India to USA Donkey | Gaurav maan,https://www.youtube.com/watch?v=O40W8JpXRwY,USA DONKEY рд▓рдЧрд╛рдиреЗ рдХрд╛ рдорди рд╣реИ рдЙрд╕рд╕реЗ рдкрд╣рд▓реЗ рдпреЗ рд╡реАрдбрд┐рдпреЛ рджреЗрдЦ рд▓реЛ ред рдХреИрд╕реА рдЖрдкрдХреА рдЬрд┐рдВрджрдЧреА ...,UCp9ABGKxojZ9MIpCurKFXCQ,Gaurav Maan
19,192.0,6LJBoKF9DcI,2022-03-14T07:24:41Z,New USA Donkey Video | Mexico border crossing | Indian boys in donkey | 2022,https://www.youtube.com/watch?v=6LJBoKF9DcI,Usa donkey video mexico border crossing 2022 Ror boys #usadonkey #donkey #america #indianinamerica #usadonkeyvideo ...,UCypuIdlqQELMH_vKb5FMcbQ,Indian American
20,193.0,Nwl9LEbQKsU,2022-11-27T05:50:23Z,usa donkey || Mexico to USA border crossing|| usa donkey 2022 technical gill || Mexico border,https://www.youtube.com/watch?v=Nwl9LEbQKsU,donkey americaa || donkey 2022 ||Usa donkey america ||donkey ||mexico border crossing to usa punjabiIndia to USA donkey ...,UCc3JmivcpjAGnd1-p-ldtaQ,Technical gill
21,196.0,drEWY5fhhQ0,2022-11-16T04:07:28Z,Usa donkey | donkey shayri | india to usa | aj__usa | pardeshi status | #aj__usa  #donkey,https://www.youtube.com/watch?v=drEWY5fhhQ0,,UCOZ4WFDBKT71c3kxTZMgWGA,Aryan__usa_
22,207.0,c9JszJR2iPc,2022-07-05T04:28:09Z,Times Square Pe Lakho Ka SCAM | India To USA Donkey VISA | Indian In America,https://www.youtube.com/watch?v=c9JszJR2iPc,"timessquare #indianinamerica #indianinusa Times Square Pe Lakho Ka SCAM | Indian In America Hello Guys, welcome back to ...",UCdvfzzIhnq4_WOZDP8L1oPw,RK'S IN AMERICA
23,218.0,l8FmYj7VBaM,2018-10-21T15:12:02Z,bahamas to usa illegal [ india pakistan  afghanistan ]USA KI DONKEY  PARTS 3 2018 in URDU&amp;HINDI.,https://www.youtube.com/watch?v=l8FmYj7VBaM,bahamas to usa illegal [ india pakistan bangladesh afghanistan ] PARTS 3 2018 in URDU&HINDI. usa ki donkey information in ...,UCYyk3C5bP0IVvukAnGibl7w,TEACH VISA
24,220.0,yAfWoDKa5Jo,2022-10-19T05:30:22Z,USA Donkey I india to usa donkey I #shorts,https://www.youtube.com/watch?v=yAfWoDKa5Jo,usa #usadonkey #usadonkey2022 #freevisaadvisor USA Donkey I india to usa donkey I #shorts Free Visa Advisor don't promote ...,UC4mifYMs39uMhHSBeP64dCg,Free Visa Advisor
25,221.0,Dj9jsS2fhBg,2022-12-12T12:07:56Z,# AMERICA ЁЯЗ║ЁЯЗ╕ DONKEY || India To Kyrgyzstan ЁЯЗ░ЁЯЗм || # USA donkey # shorts #viral #maxico #usaborder,https://www.youtube.com/watch?v=Dj9jsS2fhBg,,UC_jmCHS4CfP-cUU7KfoQISA,Amit Sharma
26,222.0,m03cXDr6ACE,2022-12-22T12:59:41Z,India to US without donkey рдЗрдВрдбрд┐рдпрд╛ рд╕реЗ рдпреВ рдПрд╕ рд╕реАрдзрд╛ us visa latest news us visa update USA visa ЁЯЗ║ЁЯЗ╕USA,https://www.youtube.com/watch?v=m03cXDr6ACE,US donkey easy and safe steps to direct India to usa donkey by flight India to uk to Maxico by flight to to ...,UC_E-4M31gKkn8Cg7H01YwGg,New Mission 
27,223.0,x_X01oegCkQ,2022-09-12T05:33:15Z,INDIA to USA donkey  I usa donkey I usa donkey 2022 I,https://www.youtube.com/watch?v=x_X01oegCkQ,"usvisa #usdonkey #usbordercrossing US donkey border crossing I usa donkey I india to usa donkey, usa donkey 2022, usa ...",UC4mifYMs39uMhHSBeP64dCg,Free Visa Advisor
28,240.0,HFFkpEaPzBY,2022-11-08T01:30:09Z,USA Donkey I india to  usa donkey I #shorts,https://www.youtube.com/watch?v=HFFkpEaPzBY,shorts #freevisaadvisor #usadonkey USA Donkey I india to usa donkey I #shorts Free Visa Advisor don't promote illegals border ...,UC4mifYMs39uMhHSBeP64dCg,Free Visa Advisor
29,256.0,Xk1eJ0DnM1Y,2022-02-16T14:00:25Z,India to Germany donkey flight | Europe donkey flight | 3 way to go Germany | By Air .,https://www.youtube.com/watch?v=Xk1eJ0DnM1Y,India to Germany donkey flight | Europe donkey flight | 3 way to go Germany | By Air .. #Germanydonkeyflight #Europedonkey ...,UCEFJ74BQdQ7kGHXX2D8nfRA,Teach visa Punjabi
30,257.0,jo1H581ixKs,2022-04-17T06:36:04Z,INDIA TO USA Immigration Kaisa Hota Hai | Indian In America | India To USA Donkey Visa,https://www.youtube.com/watch?v=jo1H581ixKs,IndiaToUsa #IndiaToUsaJourney #IndiansInAmerica INDIA TO USA Immigration Kaisa Hota Hai | Indian In America New ...,UCdvfzzIhnq4_WOZDP8L1oPw,RK'S IN AMERICA
31,265.0,fVpLx6DK9dY,2018-10-19T15:26:51Z,mexico to usa illegal [india pakistan bangladesh] PARTS 1 USA KI donkey  2018 in URDU&amp;HINDI.,https://www.youtube.com/watch?v=fVpLx6DK9dY,mexico to usa illegal [india pakistan bangladesh] PARTS 1 2018 in URDU&HINDI. India to usa by donkey U S A bond after ...,UCYyk3C5bP0IVvukAnGibl7w,TEACH VISA
32,268.0,wgJ4Hos-dCw,2022-10-18T04:55:39Z,INDIA TO USA Donkey | рдЧрд╛рдБрд╡ рдХреЗ рдмрд╛рд▓рдХ рджреЗрдЦрд▓реЛ #shorts,https://www.youtube.com/watch?v=wgJ4Hos-dCw,INDIA TO USA DONKEY.,UCp9ABGKxojZ9MIpCurKFXCQ,Gaurav Maan
33,269.0,Pd-rLSicu4s,2022-06-25T14:14:51Z,"see how ЁЯШп people,s enter in Usa ЁЯЗ║ЁЯЗ╕ЁЯЗ║ЁЯЗ╕ || border crosing donkey|| with truck || #shorts #talent",https://www.youtube.com/watch?v=Pd-rLSicu4s,,UCdVli2XHf4nX0xRUyL7ZbBg,Real Fans Club 
34,275.0,5bBv4JeFRdo,2022-12-29T01:30:01Z,USA DONKEY I INDIA TO USA I #shorts,https://www.youtube.com/watch?v=5bBv4JeFRdo,shorts #usadonkey #usa #usadonkey2022 #freevisaadvisor USA DONKEY I INDIA TO USA I #shorts Free Visa Advisor don't ...,UC4mifYMs39uMhHSBeP64dCg,Free Visa Advisor
35,281.0,Oqs47X7CkZo,2022-09-09T08:10:52Z,"donkey to USA Europe  ||Story of Refugees, Asylum &amp; Donkers In USA , UK , Germany ||",https://www.youtube.com/watch?v=Oqs47X7CkZo,"Its Hard to Explain Everything but i hope you will understand well |india to usa donkey route, #indiatousadonkeymap ...",UCu44xaLCz6wnRT3gendMcUw,vinu lifestyle
36,295.0,RWAChFxsDp8,2021-06-13T19:35:12Z,Donkey india to USA da safar Indian bande da safar donky la k usa,https://www.youtube.com/watch?v=RWAChFxsDp8,,UClqV3vx82_HYiBjPbqtUlIw,Life Luck game
37,317.0,oWz7-92fQY8,2022-06-28T08:41:36Z,New America Donkey Video | Mexico border crossing | Indian boys in donkey | 2022,https://www.youtube.com/watch?v=oWz7-92fQY8,Usa donkey video mexico border crossing 2022 boys #usadonkey #donkey #america #indianinamerica #usadonkeyvideo ...,UCypuIdlqQELMH_vKb5FMcbQ,Indian American
38,337.0,0y5xvXKmkws,2022-09-21T04:40:24Z,INDIAN USA MAI JAKAR KYA KAM KARTE HAI || я┐╝INDIAN KO USA MAI KITNE PAISE MILTE HAI,https://www.youtube.com/watch?v=0y5xvXKmkws,INDIAN USA MAI JAKAR KYA KAM KARTE HAI || INDIAN KO USA MAI KITNE PAISE MILTE HAI Instagram :- ashu_ror_22 ...,UCKw8osbjurLZYFcwYp7SD5A,ASHU ROR
39,341.0,Mol-LRNV5N4,2023-01-09T01:30:05Z,India ЁЯЗоЁЯЗ│ To USA ЁЯЗ║ЁЯЗ╕ | Part - 08 | рдкреЗрд░реВ ЁЯЗ╡ЁЯЗк рдХреЗ рдирдЬрд╝рд╛рд░реЗ ЁЯШН| рднрд╛рдЗрдпреЛрдВ рдХреА рдореЛрдЬрд╝ рдорд╕реНрддреАЁЯШВред USA ЁЯЗ║ЁЯЗ╕ Donkey,https://www.youtube.com/watch?v=Mol-LRNV5N4,Jai Mata Di America #usa     #usa #america #trending #reels #reelitfeelit #trend #explore #explorepage #usa     ...,UC1X4PBVhNsyavmtdy2XOZFA,Ankush Malik Vlogs
40,345.0,u-_5rgrK7mo,2021-06-10T18:17:28Z,Trucking Job After ЁЯЗ║ЁЯЗ╕ USA donkey from india to America Donkey | truck ЁЯЪЪ lifestyle,https://www.youtube.com/watch?v=u-_5rgrK7mo,,UCIatwPT8do3a0VYLyW_TqXA,2M Shorts
41,356.0,DThCYHVlQRo,2021-05-22T18:46:05Z,America USA Donkey new video 2021 | USA America donkey new video 2021 | INDIA TO USA,https://www.youtube.com/watch?v=DThCYHVlQRo,When i was in USA donkey | America Donkey route or diwar crossing America Donkey 2021 Mexico boader crossings.,UCcy_YHWO7b6xFQKnqws62gw,Anuj Dhanda
42,365.0,J-vjf2jDOuI,2022-05-10T14:32:58Z,Europe To  Usa Donkey || Europe To Mexico InformationЁЯЗ║ЁЯЗ╕ || рикрйБри░ридриЧри╛ри▓ ридрйЛриВ риорйИриХри╕рйАриХрйЛ риХри┐ри╡рйЗриВ риЬри╛ ри╕риХрижрйЗ 2022,https://www.youtube.com/watch?v=J-vjf2jDOuI,EuropeToUsa #PortugaltoUsa #EuropeToMexico #EuropeToMexicoDonkey #Portugaltrctomexico Welcome to our youtube ...,UCd2Pd4t8gYjOqD2kssThbXA,Pakke Europe Ale
43,366.0,D1gpj5u86iQ,2022-12-05T19:49:42Z,#usa #donkey #india #haryana ЁЯдЯЁЯдЯ,https://www.youtube.com/watch?v=D1gpj5u86iQ,,UC7hzf88ctnjEnd9lRe3cVew,assharma3561
44,367.0,4fYPGCIBib8,2022-08-14T08:54:32Z,USA ЁЯЗ║ЁЯЗ▓DONKEY PUNAMA JUNGLE TO TAPACHULA MEXICO @rahul___sheokand #youtube #viralvideos #india #usa,https://www.youtube.com/watch?v=4fYPGCIBib8,USA DONKEY MEXICO JUNGLE TO TAPACHULA MEXICO @rahul___sheokand #usadonkey #mexicojungle ...,UCAh98kuxlqrBWJZFJHLIUhg,HR90 aaleЁЯФе
45,369.0,m0rUXyfNfhw,2021-08-01T14:17:07Z,India to Europe Germany ЁЯЗйЁЯЗк |1st time most rare video |usa donkey|germanydonkey|italy|serbia|#short,https://www.youtube.com/watch?v=m0rUXyfNfhw,,UCvBuYwteJ-b-u18caEBUmUg,DEV SHARMA
46,370.0,BRrrOHwQoAQ,2023-01-21T05:25:19Z,Usa donkey ЁЯЗ║ЁЯЗ▓| India to Usa donkey | риЕриори░рйАриХри╛ ЁЯЗ║ЁЯЗ▓ #shorts,https://www.youtube.com/watch?v=BRrrOHwQoAQ,(Part 7) Mexico To America Border Crossing | Usa Donkey 2022 | #shorts #usaborder #panamajungle #americadonkey ...,UCJ2YrlSSzLlLPpHLvlM4dUg,Donkey Update 2.0
47,371.0,71MTjbTb66A,2022-10-08T10:49:06Z,mexico border crossing to usa...|| usa donkey 2022 || usa donkey border crossing ||,https://www.youtube.com/watch?v=71MTjbTb66A,donkey americaa || donkey 2022 ||Usa donkey america ||donkey ||mexico border crossing to usa punjabiIndia to USA donkey ...,UCu44xaLCz6wnRT3gendMcUw,vinu lifestyle
48,375.0,ou3mNiJEkYw,2022-07-25T16:07:22Z,#usa #donkey #india #like,https://www.youtube.com/watch?v=ou3mNiJEkYw,,UCX-75suykFwpix_B94wRiJQ,Bhagwangarh sahil
49,376.0,mQHoXCvio3A,2022-12-26T12:57:38Z,America Donkey Update | Usa donkey update | Maxico to usa donkey | Donkey update,https://www.youtube.com/watch?v=mQHoXCvio3A,MAXICO TO USA BORDER DONKEY UPDATE | ARIZONA BORDER | TEXAS BORDER | NEW DONKEY VIDEO USA - MAXICO ...,UCzUuSLnlDg59Zs0Qi2h_QlA,TRUE INDIAN RD
50,383.0,oVChQMoRXRc,2022-06-05T03:33:57Z,India to America Donkey | Mexico Donkey | America Donkey status video | #2numbri #americadonkey,https://www.youtube.com/watch?v=oVChQMoRXRc,,UC2fME6t1CfzM3ov4rTMbLIQ,Canadian Punjabi
51,387.0,TF1PBk-KApo,2022-01-26T06:00:10Z,рдХрдирд╛рдбрд╛ рдпреВрдПрд╕рдП рдмреЙрд░реНрдбрд░ рдХреНрд░реЙрд╕рд┐рдВрдЧ Illegally Go to canada to USA,https://www.youtube.com/watch?v=TF1PBk-KApo,Going to canada or USA illegally is very dangerous. Please don't trust dishonest agent here is the reality what happen 4 Indians ...,UC0MMe35tbS8BDJdEbGILBpA,India Wild Films
52,390.0,vkWI7Q1s5Ec,2022-09-28T17:45:00Z,usa donkey I india to usa I donkey by truck I #shorts,https://www.youtube.com/watch?v=vkWI7Q1s5Ec,shorts #freevisaadvisor #usdonki #usdonkey #usvisa usa donkey I india to usa I donkey by truck I My other Youtube Channel for ...,UC4mifYMs39uMhHSBeP64dCg,Free Visa Advisor
53,391.0,cAo_-efHHek,2022-08-07T05:22:49Z,UsaЁЯЗ║ЁЯЗ╕ donkey wale California#reels# border crossing time# mexico#india to usa donkey#pakke Usa wale#,https://www.youtube.com/watch?v=cAo_-efHHek,,UCKxtKddBhN0JUbYptQBUtpA,Usa Donkey Wale CALIFORNIA
54,394.0,0PTWcovnhpQ,2022-10-15T11:21:40Z,India In To USA Donkey Full Details | USA Donkey  | рдЗрдВрдбрд┐рдпрд╛ рд╕реЗ рдЕрдореЗрд░рд┐рдХрд╛ рддрдХ рдХрд╛ рд╕рдлрд╝рд░  | India To USA,https://www.youtube.com/watch?v=0PTWcovnhpQ,usadonkey #usadonkeyfulldetails #yourimmigrationchannel #donkytube #usadonkyindia #donkey2022 рдЗрдВрдбрд┐рдпрд╛ рд╕реЗ ...,UCp9cJSP1E9QGI24QKQFkRcw,Your Immigration Channel
55,397.0,bjvkVc8gEjQ,2022-11-08T14:56:13Z,"#subscribe #100k  #indiatocanada.#donkey #canada #usa new status рднрд╛рдИ рднрд╛рдИ рдХрд╛ рдкреНрдпрд╛рд░,ЁЯЗиЁЯЗжЁЯЗ║ЁЯЗ▓ЁЯШШ",https://www.youtube.com/watch?v=bjvkVc8gEjQ,america wala song munda pind vich vaje america wala full song munda pind vich vaje america munda pind vich vaje america ...,UCX07omthghq5pM4ZEGqMJvg,India to canada
56,398.0,AEm7k-99Blo,2023-01-31T09:23:53Z,donkey India to USA ЁЯФеЁЯФеЁЯЩПЁЯЩП #2numabri #donkey #usa,https://www.youtube.com/watch?v=AEm7k-99Blo,,UC2h9f177ldBJQdqG1vjC3UA,2 numbari wale
57,399.0,xfY1knJ08aA,2022-12-24T02:37:15Z,India ЁЯЗоЁЯЗ│ to USA ЁЯЗ║ЁЯЗ╕ || America Donkey || AT Kyrgyzstan ЁЯЗ░ЁЯЗм- 30 ┬░C temperature || #usa donkey,https://www.youtube.com/watch?v=xfY1knJ08aA,,UC_jmCHS4CfP-cUU7KfoQISA,Amit Sharma
58,401.0,t2bgW3Yic6w,2019-06-18T03:26:48Z,Donkey India to USA with flight in june,https://www.youtube.com/watch?v=t2bgW3Yic6w,This video are copyrighted....,UCP57seAsZQVhveLuq3Xvh9w,Vicky multani
59,404.0,yzACNo-bsZI,2020-08-21T04:45:01Z,new video US Mexico border donkey  || USA KI DONKEY.,https://www.youtube.com/watch?v=yzACNo-bsZI,new video US Mexico border donkey USA KI DONKEY. TEACH VISA PUNJABI === https://bit.ly/3aM6jAp ...,UCYyk3C5bP0IVvukAnGibl7w,TEACH VISA
60,405.0,oMTMx2TgE6I,2022-10-15T06:30:23Z,USA DONKEY ЁЯЗ║ЁЯЗ▓ VIDEO || AMERICA DONKEY ЁЯЗ║ЁЯЗ▓ VIDEO || Masti Time Turki Airport #usa #shorts #viral #2022,https://www.youtube.com/watch?v=oMTMx2TgE6I,USA DONKEY VIDEO || AMERICA DONKEY VIDEO || Masti Time Turki Airport #usa #shorts #viral #2022 2 Numabri ...,UCtLr-VlUjuxh4zUQA6pu_zg,2 Numbari USA Wala
61,410.0,3uETwutQGEI,2022-09-30T14:26:46Z,Europe donkey |europe border crossing|pendu Jatt #donkey #europe #shorts,https://www.youtube.com/watch?v=3uETwutQGEI,Europe donkey |europe border crossing |pendu Jatt #donkey #europe #shorts Europe donkey #usa donkey #uk donkey Australia ...,UC4VGQZ7InyxCUBWgoltQbqg,Pendu Jatt ( рикрйЗриВрибрйВ риЬрй▒риЯ )
62,411.0,6QOgo10Fuc4,2023-01-01T13:24:34Z,ЁЯЗоЁЯЗ│ india to USA ЁЯЗ║ЁЯЗ╕ donkey kon kon s raste s jaye jate h complete video #donkey #usa #@ashuror22,https://www.youtube.com/watch?v=6QOgo10Fuc4,How to Get subscriber on YouTube fast | How to Get 1000 subscriber on YouTube.,UCnHSERyeGFQnPlOsRX3XjXQ,USA ЁЯЗ║ЁЯЗ╕ alaa Amitmalik6700
63,412.0,6CvbldCsGyI,2023-01-20T12:43:32Z,India ЁЯЗоЁЯЗ│ to America ЁЯЗ║ЁЯЗ▓ [latest video 2023] #donkey #2numbri #youtube #shorts #video #viral #usaЁЯЗ║ЁЯЗ▓ЁЯОптЫ│я╕П,https://www.youtube.com/watch?v=6CvbldCsGyI,[Finally usa      тЫ│я╕П],UCVt0-0UpF2Cgd8BPawWebBw,usa_2numbri_wale56 
64,415.0,y7gJHigj2VI,2022-12-12T01:31:39Z,USA Donkey I India to USA I #shorts,https://www.youtube.com/watch?v=y7gJHigj2VI,shorts #usadonkey #usadonkey2022 #freevisaadvisor USA Donkey I India to USA I #shorts Free Visa Advisor don't promote ...,UC4mifYMs39uMhHSBeP64dCg,Free Visa Advisor
65,430.0,WfxSFRrtt-4,2022-07-29T13:33:46Z,USA donkey 2022 | Mexico border crossing тАв indian boys | USA donkey 2022,https://www.youtube.com/watch?v=WfxSFRrtt-4,usa #usadonkey #america Usa donkey video mexico border crossing 2022 boys #usadonkey #donkey #america ...,UCypuIdlqQELMH_vKb5FMcbQ,Indian American
66,431.0,0XfVsJvWnWM,2022-12-27T05:16:46Z,Maxico to usa Donkey Latest Update | Maxico Border рд╕реЗ рднреА рднрдЧрд╛рдиреЗ рд▓рдЧреЗ,https://www.youtube.com/watch?v=0XfVsJvWnWM,Maxico to usa Donkey Latest Update | Maxico Border рд╕реЗ рднреА рднрдЧрд╛рдиреЗ рд▓рдЧреЗ MAXICO TO USA BORDER DONKEY UPDATE ...,UCzUuSLnlDg59Zs0Qi2h_QlA,TRUE INDIAN RD
67,434.0,tl41dxWioqg,2022-06-29T11:22:55Z,USA Real Sad story of USA Donkey | USA DONKEY TRUTH | MEXICO TO USA,https://www.youtube.com/watch?v=tl41dxWioqg,"риЕриори░рйАриХри╛ Donkey рижри╛ риЕри╕ри▓ ри╕рй▒риЪ риХрйА ри╣рйИ America рикри╣рйБрй░риЪрйЗ 46 ри▓рйЛриХри╛риВ рижрйА риорйМрид, риЯри░рй▒риХ риЕрй░рижри░рйЛриВ ...",UCRE9zegAYAOchRkZqfS-djg,Paramount e Services
68,437.0,vWuO-5zTgmk,2022-07-29T11:11:05Z,USA Donkey 2022ЁЯЗ║ЁЯЗ╕|new update|India to Usa|#donkey #usa |panama camp 3,https://www.youtube.com/watch?v=vWuO-5zTgmk,USA Donkey 2022 | new update | India to Usa |#usa #donkey | Panama camp 3 plz subscribe my channel ...,UCGX2FGGulDSJHaEMa0uNOfg,Nishu Deswal Hr31
69,440.0,bZaR9pn0oBQ,2021-06-20T07:16:43Z,Donkey india to usa indian part 2 римрй░рижрйЗ рижрйА ри╣ри╛ри▓рид рижрйВриЬрйЗЁЯШВ рижрйЗри╕ри╝ риЪ Donkey maxico to usa ЁЯШБy aa koi chakkr риирйА,https://www.youtube.com/watch?v=bZaR9pn0oBQ,india#usa#donkey#border#crossing#Punjabi#funny.,UClqV3vx82_HYiBjPbqtUlIw,Life Luck game
70,442.0,8LHmwX9Pq9I,2022-05-10T00:26:14Z,usa donkey ЁЯШФЁЯШФ //dream usa //indian boys,https://www.youtube.com/watch?v=8LHmwX9Pq9I,,UC8sMmsqMJN3BLB-AlI4hSlw,ER. YAGYA PANCHAL
71,445.0,tjBdtgHTgPg,2022-07-29T13:31:51Z,USA Donkey video 2022 | Danger situations in america donkey ЁЯЗ║ЁЯЗ▓ | india to america donkey video,https://www.youtube.com/watch?v=tjBdtgHTgPg,Usa donkey video mexico border crossing 2022 boys #usadonkey #donkey #america #indianinamerica #usadonkeyvideo ...,UCypuIdlqQELMH_vKb5FMcbQ,Indian American
72,452.0,t8w36Jb6Ass,2022-06-08T08:28:48Z,Usa donkey HARYANVI.      #usa #donkey #usadonkey #internationalstudents #haryanvi #choudhary #india,https://www.youtube.com/watch?v=t8w36Jb6Ass,,UCrKfq2DGFUAVee9UGstfTmw,love ror
73,457.0,myKtn4MkqRg,2022-03-07T02:55:58Z,USA Donkey in panamas prelious jungle #usa #donkey #india #hrd #punjabi #views #viral #shorts,https://www.youtube.com/watch?v=myKtn4MkqRg,,UCJEPGRrGXIVJgGdCcpUBnfA,jaat
74,458.0,01wk1Bx3giU,2022-09-24T15:30:20Z,Full Video Of donkey #america,https://www.youtube.com/watch?v=01wk1Bx3giU,america #donkey #usa #us #2022 #2numabri #students #mexico #m├йxico #mexican #india #punjabi #haryana #gujarat ...,UCjTHIkgghGqhlrGoTHBljbg,Scammer 2.O
75,474.0,Z9mROrgUnvM,2022-10-07T01:31:53Z,USA Donkey I india to usa donkey I риЗри╣ риЬрй░риЧри▓рйЗ риорйМрид рижри╛ риЬрй░риЧри▓ риП,https://www.youtube.com/watch?v=Z9mROrgUnvM,shorts #shortsvideo #usadonkey #usadonkey2022 #freevisaadvisor USA Donkey I india to usa donkey I риЗри╣ риЬрй░риЧри▓рйЗ риорйМрид ...,UC4mifYMs39uMhHSBeP64dCg,Free Visa Advisor
76,492.0,2lREN8jYoGQ,2022-04-14T10:12:48Z,India to America VIA Donkey ЁЯЗ║ЁЯЗ╕ @donker #donkey,https://www.youtube.com/watch?v=2lREN8jYoGQ,Donkey by punjabi and haryanvi boy........ #donkey #panama #students #student.,UCXMfqD7XTZbc-9XlLIALJXg,IELTS WALE ЁЯЗиЁЯЗж
77,495.0,u4u-_piR3ug,2022-05-04T02:00:09Z,America ki donkey in August | india to usa | PUNJAB TO USA |,https://www.youtube.com/watch?v=u4u-_piR3ug,,UCBGjXFBZMjZ3GodrxmnMHrw,mohit traveller vlogs 2046
78,497.0,sKC6oMIVzEs,2022-11-27T01:30:23Z,USA DONKEY ЁЯЗ║ЁЯЗ▓ VIDEO || AMERICA CAMP || PERU TO AMERICA DONKEY VIDEO #usa #trending #shorts #viral,https://www.youtube.com/watch?v=sKC6oMIVzEs,USA DONKEY VIDEO || AMERICA CAMP || PERU TO AMERICA DONKEY VIDEO #usa #trending #shorts #viral 2 Numabri ...,UCtLr-VlUjuxh4zUQA6pu_zg,2 Numbari USA Wala
79,508.0,tZ_WGfbZcc4,2022-12-25T11:26:30Z,india to america train|| #shorts #viral #trending #donkey #america #canada,https://www.youtube.com/watch?v=tZ_WGfbZcc4,,UCnraamCk9ZqGj3bg0Jbu6Zw,KUCH B
80,509.0,GAG5257eDGI,2022-08-04T04:39:45Z,DONKEY AMERICA ЁЯЗ║ЁЯЗ╕ USA DONKEY || MEXICO BORDER CROSSING TO USA PUNJABI @nishudeswalhr31,https://www.youtube.com/watch?v=GAG5257eDGI,"DONKEY AMERICA USA DONKEY || MEXICO BORDER CROSSING TO USA PUNJABI USA DONKEY 2022 ,INDIAN BOYS ...",UCGX2FGGulDSJHaEMa0uNOfg,Nishu Deswal Hr31
81,510.0,SfGODMla57Q,2022-08-25T12:50:56Z,"USA donkey 2022 , Live boys and girls enter to Mexico border India to amarica",https://www.youtube.com/watch?v=SfGODMla57Q,,UCzgeGx5CJxBAODMOEZs8mqw,2 Numberi Usa WalaЁЯЗ║ЁЯЗ╕
82,512.0,wGTuucCoyQI,2022-12-08T00:00:29Z,not easy usa donkey ЁЯЗ║ЁЯЗ▓ЁЯЗ║ЁЯЗ▓ЁЯЗ║ЁЯЗ▓,https://www.youtube.com/watch?v=wGTuucCoyQI,,UCMe1-WksNvtO_76XrXOoE4Q,Aryan ror
