,videoId,new_comment,author_name,author_id,replies
3024,qoZSg-DErE0,Ror bhai bot mila oga,What do FOR YOU,UCDan9ucTE9Sgg2iNCB6U3IA,[]
3025,qoZSg-DErE0,"Khush rho Ladlo,,,✌️",MDAnee,UCwap4hxkI1tlWlxQ8G_gDXA,[]
3026,qoZSg-DErE0,Agent ka number do Delhi ka,neeraj singh,UCFzRxWkD57lPkqeY8j3_-dg,[]
3027,qoZSg-DErE0,Please phone number,neeraj singh,UCFzRxWkD57lPkqeY8j3_-dg,[]
3028,qoZSg-DErE0,India में थोड़े काम इतने बिजनेस है इंडिया में विदेश के लोग इंडिया आ रहें है और तुम 40 lack लगा इतने खतरे में मरने अमेरिका जा रहें हो अरे मंदबुद्धि 😀😀😀,Pawan kumar saini,UC4pJ0ChV0hyyxhavqiRXGuw,[]
3029,qoZSg-DErE0,पहुंच तो गए अमेरिका पुलिस अब तुम्हे छोड़ देगी क्या USA पुलिस जेल में डाले गि अब,Pawan kumar saini,UC4pJ0ChV0hyyxhavqiRXGuw,[]
3030,qoZSg-DErE0,Pase khod liye the brazil police fer kit t mile pase,Pardeep Sharma,UCa0XotSURJ2aDjHYJ9JjCUw,[]
3031,qoZSg-DErE0,Gorkhaa ko prsaan kar diya aap ne,Sheetal Lohan,UCkiB6RYzuwNY5ZfIdhKAXBg,[]
3032,qoZSg-DErE0,Veer ji mne ak donki video dekhi thi usme to bol re the hamare phone agent le lete hai lekin aap ne pura vlog hi bna lia ye kse hua,manraj gahlot,UCCvf34Z78z4BPlxRQcveiWQ,[]
3033,qoZSg-DErE0,Bhai Paisa kitna lg geye,Never Give Up,UC7iilPgWfoXC8DK151iVKCw,[]
3034,lAETvBN-S6Y,Allah rahem karre,Afrin Taiyyabali,UCikNsdsNDNNvojDd4g9pBBw,[]
3035,lAETvBN-S6Y,Bahut Bura hoa   So sad incident,gora studio bathinda,UCDBCQsSwy7A-XkJnRP1EAUw,[]
3036,lAETvBN-S6Y,"Very sad,",Capri's DIY World,UC7dYrDEhA596-WDBAiROBKw,[]
3037,lAETvBN-S6Y,sir please shear your email id,indresh maurya,UCCDkkDY8xvC29syP6TUTCJQ,[]
3038,lAETvBN-S6Y,G sir soo sad,Malak Salman khan,UCWEpVOcm047nj9hkqshTnBA,[]
3039,lAETvBN-S6Y,Very sad sir,Kakali Debnath,UCX9a_tKSTx2l2_BfMHVvh5g,[]
3040,lAETvBN-S6Y,God bless you brother 💕🙏,Piyush Gautam,UCdsXHdsM6IvE5PhH2H2eFJQ,[]
3041,lAETvBN-S6Y,Allah Pak sub ko aqal or shaoor atta fermaen Aameen,Amjad Toor,UC1cBjGIQsuTXsTtDG1lolzw,[]
3042,lAETvBN-S6Y,Bhai bohat koshah kya likn kya kry yrrr koi rasta batawo plz plz plz,Jamsher Khan,UCPMe_olFgVppeEQfnfSw22A,[]
3043,lAETvBN-S6Y,So sad incident. Why people lost their life for fucking America and Canada.😱😱,Prem Bala,UCL3lE8_WfJNwKK0-SpHYOWQ,[]
3044,lAETvBN-S6Y,India me to Bissness man apna Bissness band kar ke chale gaye other countries.or jesa India me dikha rahe he vesa nahi he. log kya kare. choti family ese raste chunte he majburi me. kyu ki unhe bhi aage badh na he sab ki tarah.😢,IRSAD HUSSAIN,UCDigVvBDycE1bkxmAL470gg,[]
3045,lAETvBN-S6Y,"Ye sub chizain log dakhty han phir b apni zindgi DAO pe lga daty han,",zarina changez,UCM-UKDs1Y_kWzc3qhvAYQrg,[]
3046,lAETvBN-S6Y,"Insani smuggling ha ye agent logon ko Khuda ka khaof hi ni ata Apne humwatnon k sath dhoka karty,",zarina changez,UCM-UKDs1Y_kWzc3qhvAYQrg,[]
3047,lAETvBN-S6Y,Jazakallah Hu Khairan kaseera 🤲,Irfan Ali,UCMoosoAN2nHtjRXWAW-HrQA,[]
3048,lAETvBN-S6Y,so bad brother,Shahab Ali,UC-CYBWjg87z8XiwbKBdtnzg,[]
3049,lAETvBN-S6Y,European format CV canada job ke liye useful hai? Ya Canadian formate different hai?,Sunanda Bhosale,UCp4snvduXWBwPDqM0Uk7rIA,[]
3050,lAETvBN-S6Y,"Astaghfirullah....
Allah pak rehm farmae sub par...",Hira'sDigest,UCYYAalLuxsxIygpo2PnvUrw,[]
3051,lAETvBN-S6Y,Allah pak mazeed kamyabi dy,Shorts Vedio With Liaqat,UC0wJVKKxiyoY8vTmrjMjfIA,[]
3052,lAETvBN-S6Y,Bhut achi information hi bhi,Shorts Vedio With Liaqat,UC0wJVKKxiyoY8vTmrjMjfIA,[]
3053,lAETvBN-S6Y,As salaam o alaikum bhai,Arsalan Haneef,UCb4_4QioxKnEnJqQoGXcMPw,[]
3054,rGs804hBPxI,"Kitne din lgte hai bhai camp me,plz tell me",Preet Choudhary,UCIA7h0azMVgMTlpTIMGwzPg,[]
3055,rGs804hBPxI,👪family kitne din me bahar nikal jati hai plz reply,Dasharath,UCiHaWM_Eg4bLovN6UJzLI9A,[]
3056,P7ZcPEdxTyI,Haan Thik hai mat koi bhi bhai aise magar ye aadhi baate jhut bol raha hai,Abhinav Gupta,UCHRxqzmNpgkQ7qK_0aKXjrQ,[]
3057,P7ZcPEdxTyI,Sab jhut bol raha hai,Abhinav Gupta,UCHRxqzmNpgkQ7qK_0aKXjrQ,[]
3058,P7ZcPEdxTyI,bhai tum farji video kyu bnate ho.,Ankit Sharma,UCNhfPmHRBaW9w5pUK7Lm5Rg,[]
3059,P7ZcPEdxTyI,Dhanyavad bhai .......mai kal Jane vala tha .....aapne meri aakhe khol di,2 number Bhai,UCNO8OD-2PPzUo5jCHJZjX1A,[]
3060,P7ZcPEdxTyI,bhai jana hi hai to legally jao varna bhart accha hi hai 🤗🙏🏼,AKKI SHORT'S,UCQ8xXhFZgw2hhHrjso3WY-g,[]
3061,P7ZcPEdxTyI,Main v Serbia to donkey layi te Hun main Germany AA,Vikas Rajput,UClaUK86JA6Bmf-_cZTP7zIQ,[]
3062,P7ZcPEdxTyI,Agar vedesh Jana hai to sidhe raste se jao donkey lagakar Mt jao bhaiyon 🙏🙏,Kamboj Saab,UC566KLk3EntZRfkTr-_Pxvg,[]
3063,P7ZcPEdxTyI,"Aisa bhi kuch Hota h donkey traveling pehle baar Pata chala bhai..thank You..hope ki ab aise illegal way se koi na jaaye..or I
USA na bhi gaye to problem hai...just try to only legal way.",Motivational Movies & Hollywood movies,UCoBQFvEsB6oNtISPhot0SgA,[]
3064,P7ZcPEdxTyI,Aisa hi hona chahiye pade likhe anpad gwaro ke sath...,pankaj verma,UClgPb5hT7ygIMq55FBojz_Q,[]
3065,P7ZcPEdxTyI,जब तक देश मे आरक्षण रहेगा। सवर्ण जाति के लोग भारत छोड़ कर विदेशों को भागते रहेंगे। एक दिन भारत मे मुस्लिम और दलित ये ही रहेंगे। हिन्दू भारत छोड़ कर भाग चुके होंगे। कयूँ की सवर्ण हिंदुओं का भारत में अब कोई भविष्य नहीं रहा।,chandra pandey,UC-Bg3PCC1-DrE5-r2DhJrFg,[]
3066,P7ZcPEdxTyI,नेताओं की मिली भगत से ये सारे गंदे काम होते हें। 2014 में बीजेपी के आने के बाद हर तरह के अपराध नेताओं के साथ मिली भगत से हो रहे हें। ऐजेन्ट के खिलाफ कोई भी कार्यवाही नहीं होती है। ऐजेन्ट भी नेताओं को मोटा माल खिलाता है।,chandra pandey,UC-Bg3PCC1-DrE5-r2DhJrFg,[]
3067,P7ZcPEdxTyI,देश धर्म का नाता है गाय हमारी माता है भाइयों डोंकी लगा कर मत जाना नहीं तो वह गौ माता का मांस खाने को देते हैं,Suresh Kumar,UCga0FyvSrMyQIMOwMOlJbKg,[]
3068,P7ZcPEdxTyI,"Jo pahunch gya use ke liye sabkuch nadiya h
Or iske jese bahi ke sab kuch bekar h",Sheetal Lohan,UCkiB6RYzuwNY5ZfIdhKAXBg,[]
3069,P7ZcPEdxTyI,Kuch nahi h india me...,azad,UCwvlExk4dorASlGdRumm6bg,[]
3070,P7ZcPEdxTyI,Asa kuch ni mare bahi,cable news 4 2. 0,UCwJ4PE5YhsjS8KRnE1yiiSA,[]
3071,P7ZcPEdxTyI,U film banawa u bass,cable news 4 2. 0,UCwJ4PE5YhsjS8KRnE1yiiSA,[]
3072,P7ZcPEdxTyI,बकवास लोग क्या जरूरत हे इन chitiyo को..,Technical Analysis Classes,UCCdE9oTchcKdJpKLMqC2BDw,[]
3073,P7ZcPEdxTyI,Kam Khao Bharat nahin Khao,Rana Rajvir,UCBDQoWVl1fDMXYYKcsyjwsQ,[]
3074,P7ZcPEdxTyI,Bharat mata ke ja,Rana Rajvir,UCBDQoWVl1fDMXYYKcsyjwsQ,[]
3075,P7ZcPEdxTyI,Bhai thoda kmakr kha lo pr apne desh me hi rho ye Ram Krishan ki dharti h,sarita sharma,UCU7fPe8ckht66V7tn5pJ0eg,[]
3076,S5l992LdpCs,😍😍😍😍,Shakti Rai,UCS2MImuNR66AAahLM-WdYqQ,[]
3077,S5l992LdpCs,Nice 👍👍,Surjeet Singh,UC-uMJ-_cUMoMX4yqM-lXHcQ,[]
3078,2JtMr8TTG5g,Vrr mnu ve donkey lva dbo,Gurjant Bhullar,UCVI1AFLakD6amk5h-70hCrQ,[]
3079,2JtMr8TTG5g,Suriname to usa how can we reach,Manupratap Rana,UChcqmPGOJIeVkfT7AWs5nzA,[]
3080,2JtMr8TTG5g,Thnku for great update..tuhada way of talking bhut acha a veer g,lovepreet singh,UCzhWEB1hoZfiPD0DopP7iBA,[]
3081,2JtMr8TTG5g,Bhai main apse bat karna chahta hun,SADIQ PARWANO,UCbpBJhC97pfOavLt37tbCcQ,[]
3082,2JtMr8TTG5g,https://youtu.be/MAa3AzA9b34,Partap Singh,UCn_Jd229Sc3KY_rub6NdPsA,[]
3083,2JtMr8TTG5g,paji Agar  Bahamas se Miami donky lagate huve pakde jane ke baad kya hota h,Davender Sandhu,UCLr0wvyN6mirK_2RDqs2lqg,[]
3084,2JtMr8TTG5g,paji Bahamas me fase huve kyaa kare,Davender Sandhu,UCLr0wvyN6mirK_2RDqs2lqg,[]
3085,2JtMr8TTG5g,Bhai agent ka koi contact hai kisi k pass to pls.dsyo,Ankit Kundu,UCSy733bPMCXBuoE6A71quww,[]
3086,2JtMr8TTG5g,Bahamas latest updates daso,Ustad media,UCBCKilvvBi5bPVjNxrEfALg,[]
3087,2JtMr8TTG5g,Bahamas bara daso,Ustad media,UCBCKilvvBi5bPVjNxrEfALg,[]
3088,2JtMr8TTG5g,Paji turkey wala rah thik aa ya nahi agent kenda phela turkey lake jana fer Mexico  daso koi ese rout thik aa?,Kml Kaur,UCATf3m4FR7fcBIxANqHMW8g,[]
3089,2JtMr8TTG5g,Bahmass ki ky repot hai bhai,Saleh Pal,UCLnSZK3pk4CK_-vOSa6dj1g,[]
3090,2JtMr8TTG5g,Bhai Cuba to USA ki koi new video banao,Abdullah Mehmood,UCSdppL1_87Ud9DBrgwa7h6g,[]
3091,2JtMr8TTG5g,Veer gall kida ho skdi thode nal?,Harpreet Singh,UCg3-7R4XtQvJNctno8XN0fQ,[]
3092,2JtMr8TTG5g,Mexico de border di ki information aa bro otho de k halaat ne,Dilraj Singh,UC0vcaofeu4G6DWNTS1q6hLg,[]
3093,2JtMr8TTG5g,Under age Vara update do,Vishu Mandhar,UC1ppEVhxaWzxmLkI9ypq0eg,[]
3094,2JtMr8TTG5g,Bro bond kina panda pya,SHANTY KUMAR,UCmI8QfqtpDSeB8WX2D6kLDQ,[]
3095,2JtMr8TTG5g,Bahamas to u.s jaana sokha hga!!!????,Aman Saini,UClsgPCQ-ClxZgOdq_30WHtA,[]
3096,2JtMr8TTG5g,Dubai Tu Mexico the visa  milta veer,Gursahib Sekhon,UCAlAwTFnoapMpowOSt4ywbQ,[]
3097,2JtMr8TTG5g,Bhai abhi kam chal rha hai kya mera bhai dubai hai depot too nahi ho jayengi bhai,Ankit Ankit,UCoYZ4DI2mljL3sSScZhHTmA,[]
3098,s0TVIdtEU3w,Yeh Saab pagal hai usa par 23 lakh crore ka debt hai . Jis din international market se dollar replace ho gya USS din yeh desh barbaad hai .,virender pal,UCqlpmngtGOgGOKUc_fQly-w,[]
3099,s0TVIdtEU3w,sir jaise donky maran vale da docoment me date of birth alag alag ho to kya koi problem ho sakti h or janam ptri nhi h uski,Som Pal,UCh-gxjHUW4_Wg5YuCL9jLGQ,[]
3100,s0TVIdtEU3w,Sir what's number send,Imran Ali,UCfMdEcChaFfR2VnmCZeh09Q,[]
3101,s0TVIdtEU3w,Subscribe k badley subscribe,SHAMO PUBG,UCY9a4x1uLw1sxSysgo0IgEA,[]
3102,s0TVIdtEU3w,Hlo 22 Tera Instagram  account ni Chalda pra  ????,Rajdeep Singh,UCUuNlfi2k46wZfE9e7QgIQQ,[]
3103,s0TVIdtEU3w,Tera channel ty strik den lgya kal evening tak da time aa tere kol eh videos meria wa tera channel terminate hoju,Amandeep sharma,UC1jJoq39j_7KOmQvhaEpWeA,[]
3104,s0TVIdtEU3w,Bhai Indian ki entry dikhao video me,Pavan Singh,UC8Vd43TrdL3QUsFT8uvZJ1Q,[]
3105,8UIuCAerzdU,Aí vai mecher com quem tá quieto,Maria Aparecida,UCxHbWVSHnyVYBJC5m8ZZ5Ig,[]
3106,8UIuCAerzdU,I bet that dog will think twice to mess with a donkey,James Giddings,UC2a7desig8ckHX4qsy7BAwA,[]
3107,Ab11QMFo99E,Koi dikkat to nhi,Inderjeet Singh Bhangu,UC4xCPrK5MhCVpSO2mr2_-1g,[]
3108,Ab11QMFo99E,Donki se ana chahta hu,Inderjeet Singh Bhangu,UC4xCPrK5MhCVpSO2mr2_-1g,[]
3109,Ab11QMFo99E,Bhai ram ram,Inderjeet Singh Bhangu,UC4xCPrK5MhCVpSO2mr2_-1g,[]
3110,Ab11QMFo99E,Bhai kitne din me pahoche,Rocky Rock,UC8YlLo135WU4wt-eT6TjN-w,[]
3111,Ab11QMFo99E,Bhai ji plz me be ana chata hu apna agent ka number ya ya uska address de do,Rony Saroha,UCEKlr85nDvYw5li_DwCGN3g,[]
3112,Ab11QMFo99E,Bhai mera chora n bhi aana h apna agent ka no do n,prem parkash,UC7F-3NTy1vh_yzgsK8Vwhuw,[]
3113,Ab11QMFo99E,jai baba ki,Ranbir Dahiya,UCFZtXo_VaRUonRTH0_avajA,[]
3114,dEBBpFtQPyM,Elephant crossing the border,Arif Uddin,UCA4uDSMWFfROBOV9IW3SFXQ,[]
3115,dEBBpFtQPyM,Ehne gril tood deni aa lagda,DaKu,UCtwi2x6KJ0hBpPBZ8BMmU5Q,[]
3116,dEBBpFtQPyM,Odunu police aa jo gi,Gurmeet usmankheriya,UCJQoW9SbaRFwS0HQeZc0Xiw,[]
3117,AP6OyY_yon0,Insha'Allah ap ke sare video WhatsApp group me share kero ga or slow slow kerta jaa reha ho,Aamir Ali Leghari,UCtUoAyHDY8mzvQgVOW9UWzQ,[]
3118,#NAME?,Apna phone number sand kardo g,Satnam Grewal,UCYCJz1YBm_YNDaEyY7gHTZg,[]
3119,#NAME?,Maange sera 🔥🔥🔥,Ankit Only,UCJHIVuzi7zFPWz0oUaui46Q,[]
3120,#NAME?,"Kia Hal ha Bhai 
Apsy rabata Kis tarha krna ha 
Baat krnii ha apsy",Syed Zeshan,UC3U9Ucqu4-G4EMxidM3wKdg,[]
3121,#NAME?,अब ये पिछली वीडीओ डाली है k,Anil Ror Namberdar Kurana,UC7Sjptqmrs-8wC3kCl8dlgQ,[]
3122,#NAME?,Hi,Monu Bumbra,UC3DbkYtsBu_5DCx5E06FXhw,[]
3123,#NAME?,Bhai esbaar poster change krke video upload kara kroo..,a p action network,UC5MYExxKWtB9JXylVyc916A,[]
3124,#NAME?,Ram Ram bhai,kd yadav,UChgySe9Tw4hF1a2pgdv64cQ,[]
3125,#NAME?,👍👍,a p action network,UC5MYExxKWtB9JXylVyc916A,[]
3126,I8vScSQsjqE,Apne hath m hota h kya govt lena ?,Sahil_Sharma1,UCqhVYrw59QBikJt2-b5JORg,[]
3127,I8vScSQsjqE,govt kisti or privet kisti ka kya chakr h bai,Sunil Malik,UCVMlBVYJy3w69LksbWdNgLw,[]
3128,I8vScSQsjqE,ye govt kisti h kya bai,Sunil Malik,UCVMlBVYJy3w69LksbWdNgLw,[]
3129,I8vScSQsjqE,Bro don't mind but ..in sab videos pr usa immigration ki najar hai ... Or har ek rasta or pick point check ho rha ...so please ap jo bhi video yha uplod karte ho dhayan se Bhai...,Mandeep Raj Rana,UCVsnDYu-hOVEG2MJQ7Dh8sQ,[]
3130,I8vScSQsjqE,Panama cross krnaa kaa baad Mexico tk kyaa hota haa os pr vedio bnaoo,JASHAN PAL,UCie_hVLT8pkWhwcJi_JHiAg,[]
3131,vkhR-jVoCOQ,tere abbay nay konsi machine bnai hy jo 20 mint me america ponchaye,Motu Patlu Unlimited,UCk2V1X4YYs8n6PQCE5bND5g,[]
3132,vkhR-jVoCOQ,250km ka fasla hy bhosri kay,Motu Patlu Unlimited,UCk2V1X4YYs8n6PQCE5bND5g,[]
3133,vkhR-jVoCOQ,Teri Information Tay V Lanat.. Aslaka Deya Salaya... Pehly Alaska Bolna Tay Sikh lay... DFM,Mubeen Sarwar,UCapfyUM5TOTpkEWhK6TlfXg,[]
3134,vkhR-jVoCOQ,"Aslamualikum,ap ya btao k Kuch madad kr dakty ho ap is donky k leya",ch assad ali,UC0MEzQElw_tNqsG9WMsk7oA,[]
3135,vkhR-jVoCOQ,Bahi ny sahi bola k pehlay chota country jaoo or kamao phr bhara country jao mera frnd b 5 saal dubai kam kiya paisa jora or ab wo canada hai so hum life py risk maat lo .jaan ho to paisa b a jata hai paisey k pechay etna na bagho k apni jaan sy jao,Mohsin Tahir,UC3aelhpkvNZVMKsDwa0fc0g,[]
3136,vkhR-jVoCOQ,Es raste se ahogey tu gand freeze ho jayegui aur tati bi🍧,Imran Nadeem,UCO2Ok-5a7zGPyiFd8VcMgaQ,[]
3137,vkhR-jVoCOQ,جهوٹے پر خدا کی لعنت هوتی هے ٹوٹل بکواس 6000KM کا سفر کرنا بچوں کا کهیل هے روس کے بارڈر پر پولیس نهیں بیٹهی اور الاسکا میں -40 منفی میں سپر مین هی سفر کر سکتا هے صرف جهوٹا ٹائٹتل لگا کر ویڈیو کی ریٹنگ بڑهانے کے لئے اتنے جهوٹ خدا کی پناه.,waseem akram,UCPH2d_702xhGPElIVzBdnqw,[]
3138,vkhR-jVoCOQ,اسلاکہ نہی بھائ الاسکہ Alaska صحیح اردو بولنا تو سیکھو اگر وڈیو بنانے کا شوق ہے میں تو تمہارے جییسے جاہلوں کا چینل کھبی بھئ سبسکرایب نہی کروں,Iqbal Khan,UCZOFaVEiZNGUqlZO9uCxOUw,[]
3139,vkhR-jVoCOQ,do or dai,True TV1,UCo20qP_h1C7lkU9kzTK1_pA,[]
3140,vkhR-jVoCOQ,Mashallah 😍,Technical Ali,UChRBauTSn5GNWyzX_jNN11Q,[]
3141,vkhR-jVoCOQ,"This is very surprising information for me,  I am also living in North America, and I have never heard this before, firstly it is mostly impossible for any person specially Pakistani or Indians to survive in Hell of snow , in -60 or - 70 Digree centigrade., Impossible route.",Durrani's America,UCFXox75bkAYVB44TERuOn9Q,[]
3142,vkhR-jVoCOQ,Bhai aplog itne chutia kun hei ke maloomat hei na ho or video banadeya,AMAZON TOP DEAL,UCmM_hPoKstZWAwv3mUSrp_w,[]
3143,vkhR-jVoCOQ,How much it will cost,maaz ahned,UCP9XFLhyH3s0_i54Xkinh4w,[]
3144,vkhR-jVoCOQ,New information for me,Ulfat Hussain,UCGsLTqbTA_91tyDAXHD-mhQ,[]
3145,vkhR-jVoCOQ,Bohat assaaan hai like lena,Tag Master,UC5THk92a00PCLu1-7o1mbBA,[]
3146,vkhR-jVoCOQ,canada jany ka ak asan rasta ha,Knowledge,UCP0ivuyTBuByeuT52FEkcmA,[]
3147,vkhR-jVoCOQ,Sir please aadirbahijan Sy itly ka rasta bi btaya,Imran Khan,UCV6h5s8CmDRJGaoJpG2QHlg,[]
3148,vkhR-jVoCOQ,Dankey mai ny laganywhai usa ki plz bhai koi nahi jaye mai mexico border tuk gaya ho,Saleem Zain,UCA4peiWwGO_H9NUOf8r-ELQ,[]
3149,vkhR-jVoCOQ,Please sir help me I need Canada work Visa please my WhatsApp no00971507678069,Abdul Qudoos,UCdggd3oB1DpEuKBkZJCneeQ,[]
3150,vkhR-jVoCOQ,Russian  mafia  bhot ha,Muhammad Talha Tariq Rashid,UC3ED-jiX2_BMAJhffKQtcFw,[]
3151,GVtHdyX-QMg,https://www.youtube.com/@sakshisharma11user-cg8yg8hy6o,sakshi Sharma ki pagal panti comedy king of India,UCb4EbG5azJ4kq_knpmeFf_Q,[]
3152,GVtHdyX-QMg,🤫🤫🤫🤫,Sangeetapandey@4112,UCmBSzbCsNfKxnkXBMY3k8GA,[]
3153,6WxGGWdV168,🇲🇽Mexico border,Dilbag Singh,UCfY_ZXj13pQOF1Oqy0R9hwA,[]
3154,6WxGGWdV168,New update,Dilbag Singh,UCfY_ZXj13pQOF1Oqy0R9hwA,[]
3155,6WxGGWdV168,Haryana ke kitne bnde h,Dilbag Singh,UCfY_ZXj13pQOF1Oqy0R9hwA,[]
3156,6WxGGWdV168,Donkey jindabad,Dilbag Singh,UCfY_ZXj13pQOF1Oqy0R9hwA,[]
3157,6WxGGWdV168,Nic video,Dilbag Singh,UCfY_ZXj13pQOF1Oqy0R9hwA,[]
3158,6WxGGWdV168,donkey chalu h,Travel Dream Vlog,UCxwjDF4VLM9gmDTKWO8a-MA,[]
3159,6WxGGWdV168,jai hindustan,Travel Dream Vlog,UCxwjDF4VLM9gmDTKWO8a-MA,[]
3160,6WxGGWdV168,good,Travel Dream Vlog,UCxwjDF4VLM9gmDTKWO8a-MA,[]
3161,6WxGGWdV168,nic video,Travel Dream Vlog,UCxwjDF4VLM9gmDTKWO8a-MA,[]
3162,RJUx57h0GNg,Mere jhatke dayachand,Gobind Singh,UCn-S8IFdJIe-p_8Jbw0mIuQ,[]
3163,RJUx57h0GNg,Morning sir. Sir America da border open. H gy kee plz sir reply,Gorav Lalka,UClr8nwsDxc_naIrEQzdLPfQ,[]
3164,RJUx57h0GNg,Bai g aa dso September di ki report aa veer donkey di,Gurjot Jatt,UCGEbQLPHz297gm2HPAyGBFg,[]
3165,RJUx57h0GNg,Veer jihdi family di usa or canada di refusl hoye ta oh usa donky la skda,Gurdeep singh,UCEngU89Pf1M5yfLEA5SfLcA,[]
3166,RJUx57h0GNg,Hun koi usa de donkey lagva sakda hai,Dalvir Singh,UCERP6URXQ6fFDSm4g7T4o6A,[]
3167,RJUx57h0GNg,India to USA kini money Yg,Harindersingh Dhaliwal,UC4NnkemOErqghaEfcPGp5eg,[]
3168,RJUx57h0GNg,Hun donkey open a ja nahi bro ji,Gurlal Virk,UC32QjISOwZCk9BONOQbd7-g,[]
3169,RJUx57h0GNg,Maxico aerport kado open honge please rply,Rebel King,UCfM1qSGbB0AyPOPBo9FSuEg,[]
3170,RJUx57h0GNg,How stay in uk on tourist visa??,Jasdeep Singh,UCHiH-pfiMhemh4f2QUfgC0g,[]
3171,RJUx57h0GNg,Usa kand di hit kini  hun ta time kiwa da donkey  lon wala time ha Panama jangle kiwa da sumender donkey kini time loni pandi,Kamal Bhatti,UCcveXEdfdAoh8y-N7P5IT6w,[]
3172,RJUx57h0GNg,"Paji mere kol Japan da 5 yrs tourists visa he 
Me Mexico on arrival visa le sakda it is difficult or easy please reply",Amarjit Singh,UCy1XKaDNY3LxfwNQhK6OINw,[]
3173,RJUx57h0GNg,delhi tu Flights da ki seen ve open ve ya close Dubai Brazil and Mexico donkey flights August de vich,Lovepreet Singh Ghotra🙏,UCyIC1ZNpQ8o1i67nTECLOSg,[]
3174,RJUx57h0GNg,India to Mexico flight kb open hogi,bhupinderjeet,UCdY_p8Amd6WPI6A8sb5lK8Q,[]
3175,RJUx57h0GNg,Veer gg usa student visa te bnado ik video latest updates,Lakash Multani,UC7OwwVCf58CceFoTMFXBJoA,[]
3176,RJUx57h0GNg,"Texas governor announced southern border state of emergency and arresting prople, Don't listen to false info",Gurminder Kaur,UCBrRcSF6BgsinAkbHz3ZFtg,[]
3177,RJUx57h0GNg,I am US citizen from 25 yrs.,Gurminder Kaur,UCBrRcSF6BgsinAkbHz3ZFtg,[]
3178,RJUx57h0GNg,DON'T SPREAD FALSE INFO ???????????,Gurminder Kaur,UCBrRcSF6BgsinAkbHz3ZFtg,[]
3179,RJUx57h0GNg,Mexico topic,Gurpreet Singh,UCjjKiQRs7v6g4lAda-b7SAQ,[]
3180,RJUx57h0GNg,Panama rehi nahi jana,kabbadi live,UCiSUp7n4PmA9Sze5Xux5AGw,[]
3181,RJUx57h0GNg,Veer seda  mexico jana hai kam khula a,kabbadi live,UCiSUp7n4PmA9Sze5Xux5AGw,[]
3182,FnPZ8pWeSyc,Bro kab pahuch liya usa,clip hunter,UCVzrZHwgMmneda39MUCtecg,[]
3183,FnPZ8pWeSyc,Phone number sand kardo g,Satnam Grewal,UCYCJz1YBm_YNDaEyY7gHTZg,[]
3184,FnPZ8pWeSyc,Bro apna n. De do,ak aly,UCLFLjK9uuVxzVOzpj3LWvOg,[]
3185,FnPZ8pWeSyc,Apka payrate kitna hh,Vishu Kadian,UCgY8tznLxOJQprd3IgqZjPQ,[]
3186,FnPZ8pWeSyc,"Ankit Bhai ji ko Ram Ram
India 🇮🇳 to usa 🇺🇸 jugad successfull kese hua apke sabhi 🇮🇳 to 🇺🇸❤️ bhaiyo ke liye plz proper jarny video banado 
Bhai ji ko Ram Ram ji and plz reply",Hariom Rathore,UCYAJRBAEQ9FL3Qem6nPil2g,[]
3187,FnPZ8pWeSyc,Bhai bht khus h syam baba apke fece pe aise hi khushi bnaye rkhe,Kunj Rana,UC991y2TdyPwahNzQeLppw3g,[]
3188,FnPZ8pWeSyc,Bhai kame mil ga Tena,Indiangamingop,UCakOztCWtuGpaVHzj4NJwEQ,[]
3189,FnPZ8pWeSyc,Bhai rr ❤❤,Gourav Kadyan,UCfoEFuQNsBobUvNVkYogVng,[]
3190,FnPZ8pWeSyc,🙏🙏Ankit bhai,Ankit Choudhury,UCOxegKrQvtcl2Ywq2fg6Qzg,[]
3191,FnPZ8pWeSyc,Nice journey bhai,Rajesh Singroha,UCve1PnzPpnYNTeVSq2i4Q-Q,[]
3192,FnPZ8pWeSyc,Ram Ram ji,Shubham Panchal,UC5PNjrIoItJYwaQ5T9AGNiQ,[]
3193,FnPZ8pWeSyc,Ram ram g,Anshu Kumar,UC314yiqqySt2eJVbNYHJCJA,[]
3194,4l57KHaOpP8,👍,Ritesh Lathwal,UC3cet9aLRUklzdeaEvcplKg,[]
3195,4l57KHaOpP8,🐯🐯🐯,ND Records Haryanvi,UCZHZNxOWHDZdQh17AlhJE0w,[]
3196,4l57KHaOpP8,BHAI DATE OR DIN KON SA HAI BHAI YA BE BTA DYA KARO TAKI BHAYO KO PTA LAG JAYA,DREAMBOY fitness haryana,UC7XjWdvw-z6zDL1a22qGAfw,[]
3197,4l57KHaOpP8,Bhai donkey me kya saman lekar aana chahiye is per vidio banao bag kese le or pese kine le kaha per chupane chahiye fuul vidio bhai,Anshu Kumar,UC314yiqqySt2eJVbNYHJCJA,[]
3198,NkbHKjNMvFs,Bro kal jo speech di Biden ne Mexico border par us ch ki si,Gurmukh Sidhu,UCXTXeIYg8qEbVGQa5vjRx6g,[]
3199,NkbHKjNMvFs,Mera first comment bro,Gurmukh Sidhu,UCXTXeIYg8qEbVGQa5vjRx6g,[]
3200,YTPnL2So-SI,#krishanakumarsah,Saraswati puja,UCLWsXpTRH2eQKn4Or21KdpA,[]
3201,UxJjhR27baw,Mere kol veer di original vidio pai a . eve snap chat te la ke snowfall na dikha . a veer america ponch v gea,hardeep Singh,UCsSTKmD2L7sye87Ek6ZlfmA,[]
3202,UxJjhR27baw,Kho lokea nu fuddu vanea rahea gea fake video pah ke sara kuj thik chal reaha koi problem ne,Young farming,UC6CWnS1w03bilbdhwBmVCjw,[]
3203,UxJjhR27baw,Boht bande baithey aaa spain vich USA jaan lyi agent bass laare e lga riha aa ohna nu 4 din da keh ke 4 month ho gye aa ohna nu spain vich baithya nu .......,pawan pawan,UCxbVqE6xwISnDZglyJ32zwA,[]
3204,UxJjhR27baw,Bukwaas jinay aana jaldi aajo ok system hai,Sumit Si,UC9m1oJgPXdhxvavyd9vJVpg,[]
3205,34AzvUjc2ws,Yah serf punjab ka log hi karte ha baki pura hindustan ma,rajeev sharma,UC8sTjOt1X_jaTMGjsDQJS0g,[]
3206,34AzvUjc2ws,20 20 lakh de dete he agent ko to yaar wo garib kese hue 20 lakh se india me bahut acha khasa busnes kar sakte he,Anil Jain,UCBobNE42FD_P_iEvc4UdFBg,[]
3207,34AzvUjc2ws,#sukhchainsingh1805,Sukhchain Singh 1805,UCKA9XiYwQNZUtRVPyxXb-8A,[]
3208,34AzvUjc2ws,2 no se koi mt jao please,Rishab Saini,UCCdSmLbfwVU5gAF_nvlR09Q,[]
3209,34AzvUjc2ws,Mein v donkey lake America gya,Maan Saab,UCVZJREs6334IT3pFVg46fsw,[]
3210,34AzvUjc2ws,Gadhe Bewkoof log hi jate h paise hone ke baad bhi chutiye 15 lakh m khud ka koi business start kr skta tha. Ya koi shop open kr skta tha gandu soch tere pass 15 lakh ki okat h to kuchh time bad 50 lakh hote agr mehnat krta apne hi gaanv m,सिंगल जोड़ी लीक,UCQ59fJ5OdtXLlmzFDVO_mtA,[]
3211,34AzvUjc2ws,ਬੁਲੰਦ ਹੌਸਲੇ,be good,UCOMzMF-9XWqsau_x1NcC3hA,[]
3212,34AzvUjc2ws,😢😢,Cooking Tips with Sobia,UC1WTf7KsF53vAJcyNKIq1_A,[]
3213,34AzvUjc2ws,Yah problem serf Punjabi logo ma ha kya kami ha waha jo apni asi tasi karwana jata ha asa,rajeev sharma,UC8sTjOt1X_jaTMGjsDQJS0g,[]
3214,34AzvUjc2ws,Sahi baat hai,AKSHAY KUMAR,UC9dwH3RC-3aF_eaCBg2vzSw,[]
3215,34AzvUjc2ws,Thank you so much ma'am.,Ashish Pradhan,UCxdQvMrAQJoN3aoNM1x2-Og,[]
3216,34AzvUjc2ws,Mera bro 7 month vich ponchya c,MRVEL EDITS,UCnvClIq607-IZWUMYBokEFQ,[]
3217,34AzvUjc2ws,Kya hai voice he clear nhi hai,Sunil Kumar,UCMKIoV-8BZUYh_tjlKTvHBQ,[]
3218,34AzvUjc2ws,",,😘😘😘😘😘😘😘😘",Thakur Family,UC4aU2SMQOZQfZwHjyr3hcLA,[]
3219,34AzvUjc2ws,"mere brother in law bhi maxico se hi America gaye the waha police ne pakd liya tha tab unhone byan diya tha ke ab wo India nhi jana chahte unki jaan ko khatra hai waha ,5 saal tak case chala baad me unko political stay mil gayi thi",Satwinder Singh,UCyZP-PWrfw-MqIHQMSqhitA,[]
3220,34AzvUjc2ws,Write sir,Arun Sharma,UCJZBWZUKhhQNy8ycHPmooRA,[]
3221,34AzvUjc2ws,Jab 15-20lakh lga rhe ho to etne m apna kaam bhi kr sakte ho,Yug dhilod,UCXHEL4Rm9nZbLvFmR0AA3ZA,[]
3222,34AzvUjc2ws,Donky maaro koi chakkar ni 😂😂,Hitesh Bhardwaj,UCklOv0Ofe9Kepv58PBQ-T8Q,[]
3223,34AzvUjc2ws,hosle vadde hon taa kuj be ho sakda,animals record,UCFulinKskFPtwOPgnkkTa3w,[]
3224,34AzvUjc2ws,Why people are want go kuch nahi hai bidesh me janwaro ki tarha jindagi hai,Alex Stephen,UCJWAduOWL-rSPrwQmM_vtvQ,[]
3225,DXmndjtjUoI,bhai bond kaise bhara jayega agar kiska agent na ho to,Mr Hell Technical,UCmRH40rqHc3XxC5xUxJg2bQ,[]
3226,7-WpwHEwwDU,*#teachvisa**#teachvisapunjabi** ***,Teach visa Punjabi,UCEFJ74BQdQ7kGHXX2D8nfRA,[]
3227,nV-LQnl0baM,👍👍👍,Surjeet Singh,UC-uMJ-_cUMoMX4yqM-lXHcQ,[]
3228,b94OzZtU-Ls,Like Share Subscribe And Comment ❤️👍,Donkey Update 2.0,UCJ2YrlSSzLlLPpHLvlM4dUg,[]
3229,b94OzZtU-Ls,Ghusse ghta bnda saala,sandy rana,UCKA-sYcejx_Jv24evndP7FA,[]
3230,b94OzZtU-Ls,😡😡,"Arshdep KA MISAN 1.2M views .7
hours ago..",UCQx8hHjIzFilsc3if6F4ndg,[]
3231,8bKaEWm_l8E,muh se paan nikal kr bol,Zoom Movie Review Mumbai,UCcwN0eRPmzqEeMhQDHy167w,[]
3232,Nx_JVtbvthc,❤️❤️🙏🙏,Surjeet Singh,UC-uMJ-_cUMoMX4yqM-lXHcQ,[]
3233,Z6zg5aEvEPo,Best of luck Karan . My Best wishes with you,Abhijeet Chakraborty,UCJn8qKccOSsQeBA-HTG1WJA,[]
3234,Z6zg5aEvEPo,👌👌 badya mhant Kari bro na video bana ma,Sawan Maratha,UC3gZa4ulTF2NcBtp_rqiWWw,[]
3235,Ww62knHcm2s,Super video ji,Himachali Vlogger Balwant Kapoor,UCa1TydYnt8YXG11-YKKv_kg,[]
