,videoId,publishedDate,title,videoUrl,description,channelId,channelTitle
190,O40W8JpXRwY,2022-10-05T07:30:12Z,LAST VIDEO - India to USA Donkey | Gaurav maan,https://www.youtube.com/watch?v=O40W8JpXRwY,USA DONKEY लगाने का मन है उससे पहले ये वीडियो देख लो । कैसी आपकी जिंदगी ...,UCp9ABGKxojZ9MIpCurKFXCQ,Gaurav Maan
191,Zhk_5SIF2jI,2023-01-16T17:58:59Z,INDIA TO USA DONKEY 🇺🇲 subscribe kardiyo bhaiyo #usadonkey #panama #usaindians,https://www.youtube.com/watch?v=Zhk_5SIF2jI,,UCiE4PdGTNDUz3fMSG1AvQ1A,DL 70
192,6LJBoKF9DcI,2022-03-14T07:24:41Z,New USA Donkey Video | Mexico border crossing | Indian boys in donkey | 2022,https://www.youtube.com/watch?v=6LJBoKF9DcI,Usa donkey video mexico border crossing 2022 Ror boys #usadonkey #donkey #america #indianinamerica #usadonkeyvideo ...,UCypuIdlqQELMH_vKb5FMcbQ,Indian American
193,Nwl9LEbQKsU,2022-11-27T05:50:23Z,usa donkey || Mexico to USA border crossing|| usa donkey 2022 technical gill || Mexico border,https://www.youtube.com/watch?v=Nwl9LEbQKsU,donkey americaa || donkey 2022 ||Usa donkey america ||donkey ||mexico border crossing to usa punjabiIndia to USA donkey ...,UCc3JmivcpjAGnd1-p-ldtaQ,Technical gill
194,YDEHyjXLNJM,2022-05-11T01:37:27Z,ILLEGAL USA BORDER CROSSING VIDEO । USA DONKEY FROM INDIA TO AMERICA 🇺🇲.......... #vlogs #punjabi,https://www.youtube.com/watch?v=YDEHyjXLNJM,Amricandonkey #amricanbordercrossing #blogger #vlogs #mexico #méxico #mexicoborder #punjabi #punjabinews #amrican ...,UCVtjf20IY-hQkoqowP3p77w,MR AKASH VLOGS
195,O8C15GVaIqg,2022-07-19T07:30:10Z,India to USA donkey | दीवार कूदने के बाद क्या होता है | Gaurav Maan,https://www.youtube.com/watch?v=O8C15GVaIqg,"India to usa donkey मार के जाने के बाद, अमरीका की दीवार कूदने के बाद का सफ़र ...",UCp9ABGKxojZ9MIpCurKFXCQ,Gaurav Maan
196,drEWY5fhhQ0,2022-11-16T04:07:28Z,Usa donkey | donkey shayri | india to usa | aj__usa | pardeshi status | #aj__usa  #donkey,https://www.youtube.com/watch?v=drEWY5fhhQ0,,UCOZ4WFDBKT71c3kxTZMgWGA,Aryan__usa_
197,ozIc_kagCCw,2023-01-27T02:00:28Z,India 🇮🇳 To USA 🇺🇸 | Part 13 | Panama 🇵🇦 Jungle Ki Tyaari Hogyi 🙂| USA 🇺🇸 Donkey |,https://www.youtube.com/watch?v=ozIc_kagCCw,Jai Mata Di America #usa     #usa #america #trending #reels #reelitfeelit #trend #explore #explorepage #usa     ...,UC1X4PBVhNsyavmtdy2XOZFA,Ankush Malik Vlogs
198,GAHGL5jJxJA,2022-10-17T03:33:31Z,"Donkey , USA Donkey | India To USA Donkey #shorts #donkey2022 #usadonkey2022",https://www.youtube.com/watch?v=GAHGL5jJxJA,"Donkey , USA Donkey | India To USA Donkey #shorts #donkey2022 #usadonkey2022 #yourimmigrationchannel India In To USA ...",UCp9cJSP1E9QGI24QKQFkRcw,Your Immigration Channel
201,CUk_GCVJGPg,2022-10-19T02:23:35Z,#donkey vidio#hungry city#going spain #donkey #india ta usa wala bhai# sport karo bhaiyo,https://www.youtube.com/watch?v=CUk_GCVJGPg,,UCKiog0ropxCNdCdXk9Yev3w,india to usa wala bhai
207,c9JszJR2iPc,2022-07-05T04:28:09Z,Times Square Pe Lakho Ka SCAM | India To USA Donkey VISA | Indian In America,https://www.youtube.com/watch?v=c9JszJR2iPc,"timessquare #indianinamerica #indianinusa Times Square Pe Lakho Ka SCAM | Indian In America Hello Guys, welcome back to ...",UCdvfzzIhnq4_WOZDP8L1oPw,RK'S IN AMERICA
210,w_4RYYe9rNE,2019-10-06T08:25:21Z,Donkey to America,https://www.youtube.com/watch?v=w_4RYYe9rNE,Donkey to American.,UCZ03zRkcsTj5U8gfXb2zhvA,Gillsabb
214,22M7hJ5bT44,2022-08-07T01:19:35Z,MEXICO JUNGLE TAPACHULA TO CHIAPAS MEXICO ASHU ROR,https://www.youtube.com/watch?v=22M7hJ5bT44,MEXICO JUNGLE TAPACHULA TO CHIAPAS MEXICO ASHU ROR instagram :- ashu_ror_22 #usadonkey #mexicojungle ...,UCKw8osbjurLZYFcwYp7SD5A,ASHU ROR
216,wcN5z0ZpW4k,2022-09-24T09:19:58Z,America entry #usadonkey #mexicoborder #panama #indiatousa #usa #mexico #punjabi #india #america,https://www.youtube.com/watch?v=wcN5z0ZpW4k,,UCdtvGeKuOZbut8QD1r15lAw,SELFSION 
218,l8FmYj7VBaM,2018-10-21T15:12:02Z,bahamas to usa illegal [ india pakistan  afghanistan ]USA KI DONKEY  PARTS 3 2018 in URDU&amp;HINDI.,https://www.youtube.com/watch?v=l8FmYj7VBaM,bahamas to usa illegal [ india pakistan bangladesh afghanistan ] PARTS 3 2018 in URDU&HINDI. usa ki donkey information in ...,UCYyk3C5bP0IVvukAnGibl7w,TEACH VISA
219,ObVq0cpnLok,2022-12-23T01:30:05Z,India 🇮🇳 To USA 🇺🇸 | Part - 02| Donkey 2022| Second Flight| 2 Numbari ✌🏻| America 🇺🇸,https://www.youtube.com/watch?v=ObVq0cpnLok,Jai Mata Di America #usa     #usa #america #trending #reels #reelitfeelit #trend #explore #explorepage #usa     ...,UC1X4PBVhNsyavmtdy2XOZFA,Ankush Malik Vlogs
220,yAfWoDKa5Jo,2022-10-19T05:30:22Z,USA Donkey I india to usa donkey I #shorts,https://www.youtube.com/watch?v=yAfWoDKa5Jo,usa #usadonkey #usadonkey2022 #freevisaadvisor USA Donkey I india to usa donkey I #shorts Free Visa Advisor don't promote ...,UC4mifYMs39uMhHSBeP64dCg,Free Visa Advisor
221,Dj9jsS2fhBg,2022-12-12T12:07:56Z,# AMERICA 🇺🇸 DONKEY || India To Kyrgyzstan 🇰🇬 || # USA donkey # shorts #viral #maxico #usaborder,https://www.youtube.com/watch?v=Dj9jsS2fhBg,,UC_jmCHS4CfP-cUU7KfoQISA,Amit Sharma
222,m03cXDr6ACE,2022-12-22T12:59:41Z,India to US without donkey इंडिया से यू एस सीधा us visa latest news us visa update USA visa 🇺🇸USA,https://www.youtube.com/watch?v=m03cXDr6ACE,US donkey easy and safe steps to direct India to usa donkey by flight India to uk to Maxico by flight to to ...,UC_E-4M31gKkn8Cg7H01YwGg,New Mission 
223,x_X01oegCkQ,2022-09-12T05:33:15Z,INDIA to USA donkey  I usa donkey I usa donkey 2022 I,https://www.youtube.com/watch?v=x_X01oegCkQ,"usvisa #usdonkey #usbordercrossing US donkey border crossing I usa donkey I india to usa donkey, usa donkey 2022, usa ...",UC4mifYMs39uMhHSBeP64dCg,Free Visa Advisor
224,#NAME?,2022-08-03T10:32:52Z,USA DONKEY || 2022 || India to usa,https://www.youtube.com/watch?v=-_ae4Vds3Zc,,UCaKNxU0tt_09z1gsQcm87nA,JS vlogs
225,cJDPsyEbWq8,2021-06-17T10:15:00Z,india to Brazil flight | America di Donkey flight | Flight UPDATE 2021.,https://www.youtube.com/watch?v=cJDPsyEbWq8,india to Brazil flight | America di Donkey flight | Flight UPDATE 2021. Usa ki Donkey Information in Punjabi.#usakidonkey ...,UCEFJ74BQdQ7kGHXX2D8nfRA,Teach visa Punjabi
226,xTfMgAXbxu8,2022-09-25T12:05:08Z,Donkey America  I usa donkey 2022 I india to usa I,https://www.youtube.com/watch?v=xTfMgAXbxu8,shorts #freevisaadvisor #usdonki #usadonkey Donkey America I usa donkey 2022 I india to usa I Don't go for donkey its just an ...,UC4mifYMs39uMhHSBeP64dCg,Free Visa Advisor
227,R75AhrJvE1s,2022-12-22T23:58:42Z,🇮🇳 India se America 🇺🇸 Panama jungle,https://www.youtube.com/watch?v=R75AhrJvE1s,,UCO6pIFkW0-S9BzkeokU4zlQ,Indian Immigrants
228,gOCL_eMkl0w,2019-04-28T10:59:12Z,||India to USA Donkey Live 2020|| 30 boy died in the sea ||,https://www.youtube.com/watch?v=gOCL_eMkl0w,"India to usa donkey | Plz subscribe my channel, Thanks for watching video,",UCdVTy3JQ5oTCw_49HTS_vUw,Knowledge 360
229,ukctX-Hdot0,2022-03-20T09:43:09Z,usa donkey 2022🙏🏻🥵 new update full information in hindi MEXICO USA DONKY,https://www.youtube.com/watch?v=ukctX-Hdot0,usa donkey 2022 new update full information in hindi MEXICO USA DONKEY.,UCjj9Rtf2GquenO-LX0Wkd1w,Hello india
230,4ZzCN6UqKfI,2023-02-06T04:44:44Z,#2numabri #haryanaale #india #jind #jind #punam #usa #donkey #america #haryana,https://www.youtube.com/watch?v=4ZzCN6UqKfI,Insta= honeymaan05 Insta=rishideswal USA में काम क्यों नहीं मिल रहा कैसे मिलेगा ...,UCbxP5ppeghypksQtdbMSzog,Deswal & Maan
231,qfTKe3XdcDw,2023-02-02T18:21:58Z,Donkey ?????? #america #indianinusa #donkey #americakidonki #haryanviinusa (Part :1),https://www.youtube.com/watch?v=qfTKe3XdcDw,"usa ki donkey,america donkey,donkey america,america ki donkey,usa donkey,usa ki donkey information hindi,usa ki donkey ...",UCyORkzQuHawChmz_QII3QXA,Jakhar vlogs
232,1D-ac4de6E8,2022-12-11T03:53:27Z,INDIA TO USA DONKEY ROUTE 🇺🇲 FULL USA DONKEY ROUTE DETAILS|| USA DONKEY MAI KAISE AATE HAI #donkey,https://www.youtube.com/watch?v=1D-ac4de6E8,INDIA TO USA DONKEY ROUTE FULL USA DONKEY ROUTE DETAILS || USA DONKEY MAI KAISE AATE HAI If you like ...,UCxe-tfucj4BB_4MxnoHd4Vw,2 number wale
233,pAVLfkfNsjA,2023-01-16T03:30:17Z,Usa Mexico Donkey | USA Mexico Border Update | India To USA Donkey#usadonkey#mexicoborder#border#usa,https://www.youtube.com/watch?v=pAVLfkfNsjA,My channel:-https://www.youtube.com/channel/UCn7K... Press The BELL ICON For Get Next Video Information. For Daily Live ...,UCn7KrefotvouJeYXzwRBpfw,Rohit Backpacker
234,xNpp6KkUVwc,2023-02-06T04:00:25Z,USA DONKEY 🇺🇸 VIDEO || INDIA TO USA DONKEY VIDEO || AMERICA CAMP #explore #usa  #shorts,https://www.youtube.com/watch?v=xNpp6KkUVwc,USA DONKEY VIDEO ||AMERICA CAMP || PANAMA JUNGEL DONKEY VIDEO DONKY VIDEO 15/12/2022 #shorts 2 ...,UCtLr-VlUjuxh4zUQA6pu_zg,2 Numbari USA Wala
235,OmfitjGjxnc,2023-01-09T04:35:57Z,India to America |Indian Asylum seekers in USA | immigration life USA | US visa @DonkeyAmericaki,https://www.youtube.com/watch?v=OmfitjGjxnc,India to America |Indian Asylum seekers in USA | immigration life USA | US visa ‎@DonkeyAmericaki.,UCgsSAyzq8dgIJ3FT8DEtGYQ,Donkey America ki
236,HCdOqj6Qw3Y,2022-08-12T12:52:32Z,USA DONKEY#india to usa donkey#reels#pakke usa wale California#pakke amrica wale#Mexico bordar#,https://www.youtube.com/watch?v=HCdOqj6Qw3Y,,UCKxtKddBhN0JUbYptQBUtpA,Usa Donkey Wale CALIFORNIA
237,QAW3CjICgrk,2022-05-12T17:01:52Z,Donkey India to USA #donkey #donkeykong #jaat #haryana #mexico #india #usa,https://www.youtube.com/watch?v=QAW3CjICgrk,,UCpiLg20Tmit5KlmUvek13TQ,Manish Kumar
238,MgbiD1vWPCs,2022-09-21T08:18:51Z,TEXES NEW UPDATE#USA DONKEY #USA DONKEY MEXICO#INDIA TO USA US IMMIGRATION NEWS LATEST,https://www.youtube.com/watch?v=MgbiD1vWPCs,Pl subscribe our chennal for more information Jassi Backpacker Vlogs Gmail.jasvindersingh46664@gmail.com Pl follow ...,UCdO_wi4TJhvMynJcUOw6UBQ,Jassi backpacker vlogs
239,AHE40T3ruHc,2021-07-18T06:26:09Z,Q&amp;A Video - USA ki donkey | under 18 year |  India to Brazil flights-Mexico donkey - Asylum in USA.,https://www.youtube.com/watch?v=AHE40T3ruHc,Q&A Video - USA ki donkey | under 18 year | India to Brazil flights-Mexico donkey - Asylum in USA. Hassan Visa Info ...,UCEFJ74BQdQ7kGHXX2D8nfRA,Teach visa Punjabi
240,HFFkpEaPzBY,2022-11-08T01:30:09Z,USA Donkey I india to  usa donkey I #shorts,https://www.youtube.com/watch?v=HFFkpEaPzBY,shorts #freevisaadvisor #usadonkey USA Donkey I india to usa donkey I #shorts Free Visa Advisor don't promote illegals border ...,UC4mifYMs39uMhHSBeP64dCg,Free Visa Advisor
241,B-3cg9SnlQo,2020-05-21T04:49:08Z,Journey India to Usa ( Donkey ale jatt ),https://www.youtube.com/watch?v=B-3cg9SnlQo,Follow on Instagram @deep1_official . . .#trending #foryoupage #foryou #trending #Canada #usa #covid19 #lockdown ...,UCibZHKBfHFe5kqdqJP-TnrA,Harshpreet karnal
242,mM3UKrL0QAM,2023-01-01T04:00:11Z,USA DONKEY 🇺🇲 VIDEO || PANAMA JUNGEL  || Part- 6 पनामा जंगल डोंकी वीडियो जंगल खत्म 🥳🥳 !  #tranding,https://www.youtube.com/watch?v=mM3UKrL0QAM,USA DONKEY VIDEO || PANAMA JUNGEL || Part- 6 पनामा जंगल डोंकी वीडियो जंगल खत्म !,UCtLr-VlUjuxh4zUQA6pu_zg,2 Numbari USA Wala
243,oPpbIIau5Lk,2023-01-23T11:20:13Z,"#America_donkey लगाने से पहले यह वीडियो जरूर देखें , कैसे होती है माफिया से मुलाकात ..??",https://www.youtube.com/watch?v=oPpbIIau5Lk,"America_donkey लगाने से पहले यह वीडियो जरूर देखें , कैसे होती है माफिया से ...",UC-pw4kZhpHvpvK2O2XJfFoA,खास हरियाणा Khas Haryana
244,yqYJAmpm5TI,2018-08-07T17:39:02Z,Never Ever Use Donkey Flight For Illegal Immigration,https://www.youtube.com/watch?v=yqYJAmpm5TI,"Guys never ever take donkey flight to fulfil your abroad dream, there could be very bad circumstances when you take donkey flight ...",UCy7XGBPyMLP-h6rZ4pr5EeQ,Mission Abroad
245,OdR_PFNcKsk,2023-01-25T18:16:28Z,#donkey #haryana #usa #2numabri #2numberi #america #haryanaale #panama #india #usalifestyle,https://www.youtube.com/watch?v=OdR_PFNcKsk,Insta =rishideswal Insta=Honeymaan05 #donkey #haryana #usa #2numabri #2numabri #america #haryanaale #panama ...,UCbxP5ppeghypksQtdbMSzog,Deswal & Maan
246,ZgdrNVYB7x8,2022-08-08T11:57:22Z,Amerika USA donkey 🇺🇸||USA wale #donkey #shorts #usa,https://www.youtube.com/watch?v=ZgdrNVYB7x8,Amerika USA donkey USA wale ||#donkey #shorts #usa plz subscribe my channel link to watch more videos ...,UCGX2FGGulDSJHaEMa0uNOfg,Nishu Deswal Hr31
247,htLrFcoGRDs,2022-09-27T17:30:22Z,26/9 mexico border #mexicoborder #usadonkey #indiatousa #usa #mexico #punjabi #india #america,https://www.youtube.com/watch?v=htLrFcoGRDs,,UCdtvGeKuOZbut8QD1r15lAw,SELFSION 
248,a4tKIInNxtc,2018-10-23T15:42:05Z,El salvador to usa illegal [ india pakistan afghanistan ]USA KI DONKEY PARTS 5 2018 in URDU&amp;HINDI.,https://www.youtube.com/watch?v=a4tKIInNxtc,El salvador to usa illegal [ india pakistan afghanistan ]USA KI DONKEY PARTS 5 2018 in URDU&HINDI. El salvador visa info in ...,UCYyk3C5bP0IVvukAnGibl7w,TEACH VISA
249,ZlKbxkkIHSs,2022-05-21T05:11:13Z,India to Usa Donkey Information,https://www.youtube.com/watch?v=ZlKbxkkIHSs,,UCmzpBzfKkx1bzWNG0K_in8w,Donkey_aale_balak 0825 🇺🇸
250,Wgjoj13TtY0,2021-07-21T20:53:40Z,Usa donkey Panama jungle entry,https://www.youtube.com/watch?v=Wgjoj13TtY0,us boder crossing Panama jungle.,UCLt5YLVDRaOWCrov14ic_8Q,Gurpreetpreet
251,20-D1Oi-F3Q,2022-09-16T04:30:25Z,USA Donkey I india to usa donkey route I #shorts,https://www.youtube.com/watch?v=20-D1Oi-F3Q,shorts #freevisaadvisor #usvisa USA Donkey I india to usa donkey route I #shorts My other Youtube Channel for : Shorts Free ...,UC4mifYMs39uMhHSBeP64dCg,Free Visa Advisor
252,xQjnzD3qDrw,2021-08-22T04:15:02Z,America ki donkey in August | india to usa | PUNJAB TO USA | Donkey flight,https://www.youtube.com/watch?v=xQjnzD3qDrw,America ki donkey in August | india to usa | PUNJAB TO USA | Donkey flight #Americakidonkey #Donkeyflight #PUNJAB-USA ...,UCEFJ74BQdQ7kGHXX2D8nfRA,Teach visa Punjabi
253,QCpssz-XnHU,2022-10-23T07:30:06Z,USA Donkey I india to usa donkey I,https://www.youtube.com/watch?v=QCpssz-XnHU,usa #usadonkey #usadonkey2022 #usa #freevisaadvisor USA Donkey I india to usa donkey I Free Visa Advisor don't promote ...,UC4mifYMs39uMhHSBeP64dCg,Free Visa Advisor
254,d6xqY-v29vQ,2022-10-21T09:30:09Z,USA Donkey I india to usa donkey I,https://www.youtube.com/watch?v=d6xqY-v29vQ,usa #usadonkey #usadonkey2022 #freevisaadvisor USA Donkey I india to usa donkey I Free Visa Advisor don't promote illegals ...,UC4mifYMs39uMhHSBeP64dCg,Free Visa Advisor
256,Xk1eJ0DnM1Y,2022-02-16T14:00:25Z,India to Germany donkey flight | Europe donkey flight | 3 way to go Germany | By Air .,https://www.youtube.com/watch?v=Xk1eJ0DnM1Y,India to Germany donkey flight | Europe donkey flight | 3 way to go Germany | By Air .. #Germanydonkeyflight #Europedonkey ...,UCEFJ74BQdQ7kGHXX2D8nfRA,Teach visa Punjabi
257,jo1H581ixKs,2022-04-17T06:36:04Z,INDIA TO USA Immigration Kaisa Hota Hai | Indian In America | India To USA Donkey Visa,https://www.youtube.com/watch?v=jo1H581ixKs,IndiaToUsa #IndiaToUsaJourney #IndiansInAmerica INDIA TO USA Immigration Kaisa Hota Hai | Indian In America New ...,UCdvfzzIhnq4_WOZDP8L1oPw,RK'S IN AMERICA
258,4NnYMymjVl8,2020-06-11T14:57:25Z,India To USA Journey Donkey/Bebe Punjabi song,https://www.youtube.com/watch?v=4NnYMymjVl8,Bhut mushkil nal ponche c But maddi kismat Deport go gya 1sal 2 month bad Comment karke jrur Dseyo kive Lagi video.,UCWLpCT71g0KGU542pVvrJ7g,Singh_Navdeep 786
259,iJ3TGfiOo1E,2022-11-21T05:30:11Z,USA DONKEY 🇺🇲 VIDEO || America camp || India to Sao Paolo Brazil Refugees camp #usa #shorts,https://www.youtube.com/watch?v=iJ3TGfiOo1E,USA DONKEY VIDEO || America camp India to Sao Paolo Brazil Refugees camp #usa #shorts #trending 2 Numabri USA ...,UCtLr-VlUjuxh4zUQA6pu_zg,2 Numbari USA Wala
260,Fm4QukCWXBo,2022-09-30T22:58:12Z,Usa trucking night life🚨#shorts #usa #indian #india#donkey #america #night #live #life #viralvideo,https://www.youtube.com/watch?v=Fm4QukCWXBo,tension #new #punjab #punjabi #song #money #dogs #truck #night #life #kinemaster #usa #viralvideo #shorts #viral #viralreels ...,UCYoSVbWIC6at8yPyRengGmQ,Desi AMERICAN
261,AV8g_EdyLoI,2022-11-08T04:10:31Z,Mexico to America Border Crossing 🇺🇲| Usa Donkey | #shorts,https://www.youtube.com/watch?v=AV8g_EdyLoI,Mexico to America Border Crossing | Usa Donkey | #shorts #shorts #usadonkey #indiatousa #usaborder #americadonkey ...,UCJ2YrlSSzLlLPpHLvlM4dUg,Donkey Update 2.0
262,EMTPOGskvEU,2023-02-05T18:41:42Z,Punama jungle 😭😭😭😱😱😱#haryanaale #india #donkey #usa #donkey #jind #panama #,https://www.youtube.com/watch?v=EMTPOGskvEU,Insta= honeymaan05 Insta=rishideswal USA में काम क्यों नहीं मिल रहा कैसे मिलेगा ...,UCbxP5ppeghypksQtdbMSzog,Deswal & Maan
263,KOH1VmBxfPA,2022-11-23T07:30:10Z,USA Donkey I India to USA I #shorts,https://www.youtube.com/watch?v=KOH1VmBxfPA,shorts #usadonkey #freevisaadvisor #indiatousa USA Donkey I India to USA I #shorts Free Visa Advisor don't promote illegals ...,UC4mifYMs39uMhHSBeP64dCg,Free Visa Advisor
265,fVpLx6DK9dY,2018-10-19T15:26:51Z,mexico to usa illegal [india pakistan bangladesh] PARTS 1 USA KI donkey  2018 in URDU&amp;HINDI.,https://www.youtube.com/watch?v=fVpLx6DK9dY,mexico to usa illegal [india pakistan bangladesh] PARTS 1 2018 in URDU&HINDI. India to usa by donkey U S A bond after ...,UCYyk3C5bP0IVvukAnGibl7w,TEACH VISA
266,pArK1hC3mNA,2022-10-03T11:13:48Z,USA Donkey | india to usa donkey full stories || #short #youtubeshorts #usadonkey2022,https://www.youtube.com/watch?v=pArK1hC3mNA,"USA Donkey | india to usa donkey full stories || #short #youtubeshorts #usadonkey2022 Donkey flight rampant in Punjab,america ...",UCu44xaLCz6wnRT3gendMcUw,vinu lifestyle
267,MU4BaA0iF_Y,2022-10-05T09:21:16Z,illegal Pakistani Indian immigrant in Brazil USA | Brazil ki donkey | USA ki donkey.,https://www.youtube.com/watch?v=MU4BaA0iF_Y,"illegal Pakistani Indian immigrant in Brazil USA | Brazil ki donkey | USA ki donkey. #usadonkey2022, #usakidonkey2022 ...",UCEFJ74BQdQ7kGHXX2D8nfRA,Teach visa Punjabi
268,wgJ4Hos-dCw,2022-10-18T04:55:39Z,INDIA TO USA Donkey | गाँव के बालक देखलो #shorts,https://www.youtube.com/watch?v=wgJ4Hos-dCw,INDIA TO USA DONKEY.,UCp9ABGKxojZ9MIpCurKFXCQ,Gaurav Maan
269,Pd-rLSicu4s,2022-06-25T14:14:51Z,"see how 😯 people,s enter in Usa 🇺🇸🇺🇸 || border crosing donkey|| with truck || #shorts #talent",https://www.youtube.com/watch?v=Pd-rLSicu4s,,UCdVli2XHf4nX0xRUyL7ZbBg,Real Fans Club 
270,L5g58L4qbeM,2022-10-18T04:08:00Z,USA DONKEY | INDIA TO USA | INTERNATIONAL STUDENTS CANADA | MEXICO BORDER,https://www.youtube.com/watch?v=L5g58L4qbeM,,UCjH5UKrX0ZUfXv8d0IpAB-Q,Punjab Update
271,MwIFABqDfWE,2022-11-21T01:40:06Z,USA DONKEY I INDIA TO USA I #shorts,https://www.youtube.com/watch?v=MwIFABqDfWE,shorts #usadonkey #freevisaadvisor #indiatousa USA Donkey I India to USA I #shorts Free Visa Advisor don't promote illegals ...,UC4mifYMs39uMhHSBeP64dCg,Free Visa Advisor
272,WEN2Lv31bK8,2022-11-15T01:30:07Z,USA DONKEY I INDIA TO USA I #shorts,https://www.youtube.com/watch?v=WEN2Lv31bK8,"shorts #freevisaadvisor #usadonkey usa donkey 2022 I India to usa I amrika donkey,mexico donkey,usa visa,usa donkey,usa ...",UC4mifYMs39uMhHSBeP64dCg,Free Visa Advisor
273,ZQk8iqHNJqQ,2023-02-07T04:00:08Z,Donkey entry in America | Mexico border cross |,https://www.youtube.com/watch?v=ZQk8iqHNJqQ,"Usa donkey, america donkey, donkey new video, donkey 2019, 2 nunber vich usa, america visa, usa visa, usa jana, usa donkey ...",UCOIEvtWB6GpRsBAH4sakHGA,Kulbir Hooda
274,_DcN3ADa7pM,2022-11-19T01:32:57Z,USA Donkey I India to USA I #shorts #viral,https://www.youtube.com/watch?v=_DcN3ADa7pM,shorts #shortsvideo #usadonkey #freevisaadvisor USA DONKEY 2022 I India to USA #shorts #viral Free Visa Advisor don't ...,UC4mifYMs39uMhHSBeP64dCg,Free Visa Advisor
275,5bBv4JeFRdo,2022-12-29T01:30:01Z,USA DONKEY I INDIA TO USA I #shorts,https://www.youtube.com/watch?v=5bBv4JeFRdo,shorts #usadonkey #usa #usadonkey2022 #freevisaadvisor USA DONKEY I INDIA TO USA I #shorts Free Visa Advisor don't ...,UC4mifYMs39uMhHSBeP64dCg,Free Visa Advisor
277,zsVL1gdC_28,2022-05-17T18:24:45Z,Donkey entry in America | Mexico border cross |,https://www.youtube.com/watch?v=zsVL1gdC_28,"Usa donkey, america donkey, donkey new video, donkey 2019, 2 nunber vich usa, america visa, usa visa, usa jana, usa donkey ...",UCOIEvtWB6GpRsBAH4sakHGA,Kulbir Hooda
278,eZFeVnmns7s,2022-12-30T03:20:11Z,USA donkey Border Crossing Latest update December India to America donkey 2022 Mexico to USA,https://www.youtube.com/watch?v=eZFeVnmns7s,USA donkey Border Crossing Latest update December India to America donkey 2022 Mexico to USA #usadonkey2022 ...,UCsBQzotAtrLc7ca6ohLYaQw,Passion Mafia
279,OxV0TPgkUVw,2022-10-22T05:53:37Z,#donkey #america 😳#2numabri 😃🙃#panama #usa #haryana #india,https://www.youtube.com/watch?v=OxV0TPgkUVw,,UCxe-tfucj4BB_4MxnoHd4Vw,2 number wale
280,bwqVESmGZis,2022-04-29T06:10:17Z,#Usa #india #donkey #Country #bharat #paisa,https://www.youtube.com/watch?v=bwqVESmGZis,,UC_rDvDJ2IE-XClksZE3vXEg,Mukesh Kumar
281,Oqs47X7CkZo,2022-09-09T08:10:52Z,"donkey to USA Europe  ||Story of Refugees, Asylum &amp; Donkers In USA , UK , Germany ||",https://www.youtube.com/watch?v=Oqs47X7CkZo,"Its Hard to Explain Everything but i hope you will understand well |india to usa donkey route, #indiatousadonkeymap ...",UCu44xaLCz6wnRT3gendMcUw,vinu lifestyle
282,UDa3DH1_Yus,2021-09-19T15:02:08Z,India to usa #donkey #2021 #mexico  to #usa,https://www.youtube.com/watch?v=UDa3DH1_Yus,,UCaZb9fREcOIsZvLtzHne9tQ,Love ❤️
283,bAcLLT0nMOE,2022-07-07T09:52:42Z,India to USA donkey | #usadonkey #shorts | Gaurav Maan,https://www.youtube.com/watch?v=bAcLLT0nMOE,India to usa donkey full process #usadonkey #shorts #gauravmaan full video https://youtu.be/Aow6HMUEB-4.,UCRnyDDxptQzXqADcUyiEtVQ,Gaurav Maan Shorts
284,_10xTuQCGNY,2022-11-24T11:41:27Z,India to USA donkey|| Mexico to America border crossing Today 900+#donkey #indiatousa #punamajangal,https://www.youtube.com/watch?v=_10xTuQCGNY,donkey americaa || donkey 2022 ||Usa donkey america ||donkey ||mexico border crossing to usa punjabiIndia to USA donkey ...,UCc3JmivcpjAGnd1-p-ldtaQ,Technical gill
285,Ofet5tixK8o,2023-01-06T03:05:19Z,India 🇮🇳 To USA🇺🇸 | Part - 07 | Bolivia 🇧🇴से Peru 🇵🇪 पहुँचे । अमेरिका Donkey। Donkey 2022,https://www.youtube.com/watch?v=Ofet5tixK8o,Jai Mata Di America #usa     #usa #america #trending #reels #reelitfeelit #trend #explore #explorepage #usa     ...,UC1X4PBVhNsyavmtdy2XOZFA,Ankush Malik Vlogs
286,gDktIipAhPs,2022-09-03T18:02:39Z,USA donkey real video new update 2022 🇺🇲🇺🇲🇺🇲 panama jangle #usa #donkey #india #amrica,https://www.youtube.com/watch?v=gDktIipAhPs,Video from Jai Baba Ki.,UCh8_uHIbe5S8r73w5xjXp3g,Golu Dubai wala
287,oEmkEjGZFuI,2023-01-30T01:30:12Z,India 🇮🇳 To USA 🇺🇸 | Part 14 | पनामा जंगल के लिए निकल पड़े 😲।Necocli To Capurgana| America🇺🇸,https://www.youtube.com/watch?v=oEmkEjGZFuI,Jai Mata Di America #usa     #usa #america #trending #reels #reelitfeelit #trend #explore #explorepage #usa     ...,UC1X4PBVhNsyavmtdy2XOZFA,Ankush Malik Vlogs
288,X6-8RxNXLUY,2022-11-23T04:30:07Z,USA Donkey I India to USA I #shorts,https://www.youtube.com/watch?v=X6-8RxNXLUY,shorts #usadonkey #freevisaadvisor #indiatousa USA Donkey I India to USA I Panama k Jungle I #shorts Free Visa Advisor don't ...,UC4mifYMs39uMhHSBeP64dCg,Free Visa Advisor
289,xXFPMJu5Yy8,2023-01-12T01:30:16Z,India 🇮🇳 To USA 🇺🇸 | Part 09 | पेरू 🇵🇪में बस का सफ़र 🙂। America 🇺🇸 Donkey | Donkey Route,https://www.youtube.com/watch?v=xXFPMJu5Yy8,Jai Mata Di America #usa     #usa #america #trending #reels #reelitfeelit #trend #explore #explorepage #usa     ...,UC1X4PBVhNsyavmtdy2XOZFA,Ankush Malik Vlogs
290,U5AVg3x8YPk,2019-11-21T14:46:17Z,देखिए America Mexico में अवैध रूप से घुसे Indians के साथ 5 महीने तक क्या-क्या हुआ | Deported,https://www.youtube.com/watch?v=U5AVg3x8YPk,America #Mexico #IndiansDeported Listen what Indians had to face for five months who entered in America and Mexico illegally ...,UCl8wUKzoUVzg7U6ky1ZR8hQ,Navbharat Times नवभारत टाइम्स
291,wVQhiruV0Ps,2022-10-26T03:30:11Z,USA Donkey I india to usa donkey I #shorts,https://www.youtube.com/watch?v=wVQhiruV0Ps,shorts #usadonkey #usadonkey2022 #viral #shortsvideo #freevisaadvisor USA Donkey I india to usa donkey I #shorts Free Visa ...,UC4mifYMs39uMhHSBeP64dCg,Free Visa Advisor
292,hWbP_SAbB3s,2022-09-17T03:44:15Z,Night crossing eagle pass #mexicoborder #usadonkey #panama #indiatousa #usa #mexico #india #punjabi,https://www.youtube.com/watch?v=hWbP_SAbB3s,"Hello Everyone, this is the latest update from Maxico - USA Border in this video .. Maxico border da haal Maxico USA donkey ...",UCdtvGeKuOZbut8QD1r15lAw,SELFSION 
