,videoId,publishedDate,title,videoUrl,description,channelId,channelTitle
0,dSOMBC4156I,2022-12-03T07:11:39Z,Why Indians cross US Mexico Border? Donkey Process Explained!!,https://www.youtube.com/watch?v=dSOMBC4156I,Why Indians are the highest number of people to cross the US Mexico Border and the consequences!! Edited by Srikant Tripathi ...,UChYs-_zjKRYhdMddjx-NPLw,Singh in USA
1,t-RxWqCOBns,2022-12-14T15:31:51Z,India To USA Donkey Process,https://www.youtube.com/watch?v=t-RxWqCOBns,dipanshusaini #short #india.,UCzuUlC_vInz73zl2vY_oANQ,Dipanshu Saini
2,WF4-GH6gT_k,2022-10-06T04:00:02Z,INDIA 🇮🇳 TO USA 🇺🇸 DONKEY || इंडिया से अमेरिका तक का सफ़र ASHU ROR,https://www.youtube.com/watch?v=WF4-GH6gT_k,INDIA TO USA DONKEY || इंडिया से अमेरिका तक का सफ़र ASHU ROR Instagrams ...,UCKw8osbjurLZYFcwYp7SD5A,ASHU ROR
3,pvIA2UtNV0E,2022-06-18T15:26:03Z,India to 🇺🇸 USA Donkey legal &amp; illegal documentation-All Process step by step-How agent works//Hindi,https://www.youtube.com/watch?v=pvIA2UtNV0E,NEW Channel Link https://www.youtube.com/channel/UCQ4wHQNcVZL-IYWaK0pnCAQ.,UCqd8aA47jJjNPD2P7_soVdA,ASHISH TOMAR
4,_KzW9Ct8WLs,2023-02-03T03:00:22Z,Usa Donkey 7 Lakhs Mai | India To Portugal Portugal To Mexico | Usa Donkey,https://www.youtube.com/watch?v=_KzW9Ct8WLs,UsaDonkey#7Lakhs# Usa Donkey 7 Lakhs Mai | India To Portugal Portugal To Mexico | Usa Donkey Instagram ...,UCHsNErnX6cVbYnODtjgn9TA,Namaste Backpacker
5,OYeguAVqHNY,2023-02-07T12:57:01Z,Mexico 🇲🇽 jungel usa donkey 2 number #2numabri #haryanaale #india #donkey #usa #america #panama,https://www.youtube.com/watch?v=OYeguAVqHNY,Insta= honeymaan05 Insta=rishideswal USA में काम क्यों नहीं मिल रहा कैसे मिलेगा ...,UCbxP5ppeghypksQtdbMSzog,Deswal & Maan
6,e_SFs5v-TXs,2022-05-13T15:56:50Z,Usa donkey wale🇱🇷🇱🇷 | America wale | #usadonkey #america #shorts,https://www.youtube.com/watch?v=e_SFs5v-TXs,,UCqmwrqXsVU9O0cNitUwV9aw,Pendu Bai
7,vElXF3bwrfI,2022-07-24T06:16:17Z,PANAMA JUNGLE PART (1) FULL DETAIL ASHU ROR USA DONKEY 🇺🇸,https://www.youtube.com/watch?v=vElXF3bwrfI,PANAMA JUNGLE PART (1) FULL DETAIL ASHU ROR USA DONKEY instagram :- ashu_ror_22.,UCKw8osbjurLZYFcwYp7SD5A,ASHU ROR
8,_djgUASoBls,2023-02-04T03:40:46Z,India 🇮🇳 to 🇺🇸USA,https://www.youtube.com/watch?v=_djgUASoBls,,UCSpetEnE8uaDZ1RKsViSGHg,USA DONKEY 🇺🇸
9,pux309R_Ljo,2023-02-02T02:40:00Z,India 🇮🇳 To USA 🇺🇸 | Part 15 | पनामा जंगल में घुस गये 😱। Panama 🇵🇦 Jungle | Capurgana| USA,https://www.youtube.com/watch?v=pux309R_Ljo,Jai Mata Di America #usa     #usa #america #trending #reels #reelitfeelit #trend #explore #explorepage #usa     ...,UC1X4PBVhNsyavmtdy2XOZFA,Ankush Malik Vlogs
10,fbuFDw5Acg8,2022-12-29T04:00:19Z,India 🇮🇳 To USA 🇺🇸 | Part - 04 | जंगल में घुस गए 😈। America 🇺🇸Donkey | Donkey 2022| 2 Numbari,https://www.youtube.com/watch?v=fbuFDw5Acg8,Jai Mata Di America #usa     #usa #america #trending #reels #reelitfeelit #trend #explore #explorepage #usa     ...,UC1X4PBVhNsyavmtdy2XOZFA,Ankush Malik Vlogs
11,Wyhmg-aXmrY,2022-02-28T02:09:39Z,ILLEGAL USA MEXICO BORDER CROSSING || INDIA IN AMERICA 🇮🇳🇺🇲,https://www.youtube.com/watch?v=Wyhmg-aXmrY,Friends Every Sunday Live on Instagram SuntyDreams : https://www.instagram.com/suntydreams/ My Other New Channel Indian ...,UCV58hE-D4viqzIsGkJX-xtA,Sunty Dreams
12,FSGmJNlm5mQ,2022-12-04T16:17:41Z,US Donkey Process in 59 seconds! World&#39;s Deadliest Border!!,https://www.youtube.com/watch?v=FSGmJNlm5mQ,Full Video: https://www.youtube.com/watch?v=dSOMBC4156I&t=100s Get 2 FREE Stocks in US (valued up to $1400): ...,UCptc7b3jk_PtbpLLeZojRZA,Harnoor Singh
13,x-s0YoznGgU,2022-09-30T04:29:28Z,INDIA TO USA 🇺🇸 FULL DETAILS ASHU ROR || USA DONKEY MAI KAISE JATE HAI,https://www.youtube.com/watch?v=x-s0YoznGgU,INDIA TO USA FULL DETAILS ASHU ROR || USA DONKEY MAI KAISE JATE HAI Instagrams ...,UCKw8osbjurLZYFcwYp7SD5A,ASHU ROR
14,bwgBfJMP5s4,2022-12-09T13:00:47Z,India 🇮🇳 to America 🇺🇲 #usa donkey #viral #youtubeshorts #video🇺🇲🎯⛳️,https://www.youtube.com/watch?v=bwgBfJMP5s4,Pind vich vaje America wala ni.,UCVt0-0UpF2Cgd8BPawWebBw,usa_2numbri_wale56 
15,jHkGJE6_2Yc,2023-01-27T11:29:16Z,Usa Donkey Only 14 Lakhs Mai Direct Mexico,https://www.youtube.com/watch?v=jHkGJE6_2Yc,UsaDonkey# Usa Donkey Only 14 Lakhs Mai Direct Mexico Instagram https://www.instagram.com/Guraya #namastebackpacker ...,UCHsNErnX6cVbYnODtjgn9TA,Namaste Backpacker
16,q-h09idPxg4,2019-09-10T09:21:50Z,USA donkey ( only msg for those people who wants to go usa by donkey)  not orignal video,https://www.youtube.com/watch?v=q-h09idPxg4,This video in not original but we gave a msg to those who try to usa by donkey.,UCdMrnq-veiudEoCoFvtPNxw,The Real Amit Narwal
17,ApYh-QY53J8,2019-11-07T10:52:57Z,USA: Mexico Donkey Route - Way to Death | Full Explained | MK Films,https://www.youtube.com/watch?v=ApYh-QY53J8,"In this video, I am going to tell you all about What is the main Mexico donkey route. In this video, I am also going to tell that why ...",UCyEqAJHs9gezJwBKOw1chTA,MK Vlogs
18,SOtnnx6Zf5c,2022-09-20T04:14:51Z,USA Donkey I India to USA I #shorts,https://www.youtube.com/watch?v=SOtnnx6Zf5c,shorts #usa #freevisaadvisor USA Donkey I India to USA I #shorts My other Youtube Channel for : Shorts Free Visa Videos ...,UC4mifYMs39uMhHSBeP64dCg,Free Visa Advisor
19,X6YPd9OjytM,2022-10-14T00:39:13Z,INDIA TO USA | Flight donkey | Mexico donkey,https://www.youtube.com/watch?v=X6YPd9OjytM,All information about usa donkey.,UCGRozATAqhZW50gHNQIA0nQ,Milestone5
20,axXhqLiRMjA,2023-01-12T09:12:13Z,India To USA Donkey Route 2023 | mexico border crossing to usa | usa donkey 2023 | usa donkey 2023,https://www.youtube.com/watch?v=axXhqLiRMjA,mexico border crossing to usa...|| usa donkey 2023 || usa donkey border crossing || donkey || your queries: usa donkey usa ki ...,UCBxznLDX8FS5mG24c6Xhm2w,USA donker
21,EPlTfEptC3s,2019-09-13T09:20:26Z,🤔Indian family USA border crossing 🤔,https://www.youtube.com/watch?v=EPlTfEptC3s,border crossing Indian family.,UCO6pIFkW0-S9BzkeokU4zlQ,Indian Immigrants
22,45jmXri0fUc,2022-11-19T05:54:55Z,🇮🇳 India To Usa 🇺🇲 Donkey Route | Usa Donkey 2023 | America Donkey #shorts,https://www.youtube.com/watch?v=45jmXri0fUc,"donkey route to usa from india ,     | Usa Donkey | America Donkey #shorts #shorts #panamajungle #usaborder ...",UCJ2YrlSSzLlLPpHLvlM4dUg,Donkey Update 2.0
23,z5IOgk7WB4g,2022-09-15T01:00:09Z,USA Donkey I india to  usa donkey I #shorts,https://www.youtube.com/watch?v=z5IOgk7WB4g,shorts #freevisaadvisor #usadonkey My other Youtube Channel for : Shorts Free Visa Videos : https://rb.gy/ibeh26 Travel ...,UC4mifYMs39uMhHSBeP64dCg,Free Visa Advisor
24,VSPj51bioPc,2022-07-22T01:51:16Z,Usa Donkey wale🇺🇸/ America wale🇺🇸 / #usa #america #shorts,https://www.youtube.com/watch?v=VSPj51bioPc,,UCqmwrqXsVU9O0cNitUwV9aw,Pendu Bai
25,hG84NMmT0-4,2022-06-26T03:30:19Z,america to donkey#america,https://www.youtube.com/watch?v=hG84NMmT0-4,,UCiIeedvGgFROJ0TxwBK-VNQ,supan farmer
26,tNNAycX5gyU,2023-01-31T07:51:22Z,India 🇮🇳 to Usa 🇺🇸 Donkey,https://www.youtube.com/watch?v=tNNAycX5gyU,,UCSpetEnE8uaDZ1RKsViSGHg,USA DONKEY 🇺🇸
27,1pDi0dzT3wc,2022-11-20T07:33:06Z,India to Usa Donkey 🇺🇲| America donkey Wale #shorts,https://www.youtube.com/watch?v=1pDi0dzT3wc,Usa Donkey ਦਾ ਸਹੀ ਰਸਤਾ ਕਿਹੜਾ By Bus | India to Usa Donkey Route #shorts #shorts #ytshorts #shortvideos ...,UCJ2YrlSSzLlLPpHLvlM4dUg,Donkey Update 2.0
28,jcVx8KQDT8A,2022-09-04T06:04:11Z,डोंकी ko लेकर aapke सवालों ke जवाब ॥INDIA to USA🇺🇸 #haryanviinusa #donky #indianinamerica,https://www.youtube.com/watch?v=jcVx8KQDT8A,"india to usa donkey,usa donkey,india to america donkey map,india to usa,india to usa donky,#india to usa donky,#india to usa ...",UCyORkzQuHawChmz_QII3QXA,Jakhar vlogs
29,pM6H_zko9R4,2022-02-27T10:49:20Z,India to  Usa Donkey video ✈️(Crosing mexico border) video,https://www.youtube.com/watch?v=pM6H_zko9R4,,UCoVcoOBviip1G0t9YuP9BBQ,Sahil Kharb
30,vMpQuHznKbI,2022-11-15T08:04:19Z,Usa donkey 2023 🇺🇲 | India to Usa Donkey 🇮🇳 #shorts,https://www.youtube.com/watch?v=vMpQuHznKbI,Usa donkey | India to Usa #shorts #shorts #indiatousa #usaborder #americadonkey #americatoindia #usadonkey ...,UCJ2YrlSSzLlLPpHLvlM4dUg,Donkey Update 2.0
31,fnbB-ehHbVg,2022-10-12T19:15:01Z,USA Donkey I india to usa donkey I #shorts,https://www.youtube.com/watch?v=fnbB-ehHbVg,shorts #donkeyamerica #usa #usadonkey2023 #freevisaadvsior USA Donkey I india to usa donkey I #shorts Free Visa Advisor ...,UC4mifYMs39uMhHSBeP64dCg,Free Visa Advisor
32,4WPKTg8Lo6I,2022-10-22T01:45:00Z,USA Donkey I india to usa donkey I #shorts,https://www.youtube.com/watch?v=4WPKTg8Lo6I,shorts #usadonkey #usadonkey2022 #usa #freevisaadvisor USA Donkey I india to usa donkey I #shorts Free Visa Advisor don't ...,UC4mifYMs39uMhHSBeP64dCg,Free Visa Advisor
33,GVF0uDIygMQ,2023-02-01T14:05:11Z,Donkey India 🇮🇳 to Europe 🇪🇺 to 🇺🇸 Usa 2023  USA की Direct flight Europe से USA कैसे जाया जाता है,https://www.youtube.com/watch?v=GVF0uDIygMQ,Donkey India to Europe to Usa 2023 USA की Direct flight Europe से USA कैसे जाया जाता है ...,UCmclvZShO5ulsFCJSLIzCtw,Gourav Germany • 9.7M •view .2 days 
34,kCbW0Pqh7kc,2022-10-02T04:28:10Z,🇺🇸🏃🏻 #usadonkey #mexicoborder #indiatousa #panama #usa #mexico #america #punjabi #india #pakistani,https://www.youtube.com/watch?v=kCbW0Pqh7kc,,UCdtvGeKuOZbut8QD1r15lAw,SELFSION 
35,8on2Be9xQ_w,2021-05-04T05:53:20Z,USA : Mexico Donkey From India To America • 2021,https://www.youtube.com/watch?v=8on2Be9xQ_w,,UC-bUlL5QocVco7q4XIHfIYw,Josn Lather
36,1I3AjV8hydM,2022-09-22T07:48:14Z,USA Donkey I India to USA I USA Donkey 2022 I #shorts,https://www.youtube.com/watch?v=1I3AjV8hydM,visa #canadastudyvisa #canadavisa #freevisaadvisor USA Donkey I India to USA I USA Donkey 2022 I #shorts My other Youtube ...,UCnl6hk9yXS77kFVJNQlHjtg,Amazing Travel Shorts 
37,GR_YB9tQtNs,2022-12-19T05:53:03Z,Usa donkey 🇺🇲| India to Usa donkey | ਅਮਰੀਕਾ 🇺🇲 #shorts,https://www.youtube.com/watch?v=GR_YB9tQtNs,shorts #usaborder #usadonkey #viralshorts #americadonkey #panamajungle #indiatousa #americatoindia #    USA     ...,UCJ2YrlSSzLlLPpHLvlM4dUg,Donkey Update 2.0
38,j2bxTBWz0V8,2022-09-21T15:30:07Z,USA Donkey 2022 I India To USA I #shorts,https://www.youtube.com/watch?v=j2bxTBWz0V8,canadavisa #canada #touristvisa #pprtimeline #freevisaadvisor New Update Canada Tourist Visa Results Speed Fast Related ...,UC4mifYMs39uMhHSBeP64dCg,Free Visa Advisor
39,pKRsvAmfhCA,2022-07-21T04:33:48Z,Maxico Border June 2022 ||USA donkey ||India to USA #mexicoborder #usadonkey #panama,https://www.youtube.com/watch?v=pKRsvAmfhCA,"Hello Everyone, this is the latest update from Maxico - USA Border in this video .. Maxico border da haal Maxico USA donkey ...",UCdtvGeKuOZbut8QD1r15lAw,SELFSION 
40,cyYyT4scN6Y,2022-11-12T11:23:13Z,India🇮🇳 se America🇺🇸 ki donkey … Full detail …. Pure sfar ki Kya h hakikat …,https://www.youtube.com/watch?v=cyYyT4scN6Y,kamlikhotasikka.,UClxh51Dkbuj_A28m7LKzbyw,Kamli Khota Sikka
41,zV2eJFA7VOk,2021-08-08T02:42:05Z,usa donkey Vedio /police chasing/by Panama jungle /subscribe for more more 🙏 Vedio 🇮🇳🛫🇨🇦,https://www.youtube.com/watch?v=zV2eJFA7VOk,,UCdYf6_seMGE6J3mPlfTcSHw,Dream Canada🍁
42,9VD1UB3Jinw,2022-11-01T06:45:40Z,#america #donkey #2numabri #2numabri #panama #2numabri #india #indvsusa,https://www.youtube.com/watch?v=9VD1UB3Jinw,,UCxe-tfucj4BB_4MxnoHd4Vw,2 number wale
43,4PIkMIcc9qI,2022-04-04T11:09:18Z,2 number for India to USA donkey,https://www.youtube.com/watch?v=4PIkMIcc9qI,,UCfMP2moE5rlOtP9TCLqKc5Q,All Tips
44,R2JoXWzjPDE,2022-11-10T09:33:58Z,mexico to usa border crossing 2022 🇺🇲| Usa Donkey | usa border crossing video(Part 2) #shorts,https://www.youtube.com/watch?v=R2JoXWzjPDE,"america illegal entry punjabi | mexico to america donkey #shorts mexico to america donkey, Punjab NEws, Punjab news live, ...",UCJ2YrlSSzLlLPpHLvlM4dUg,Donkey Update 2.0
45,6nJjy-tcckQ,2022-11-17T10:03:58Z,India🇮🇳se Direct America🇺🇸 (USA) .full details in this video @kamlikhotasikka #haryana #Donkey,https://www.youtube.com/watch?v=6nJjy-tcckQ,,UClxh51Dkbuj_A28m7LKzbyw,Kamli Khota Sikka
46,SOm3vmHs43A,2022-09-14T12:33:31Z,Bail bond USA 🇺🇸 #usadonkey #mexicoborder #indiatousa #panama #usa #mexico #india #punjabi,https://www.youtube.com/watch?v=SOm3vmHs43A,"Hello Everyone, this is the latest update from Maxico - USA Border in this video .. Maxico border da haal Maxico USA donkey ...",UCdtvGeKuOZbut8QD1r15lAw,SELFSION 
47,ME1VmtDrtZo,2023-02-05T04:24:50Z,Full detailed video// Donkey// America// Camp 🏕️#donkey #bond #deport #indianinusa [ Part :2 ],https://www.youtube.com/watch?v=ME1VmtDrtZo,"america donkey,donkey to america,usa donkey,donkey america,india to america donkey,america donkey map,america,mexico to ...",UCyORkzQuHawChmz_QII3QXA,Jakhar vlogs
48,TUuYjDiqVgA,2022-11-06T07:42:02Z,Mexico to Usa Border Crossing 2022 🇺🇲 | Usa Donkey #shorts,https://www.youtube.com/watch?v=TUuYjDiqVgA,USA donkey Usa Mexico border Crossing Mexico to usa border Crossing Usa border coursing Mexico to usa donkey Punjab to ...,UCJ2YrlSSzLlLPpHLvlM4dUg,Donkey Update 2.0
49,4nVhsYEQSMA,2022-10-19T14:25:00Z,MEXICO to USA Donkey Route - Is it EASY or too DANGEROUS ?,https://www.youtube.com/watch?v=4nVhsYEQSMA,Crossing over to USA from Mexico illegally is a very popular donkey route among Indians. In this travel vlog I met a few Indian ...,UCCZrWLq1BlpxvIF9wwhv5Lg,The Punjabi Wanderer
50,zAFiNAh6emM,2021-11-02T12:53:45Z,New update 2021 USA donkey Bond information in hindi kitna kharcha aaya,https://www.youtube.com/watch?v=zAFiNAh6emM,New update 2021 USA donkey Bond information in hindi.,UCjj9Rtf2GquenO-LX0Wkd1w,Hello india
51,OhbRJ7Q3qaw,2022-11-02T07:30:26Z,America Border Crossing Today Punjabi 🇺🇲🇮🇳| Usa Donkey #shorts,https://www.youtube.com/watch?v=OhbRJ7Q3qaw,shorts #ytshorts #shortvideo #usadonkey #americadonkey #usaborder #indiatousa #americatoindia #panamajungle ...,UCJ2YrlSSzLlLPpHLvlM4dUg,Donkey Update 2.0
52,oaGhmgO5VFY,2022-11-18T07:03:14Z,Ecuador Update | India to Ecuador donkey flight | Ecuador to USA- ਯੂਐਸਏ ਡੀ ਡੰਕੀ .,https://www.youtube.com/watch?v=oaGhmgO5VFY,Ecuador visa free | India to Ecuador donkey flight | Ecuador to USA- ਯੂਐਸਏ ਡੀ ਡੰਕੀ .,UCEFJ74BQdQ7kGHXX2D8nfRA,Teach visa Punjabi
53,EQmKCvEO6T8,2022-08-21T22:55:14Z,INDIA TO USA DONKEY 🇺🇲,https://www.youtube.com/watch?v=EQmKCvEO6T8,,UC0hbO6CYJZ2czXuyl74Rdng,2 NUMBERI
54,x0DttuvnSdI,2022-10-25T04:51:47Z,Today Mexico to Usa Border Crossing 🇺🇲| America Donkey 🙏 #shorts,https://www.youtube.com/watch?v=x0DttuvnSdI,Today Mexico to Usa Border Crossing | America Donkey #shorts #shorts #ytshorts #shortsvideo #usadonkey #usaborder ...,UCJ2YrlSSzLlLPpHLvlM4dUg,Donkey Update 2.0
55,4fODIBVwUdw,2022-03-21T09:50:15Z,ਅਮਰੀਕਾ ਦੀ ਡੌਕੀ ਲਗਾਉਣ ਵਾਲਿਆਂ ਦਾ ਹਾਲ ਦੇਖੋ/ America di donkey lagon walya da haal dekho,https://www.youtube.com/watch?v=4fODIBVwUdw,American di donkey walya da haal dekho America di donkey lagon de punjabi punjabi in America by do number #viralvideo ...,UCE38TSDFHC_XWsq1_DKgohA,fateh talk
56,lUX8hk9lTqU,2022-11-24T11:38:29Z,India 🇮🇳  से कपड़े America 🇺🇸 क़ेसे लाए / # Usa #america #donkey #rinku pandit,https://www.youtube.com/watch?v=lUX8hk9lTqU,India से America कपड़े केसे लाए #us #america #usa #donkey # #india #mixco #bgmi #amrica #edit #video ...,UCFXf57dvcJEK6-BCv3-HWaA,Rinku Pandit
57,iEP5XwVqKDg,2022-03-24T10:21:42Z,Donkey route to USA 🇺🇸 || ग़ैरक़ानूनी तरीक़े से अमरीका कैसे जाते है लोग 😳 Shocked | America,https://www.youtube.com/watch?v=iEP5XwVqKDg,Donkey route to USA || ग़ैरक़ानूनी तरीक़े से अमरीका कैसे जाते है लोग Shocked ...,UCUlcXqOcpFJWorfSP6YTDvQ,Indian In China
58,DymBPxi57Cw,2022-12-05T02:16:46Z,AMERICA DONKEY I INDIA TO USA I #shorts,https://www.youtube.com/watch?v=DymBPxi57Cw,shorts #shortsvideo #usadonkey #usadonkey2022 #freevisaadvisor AMERICA DONKEY I INDIA TO USA I #shorts Free Visa ...,UC4mifYMs39uMhHSBeP64dCg,Free Visa Advisor
59,ibruiTY5wj4,2022-12-05T04:59:00Z,I got Detained at US-Mexico Border!! Donkey Process?,https://www.youtube.com/watch?v=ibruiTY5wj4,Traveling to the US / Mexico Border which is one of the deadliest border in the world! Part 1: https://youtu.be/dSOMBC4156I Get ...,UChYs-_zjKRYhdMddjx-NPLw,Singh in USA
60,rlMPueqwTFk,2022-08-20T18:22:34Z,pakistan se america jane ka rasta | india se america ki donkey | usa donkey border crossing 2022 |,https://www.youtube.com/watch?v=rlMPueqwTFk,pakistan se america jane ka rasta | india se america ki donkey | usa donkey border crossing 2022 | assalamu alaikum ...,UCcrPBcOsaWnrl7naY8ZAvLQ,ihtisham plus ali
61,ewD2WoBJT4c,2022-04-23T16:00:47Z,INDIA TO USA DONKEY #india#usa#america#donkey,https://www.youtube.com/watch?v=ewD2WoBJT4c,,UC_cTqv0fXBr55Y_DUtkBhlA,SATYAM ROR BAKAL
62,0GGlP1Nthb0,2022-10-27T14:00:01Z,USA Donkey I india to usa donkey I #shorts,https://www.youtube.com/watch?v=0GGlP1Nthb0,shorts #usadonkey #usadonkey2022 #usa #freevisaadvisor USA Donkey I india to usa donkey I #shorts Watch the full video of ...,UC4mifYMs39uMhHSBeP64dCg,Free Visa Advisor
63,VS5ncqU3dow,2022-11-30T11:52:48Z,mexico border crossing to usa...|| usa donkey 2022 || usa donkey border crossing || donkey ||,https://www.youtube.com/watch?v=VS5ncqU3dow,donkey americaa || donkey 2022 ||Usa donkey america ||donkey ||mexico border crossing to usa punjabiIndia to USA donkey ...,UCc3JmivcpjAGnd1-p-ldtaQ,Technical gill
64,dg-XeDJUcms,2021-03-06T14:33:07Z,#USA #donkey donkey indian boy punjabi boy mexico to usa donkey hindi information,https://www.youtube.com/watch?v=dg-XeDJUcms,USA #donkey America donkey indian boy punjabi boy mexico to usa donkey hindi information.,UCjj9Rtf2GquenO-LX0Wkd1w,Hello india
65,mOJNMf0T2yE,2021-07-12T04:30:13Z,USA 🇺🇸 DONKEY Punjabi Latest 2021 update 🇺🇸 America Donki India to USA,https://www.youtube.com/watch?v=mOJNMf0T2yE,Malwa vlogs official channel.,UCiOxZwUJNjPnLZ-z3vc-Lew,68 62 Mehkma vlogs
66,sGmPtSZlAFY,2022-09-21T00:30:09Z,USA Donkey I india to  usa donkey I #shorts,https://www.youtube.com/watch?v=sGmPtSZlAFY,shorts #usa #freevisaadvisor #usadonkey #donkeytousa USA Donkey I india to usa donkey I #shorts My other Youtube Channel ...,UC4mifYMs39uMhHSBeP64dCg,Free Visa Advisor
67,SCA9EeJLxr4,2022-12-22T19:27:14Z,"पहुंच गया रिश्तेदार .. India to usa donkey, Usa donkey",https://www.youtube.com/watch?v=SCA9EeJLxr4,"usa #usadonkey #amarjeet ,#aj PlZ share and comment my you tube channel AJ Malik #donky Instagram....",UCWM4pBk1ZXZgiBk0q8SzdBA,A.J MALIK VLOG
68,m3e4Tm8iIA0,2022-01-06T08:39:48Z,"America ki donkey, india se. #america #mexico #usa #india #donkey #2022  #punjab #haryana #delhi..",https://www.youtube.com/watch?v=m3e4Tm8iIA0,,UCBvz-N3G4BiFJHxk9_DXvdw,Haryanvi vloggers
69,KmThXoCiWQA,2022-03-14T06:00:04Z,"Live 🔴 India to USA donkey 2022 , Punjabi, Indian boy&#39;s enter to Mexico border India to America",https://www.youtube.com/watch?v=KmThXoCiWQA,"India to USA donkey 2022 , Punjabi, Indian boy's enter to Mexico border India to America If you like the video, be sure to subscribe ...",UCyyv0HxMVYsucE04er_Vwlg,Vikas Malik Vlogs
70,fSyA2opagf4,2022-09-15T03:20:35Z,todayTexas border crossing🇺🇲 Mexico to America bordercrossing  #donkey#india to usa #punjabidonkey,https://www.youtube.com/watch?v=fSyA2opagf4,donkey americaa || donkey 2022 ||Usa donkey america ||donkey ||mexico border crossing to usa punjabiIndia to USA donkey ...,UCc3JmivcpjAGnd1-p-ldtaQ,Technical gill
71,gezNSO_X8Uo,2023-02-06T08:32:00Z,ILLEGAL USA MEXICO BORDER CROSSING | india To Usa | Why Indians cross US Mexico Border? |@singhusa,https://www.youtube.com/watch?v=gezNSO_X8Uo,"DonkiUSA, #USAxDonki, #DonkiIndiaToUSA, #DonkiRouteIndiaToUSA, #DonkiTravelIndiaToUSA, #DonkiVoyageIndiaToUSA, ...",UChwXGCPyDxkUscLBaJ4UEuA,Its 4 You
72,nbU-Mo-l32E,2022-12-29T04:00:12Z,USA DONKEY 🇺🇲 VIDEO || PANAMA JUNGEL MAFIA MILA 🥷🥷 || Part- 4 पनामा जंगल डोंकी वीडियो ! #tranding,https://www.youtube.com/watch?v=nbU-Mo-l32E,USA DONKEY VIDEO || PANAMA JUNGEL DONKEY VIDEO || Part- 4 पनामा जंगल डोंकी वीडियो !,UCtLr-VlUjuxh4zUQA6pu_zg,2 Numbari USA Wala
73,nIMz5oyLzd8,2021-04-13T02:16:29Z,USA donkey status | India to USA by mexico donkey |,https://www.youtube.com/watch?v=nIMz5oyLzd8,usa_donkey #illegal_entry.,UC-hDxV365j4HawMLJeLprJw,Status Lover
74,o117aVZldlo,2022-11-14T01:53:04Z,India to USA Donkey #shorts,https://www.youtube.com/watch?v=o117aVZldlo,shorts #freevisaadvisor Free Visa Advisor don't promote illegals border crossing activities. This video is only for awareness ...,UC4mifYMs39uMhHSBeP64dCg,Free Visa Advisor
75,Zg6CQaPEUuk,2023-02-07T04:30:17Z,USA 🇺🇸 DONKEY VIDEO || MEXICO BORDER CROSSING TO USA ENTER FULL VIDEO #usa #tranding,https://www.youtube.com/watch?v=Zg6CQaPEUuk,USA DONKEY VIDEO ||AMERICA CAMP || PANAMA JUNGEL DONKEY VIDEO DONKY VIDEO 02/02/2023 #shorts 2 ...,UCtLr-VlUjuxh4zUQA6pu_zg,2 Numbari USA Wala
76,fcpCTgeiBew,2021-06-09T07:00:24Z,"ਕਿਵੇਂ ਲੱਗਦੀ ਹੈ America ਦੀ Donkey, ਅਸੀਂ 10-10 ਦਿਨ ਸਿਰਫ ਪਾਣੀ ਪੀ ਕੇ ਸਾਰਦੇ ਸੀ | Punjab News",https://www.youtube.com/watch?v=fcpCTgeiBew,"ਕਿਵੇਂ ਲੱਗਦੀ ਹੈ America ਦੀ Donkey, ਅਸੀਂ 10-10 ਦਿਨ ਸਿਰਫ ਪਾਣੀ ਪੀ ਕੇ ਸਾਰਦੇ ਸੀ | Punjab ...",UCFtL8JvK7JwQISlYV4GvD-Q,Punjab News
77,941PdezuX3w,2022-10-15T07:15:10Z,USA Donkey I india to usa donkey I #shorts,https://www.youtube.com/watch?v=941PdezuX3w,shorts #freevisaadvisor #usadonkey #usadonkey2023 USA Donkey I india to usa donkey I #shorts Free Visa Advisor don't ...,UC4mifYMs39uMhHSBeP64dCg,Free Visa Advisor
78,9ifKqxI_KaY,2022-10-29T01:30:03Z,USA Donkey I india to usa donkey I #shorts,https://www.youtube.com/watch?v=9ifKqxI_KaY,shorts #usadonkey #usadonkey2022 #usa #freevisaadvisor USA Donkey I india to usa donkey I #shorts Free Visa Advisor don't ...,UC4mifYMs39uMhHSBeP64dCg,Free Visa Advisor
79,aFUZA9KK8BE,2023-01-17T10:43:18Z,india 🇮🇳 to America 🇺🇲 (Panama jungle) #donkey   #panama  #usa,https://www.youtube.com/watch?v=aFUZA9KK8BE,india to America (Panama jungle) india to USA donkey Panama jungle vlogs other loves: #2numberi #donkeyamerica ...,UCTdcm9YTwT3JJfjROruBKLQ,sumit vlogs
80,iJS4RE5GbE8,2022-12-18T09:13:35Z,"America Donkey 🇺🇲,| India to Usa Donkey 🇺🇲 2022 #shorts",https://www.youtube.com/watch?v=iJS4RE5GbE8,(Part 8) Mexico To America Border Crossing | Usa Donkey 2022 | #shorts #shorts #usaborder #usadonkey ...,UCJ2YrlSSzLlLPpHLvlM4dUg,Donkey Update 2.0
81,xnlfcW5JUpE,2022-10-05T11:07:05Z,India to usa donkey #shorts  #gauravmaan,https://www.youtube.com/watch?v=xnlfcW5JUpE,usa donkey full video on main channel.,UCRnyDDxptQzXqADcUyiEtVQ,Gaurav Maan Shorts
82,V6_j3-NOe-A,2022-09-10T13:48:00Z,Donkey INDIA to USA…. USA VISA .. Success rate,https://www.youtube.com/watch?v=V6_j3-NOe-A,abroad #study #instagram #usa.,UCzV2dP6NhRygivDLSujivgw,Flying Ventures Immigration
84,RM-aWZURetU,2022-08-20T21:38:46Z,mexico border crossing to usa...|| usa donkey 2022 || usa donkey border crossing || donkey ||,https://www.youtube.com/watch?v=RM-aWZURetU,donkey americaa || donkey 2022 ||Usa donkey america ||donkey ||mexico border crossing to usa punjabiIndia to USA donkey ...,UCc3JmivcpjAGnd1-p-ldtaQ,Technical gill
85,mJkBArCpz4o,2020-04-14T01:20:51Z,US(America) ki Donkey | India to USA | | Punjabi IN USA,https://www.youtube.com/watch?v=mJkBArCpz4o,Pakistan India to US ki Donkey. USA ki Donkey information in Punjabi. USA (America) ki Donkey |India (Punjab) to Us America ...,UCEFJ74BQdQ7kGHXX2D8nfRA,Teach visa Punjabi
86,y86J1F68uCA,2022-01-30T05:18:26Z,USA DONKEY VISA Illegally Border Crossing से क्या होता है | India To USA | India To USA DONKEY VISA,https://www.youtube.com/watch?v=y86J1F68uCA,IndiansInCanada #IndianFamily #HumanSmuggling USA DONKEY VISA Illegally Border Crossing से क्या होता है ...,UCdvfzzIhnq4_WOZDP8L1oPw,RK'S IN AMERICA
87,hpGdwVJtT_4,2019-08-09T10:59:44Z,Reaction on INDIA to U.S.A by Donkey | Illegal Way India to U. S. A | Life in Danger,https://www.youtube.com/watch?v=hpGdwVJtT_4,"Disclaimer : Copyright Disclaimer Under 107 of the Copyright Act 1976, allowance is made for ""fair use"" for purposes such as ...",UCDOk20xpy9mww4BDeHc-ncw,Vicky kee
88,akgFnJamq0k,2022-11-30T21:07:37Z,USA donkey 😱😱 #shorts #youtubeshorts #viral #trending #usa #usadonkey #india #maxico #harry5267,https://www.youtube.com/watch?v=akgFnJamq0k,"USA donkey #shorts #youtubeshorts #viral #trending #usa #usadonkey #india #maxico #harry5267shorts,short,funny,funny ...",UCemSnfo0PHrdCma1tExCIig,Harry5267
