,videoId,publishedDate,title,videoUrl,description,channelId,channelTitle
293,bgC6olkVXlM,2022-10-30T05:30:06Z,USA Donkey I india to usa donkey I #shorts,https://www.youtube.com/watch?v=bgC6olkVXlM,shorts #usadonkey #usadonkey2022 #usa #freevisaadvisor USA Donkey I india to usa donkey I #shorts Free Visa Advisor don't ...,UC4mifYMs39uMhHSBeP64dCg,Free Visa Advisor
294,wy812jAlwUk,2022-09-21T00:30:22Z,USA donkey I India to USA I Why people are so Crazy I #shorts,https://www.youtube.com/watch?v=wy812jAlwUk,shorts #usa #usadonkey #indiatousa #freevisaadvisor #austrliavisa #usvisa USA donkey I India to USA I Why people are so ...,UCnl6hk9yXS77kFVJNQlHjtg,Amazing Travel Shorts 
295,RWAChFxsDp8,2021-06-13T19:35:12Z,Donkey india to USA da safar Indian bande da safar donky la k usa,https://www.youtube.com/watch?v=RWAChFxsDp8,,UClqV3vx82_HYiBjPbqtUlIw,Life Luck game
296,Jutq4yxN68I,2022-11-25T01:30:08Z,USA DONKEY I INDIA TO USA I America Donkey I,https://www.youtube.com/watch?v=Jutq4yxN68I,usa #usadonkey #freevisaadvisor #usadonkey2022 USA DONKEY I INDIA TO USA I America Donkey I Free Visa Advisor don't ...,UC4mifYMs39uMhHSBeP64dCg,Free Visa Advisor
297,vSjqCCE5aeQ,2022-11-06T04:21:29Z,usa donkey I India to USA I #shorts,https://www.youtube.com/watch?v=vSjqCCE5aeQ,"shorts #usadonkey #usadonkey2022 In this video, we'll be talking about the harmful act of the US donkey. We'll discuss the ...",UC4mifYMs39uMhHSBeP64dCg,Free Visa Advisor
298,hHnDmV1sgC0,2022-02-26T11:14:23Z,USA Donkey new update #tourist portugal TRC #visa deport from USA,https://www.youtube.com/watch?v=hHnDmV1sgC0,usa donkey new update portugal trc 2022 deport from USA.,UCjj9Rtf2GquenO-LX0Wkd1w,Hello india
305,EAZPRQ_E3PU,2022-12-11T01:38:53Z,USA Donkey I India To USA I America Donkey I #shorts,https://www.youtube.com/watch?v=EAZPRQ_E3PU,shorts #usadonkey #usadonkey2022 #freevisaadvisor USA Donkey I India To USA I America Donkey I #shorts Free Visa Advisor ...,UC4mifYMs39uMhHSBeP64dCg,Free Visa Advisor
317,oWz7-92fQY8,2022-06-28T08:41:36Z,New America Donkey Video | Mexico border crossing | Indian boys in donkey | 2022,https://www.youtube.com/watch?v=oWz7-92fQY8,Usa donkey video mexico border crossing 2022 boys #usadonkey #donkey #america #indianinamerica #usadonkeyvideo ...,UCypuIdlqQELMH_vKb5FMcbQ,Indian American
319,8r7fXoSC0DY,2022-08-20T04:30:01Z,"India to USA donkey 2022 , Live India boys and girls enter to Mexico border || India to usa donkey",https://www.youtube.com/watch?v=8r7fXoSC0DY,usadonkey #fullupdate #delhitomexico #panamajungle #mexico #usa #usanews #panama #usaborder #mexicocity ...,UCeHoKS7MenElXAcDwBgj3HQ,usa donkey 2.O
320,FjKveUVM1pY,2022-09-23T06:49:42Z,USA DONKEY II INDIA TO USA II Panam Jugle Run II,https://www.youtube.com/watch?v=FjKveUVM1pY,usa #usadoneky #usvisa #freevisaadvisor USA DONKEY II INDIA TO USA II Panam Jugle Run II My other Youtube Channel for ...,UCnl6hk9yXS77kFVJNQlHjtg,Amazing Travel Shorts 
321,d8kbFGhqXBw,2023-01-28T07:16:55Z,#usa #panama #india #america #video #donkey #2023 #shorts #song #2023election #2023song #2numbari,https://www.youtube.com/watch?v=d8kbFGhqXBw,"usa donkey , donkey usa , america donkey , donkey america , india to usa donkey , usa donkey border crossing , usa donkey ...",UCDOCK-oMuY_YhlZXCaWirEQ,SD SURA JAGSI
322,4wWxRtGd4gE,2018-10-25T14:43:49Z,Guatemala to usa illegal [ india pakistan afghanistan ]USA KI DONKEY PARTS 6 2018 in URDU&amp;HINDI.,https://www.youtube.com/watch?v=4wWxRtGd4gE,Guatemala to usa in hindi and urdu India to usa by donkey america donkey in hindi. Donkey in hindi USA KI donkey hindi and ...,UCYyk3C5bP0IVvukAnGibl7w,TEACH VISA
323,cIeQjL7Uskw,2022-05-22T04:00:11Z,Portugal to usa visa or donkey || full information || punjabi portugal || donkey or tourist visa ||,https://www.youtube.com/watch?v=cIeQjL7Uskw,portugalimmigration #portugaltousa #usadonkey #harryprincezira #america #americantrucksimulator To contact me Instagram ...,UCN2NOlepC1ZiDGFSgJGgqaw,Punjab 47 Harry
324,ogHoL6Um1j0,2022-04-09T09:14:57Z,usa donkey new rules and regulations 2022 डॉन्की लगाने के खतरे और नए कानून ध्यान से देखें वीडियो🙏🏻🙏🏻,https://www.youtube.com/watch?v=ogHoL6Um1j0,usa donkey new rules and regulations 2022.,UCjj9Rtf2GquenO-LX0Wkd1w,Hello india
325,NTwcBPyeFXM,2022-12-10T05:33:32Z,#trending #trendingshorts #viralshorts #shorts #shortsvideo #viral #canada #usa #donkey  #india #uk,https://www.youtube.com/watch?v=NTwcBPyeFXM,,UCUlRsgoPPSKg0Fau41evHWQ,International Tourist Baba
326,Dw4sjN_AORk,2022-10-21T14:30:06Z,USA Donkey I india to usa donkey I #shorts,https://www.youtube.com/watch?v=Dw4sjN_AORk,shorts #usadonkey #usadonkey2022 #usa #freevisaadvisor USA Donkey I india to usa donkey I #shorts Free Visa Advisor don't ...,UC4mifYMs39uMhHSBeP64dCg,Free Visa Advisor
327,UDmrMzFQiTI,2022-10-01T06:30:10Z,USA Donkey 2022 I india to usa donkey I #shorts,https://www.youtube.com/watch?v=UDmrMzFQiTI,shorts #freevisaadvisor #indiatousa #usadonkey USA Donkey 2022 I india to usa donkey I Free Visa Advisor don't promote ...,UC4mifYMs39uMhHSBeP64dCg,Free Visa Advisor
328,kYdWQquaEgA,2022-10-30T05:15:01Z,USA Donkey I india to usa donkey I #shorts,https://www.youtube.com/watch?v=kYdWQquaEgA,shorts #usadonkey #usadonkey2022 #usa #freevisaadvisor USA Donkey I india to usa donkey I #shorts Free Visa Advisor don't ...,UC4mifYMs39uMhHSBeP64dCg,Free Visa Advisor
329,Nvwxaamw0vY,2022-04-18T16:35:05Z,Donkey panama jungle | Usa donkey | Panama jungle donkey #usadonkey #panamajungle,https://www.youtube.com/watch?v=Nvwxaamw0vY,Donkey panama jungle | Usa donkey | Panama jungle donkey #usadonkey #panamajungle #usadonkeyvideo #donkeyVideo ...,UCM9sh4ZaCNobsUIealSb5tg,Candy's Junction
330,92eRTmUVhHY,2022-12-05T01:47:50Z,USA DONKEY I INDIA TO USA I #shorts,https://www.youtube.com/watch?v=92eRTmUVhHY,shorts #usadonkey #freevisaadvisor #indiatousa USA Donkey I India to USA I #shorts Free Visa Advisor don't promote illegals ...,UC4mifYMs39uMhHSBeP64dCg,Free Visa Advisor
331,rNCUuvawDDI,2022-11-19T13:48:58Z,अमेरिका की दुकान//#Donky#america #usa #RinkuPandit#india#donkey,https://www.youtube.com/watch?v=rNCUuvawDDI,,UCFXf57dvcJEK6-BCv3-HWaA,Rinku Pandit
332,Umch9pEFwcE,2022-10-11T06:07:27Z,USA Donkey Mexico border crossing after 3 months .,https://www.youtube.com/watch?v=Umch9pEFwcE,,UC4J0okQOD4NdCkwzXQXJ34w,LIFE SPEND WITH FUN
333,NzcLgcGjiuQ,2021-09-24T16:26:31Z,USA Donkey #usa #india  #mexico mexico border,https://www.youtube.com/watch?v=NzcLgcGjiuQ,,UCaZb9fREcOIsZvLtzHne9tQ,Love ❤️
334,Qm3Qxhz4HqI,2022-08-19T08:30:07Z,India to USA donkey Live 2022 || usa camp jail || usa donkey camp || America donkey Jail || usa,https://www.youtube.com/watch?v=Qm3Qxhz4HqI,usadonkey #fullupdate #delhitomexico #panamajungle #mexico #usa #usanews #panama #usaborder #mexicocity ...,UCeHoKS7MenElXAcDwBgj3HQ,usa donkey 2.O
335,oRYMw0IaBpA,2022-04-16T14:36:20Z,USA donkey ||America Donkey ||Mexico Bader Crossing video || New Video || US Donkey || India to USa.,https://www.youtube.com/watch?v=oRYMw0IaBpA,USA donkey America Donkey Mexico Bader Crossing video New Video US Donkey India to USa India to USA donkey.. aaja ...,UCiwf8F1te4A3wx3R3D-AWPw,The Banveer Ramgarhia
336,nrlQpxDz1iM,2022-10-18T12:18:38Z,🇮🇳India to USA 🇺🇸 America donkey wale 40 lakh wale,https://www.youtube.com/watch?v=nrlQpxDz1iM,,UCFbBAa7x_YBapTDI0XPADLQ,40_lakh_wale
337,0y5xvXKmkws,2022-09-21T04:40:24Z,INDIAN USA MAI JAKAR KYA KAM KARTE HAI || ￼INDIAN KO USA MAI KITNE PAISE MILTE HAI,https://www.youtube.com/watch?v=0y5xvXKmkws,INDIAN USA MAI JAKAR KYA KAM KARTE HAI || INDIAN KO USA MAI KITNE PAISE MILTE HAI Instagram :- ashu_ror_22 ...,UCKw8osbjurLZYFcwYp7SD5A,ASHU ROR
338,vRGYU09W2l8,2022-10-13T16:20:56Z,maxico Usa border crossing Panama Jungle donkey | India To USA Mexico border #shorts #india #usa,https://www.youtube.com/watch?v=vRGYU09W2l8,,UCXckAFCIdiUpFF4cBzq4eUQ,USA Canada Visa Update
339,slXXdM31LHU,2022-09-30T06:30:10Z,India to USA: How to get a Visa I USA Donkey I USA Donkey 2022 I,https://www.youtube.com/watch?v=slXXdM31LHU,"usadonkey,#donkeyusa,#panamajungle,#usa,#mexicodonkey,#mexicojungle,#usaborder,#mexicoborder India to USA: How to ...",UC4mifYMs39uMhHSBeP64dCg,Free Visa Advisor
340,p1slcTFdPIQ,2022-11-14T22:58:22Z,Usa donkey | donkey shayri | india to usa donkey | aj__ usa | #haryana #donkey,https://www.youtube.com/watch?v=p1slcTFdPIQ,,UCOZ4WFDBKT71c3kxTZMgWGA,Aryan__usa_
341,Mol-LRNV5N4,2023-01-09T01:30:05Z,India 🇮🇳 To USA 🇺🇸 | Part - 08 | पेरू 🇵🇪 के नज़ारे 😍| भाइयों की मोज़ मस्ती😂। USA 🇺🇸 Donkey,https://www.youtube.com/watch?v=Mol-LRNV5N4,Jai Mata Di America #usa     #usa #america #trending #reels #reelitfeelit #trend #explore #explorepage #usa     ...,UC1X4PBVhNsyavmtdy2XOZFA,Ankush Malik Vlogs
342,gGs0uU5vSBE,2022-09-10T09:34:08Z,usa donkey india to usa,https://www.youtube.com/watch?v=gGs0uU5vSBE,Pl subscribe our chennal for more information Jassi Backpacker Vlogs.,UCdO_wi4TJhvMynJcUOw6UBQ,Jassi backpacker vlogs
343,v72Y2zmLuUU,2022-12-04T01:50:09Z,USA Donkey I India to USA I Panama k Jungle I #shorts,https://www.youtube.com/watch?v=v72Y2zmLuUU,shorts #usadonkey #freevisaadvisor #indiatousa USA Donkey I India to USA I Panama k Jungle I #shorts Free Visa Advisor don't ...,UC4mifYMs39uMhHSBeP64dCg,Free Visa Advisor
344,PswI9oN7NIA,2022-11-06T17:09:11Z,ILLEGAL USA MEXICO BORDER CROSSING | panama jungle donkey | india to usa donkey route | new donkey,https://www.youtube.com/watch?v=PswI9oN7NIA,ILLEGAL USA MEXICO BORDER CROSSING | panama jungle donkey | india to usa donkey route | new donkey ...,UCcrPBcOsaWnrl7naY8ZAvLQ,ihtisham plus ali
345,u-_5rgrK7mo,2021-06-10T18:17:28Z,Trucking Job After 🇺🇸 USA donkey from india to America Donkey | truck 🚚 lifestyle,https://www.youtube.com/watch?v=u-_5rgrK7mo,,UCIatwPT8do3a0VYLyW_TqXA,2M Shorts
346,1ydFuXBbQ80,2022-09-15T01:07:42Z,America Donkey 🇺🇲 ||Usa Border Crossin 2022,https://www.youtube.com/watch?v=1ydFuXBbQ80,America Donkey || Mexico _ Usa Border Crossin 2022 #indiatousa #amricadonkey #americatoindia #indiatocanada ...,UCJ2YrlSSzLlLPpHLvlM4dUg,Donkey Update 2.0
347,p1JP8bYT-5Y,2022-08-26T21:36:30Z,USA Donkey - Indian police arrested agents &amp; 1800 passengers with fake visas - USA Asylum - Title 42,https://www.youtube.com/watch?v=p1JP8bYT-5Y,Indian police arrested hundreds of passengers and agents with fake visas and passports. USA Supreme Court ended the Remain ...,UCNO8hV-L4yv9AZAPksDjLTA,Immigration and Asylum News
348,mGE2LfqH8vI,2022-10-28T05:00:29Z,Donkey Usa | Donkey America | Usa Donkey 2022 | 100 से जादा Indian donkey लगाते,https://www.youtube.com/watch?v=mGE2LfqH8vI,Donkey Usa | Donkey America | Usa Donkey 2022 | 100 से जादा Indian donkey लगाते #usadonkey #usadonkey2022 ...,UCzUuSLnlDg59Zs0Qi2h_QlA,TRUE INDIAN RD
352,1MFS6-3DQzc,2021-05-25T13:31:53Z,USA donkey video 2021 America donkey new video 2021 India 🇮🇳 to America boarder crossings,https://www.youtube.com/watch?v=1MFS6-3DQzc,,UCIatwPT8do3a0VYLyW_TqXA,2M Shorts
355,xz4sE7Buurs,2022-05-12T07:04:38Z,PANAMA JUNGLE || DONKEY 2022 INDIA TO USA || PART 1  @billavlogs06,https://www.youtube.com/watch?v=xz4sE7Buurs,This Is Video only for knowledge everyone have to know what happen in jungle there is no water no food how we survive so wait ...,UCpPDxm5QC5sfqmWSsUI16uw,Billa Vlogs
356,DThCYHVlQRo,2021-05-22T18:46:05Z,America USA Donkey new video 2021 | USA America donkey new video 2021 | INDIA TO USA,https://www.youtube.com/watch?v=DThCYHVlQRo,When i was in USA donkey | America Donkey route or diwar crossing America Donkey 2021 Mexico boader crossings.,UCcy_YHWO7b6xFQKnqws62gw,Anuj Dhanda
360,_B-9aZsJSeg,2023-02-07T11:26:35Z,Usa Mexico Donkey | USA Mexico Border Update | India To USA Donkey#usadonkey#mexicoborder#border#usa,https://www.youtube.com/watch?v=_B-9aZsJSeg,My channel:-https://www.youtube.com/channel/UCn7K... Press The BELL ICON For Get Next Video Information. For Daily Live ...,UCn7KrefotvouJeYXzwRBpfw,Rohit Backpacker
361,54IHVR4FXD8,2022-12-21T01:31:06Z,USA Donkey I India to USA I ਦੋਂਕੀ ਤੋਂ ਬਾਅਦ ਲਿਵ ਕੋਮੇੰਟ੍ਰੀ  #shorts,https://www.youtube.com/watch?v=54IHVR4FXD8,shorts #freevisaadvisor #usadonkey #usadonkey2022 USA Donkey I India to USA I ਦੋਂਕੀ ਤੋਂ ਬਾਅਦ ਲਿਵ ...,UC4mifYMs39uMhHSBeP64dCg,Free Visa Advisor
362,1SHwMfzUscw,2022-08-17T02:35:34Z,New News For Donkey 2022 || New update India 🇮🇳 to Usa 🇺🇸 donkey,https://www.youtube.com/watch?v=1SHwMfzUscw,New News For Donkey 2022 || New update India to Usa donkey channel link ...,UCGX2FGGulDSJHaEMa0uNOfg,Nishu Deswal Hr31
363,cxUxIEkBjO8,2023-01-23T05:41:37Z,Indian restaurant in USA 🇺🇸 #donkey #usa #2numabri #2numberi #america #haryanaale #panama,https://www.youtube.com/watch?v=cxUxIEkBjO8,Insta= honeymaan05 Insta=rishideswal USA में काम क्यों नहीं मिल रहा कैसे मिलेगा ...,UCbxP5ppeghypksQtdbMSzog,Deswal & Maan
364,zIXjOJDhN_s,2021-06-06T09:17:42Z,#Usa open fligts#Usa donkey good news for tourist from india#,https://www.youtube.com/watch?v=zIXjOJDhN_s,nformation usa visa information.,UCdO_wi4TJhvMynJcUOw6UBQ,Jassi backpacker vlogs
365,J-vjf2jDOuI,2022-05-10T14:32:58Z,Europe To  Usa Donkey || Europe To Mexico Information🇺🇸 || ਪੁਰਤਗਾਲ ਤੋਂ ਮੈਕਸੀਕੋ ਕਿਵੇਂ ਜਾ ਸਕਦੇ 2022,https://www.youtube.com/watch?v=J-vjf2jDOuI,EuropeToUsa #PortugaltoUsa #EuropeToMexico #EuropeToMexicoDonkey #Portugaltrctomexico Welcome to our youtube ...,UCd2Pd4t8gYjOqD2kssThbXA,Pakke Europe Ale
366,D1gpj5u86iQ,2022-12-05T19:49:42Z,#usa #donkey #india #haryana 🤟🤟,https://www.youtube.com/watch?v=D1gpj5u86iQ,,UC7hzf88ctnjEnd9lRe3cVew,assharma3561
367,4fYPGCIBib8,2022-08-14T08:54:32Z,USA 🇺🇲DONKEY PUNAMA JUNGLE TO TAPACHULA MEXICO @rahul___sheokand #youtube #viralvideos #india #usa,https://www.youtube.com/watch?v=4fYPGCIBib8,USA DONKEY MEXICO JUNGLE TO TAPACHULA MEXICO @rahul___sheokand #usadonkey #mexicojungle ...,UCAh98kuxlqrBWJZFJHLIUhg,HR90 aale🔥
368,SZk9wdZNl0Q,2023-01-28T06:06:12Z,#losangeles #indianstudents #india #usa #usavisa #america #ielts #donkey #studyvisa,https://www.youtube.com/watch?v=SZk9wdZNl0Q,,UClB3QQzXUeClmyfsIt3wgxg,garvikduhan_USA
369,m0rUXyfNfhw,2021-08-01T14:17:07Z,India to Europe Germany 🇩🇪 |1st time most rare video |usa donkey|germanydonkey|italy|serbia|#short,https://www.youtube.com/watch?v=m0rUXyfNfhw,,UCvBuYwteJ-b-u18caEBUmUg,DEV SHARMA
370,BRrrOHwQoAQ,2023-01-21T05:25:19Z,Usa donkey 🇺🇲| India to Usa donkey | ਅਮਰੀਕਾ 🇺🇲 #shorts,https://www.youtube.com/watch?v=BRrrOHwQoAQ,(Part 7) Mexico To America Border Crossing | Usa Donkey 2022 | #shorts #usaborder #panamajungle #americadonkey ...,UCJ2YrlSSzLlLPpHLvlM4dUg,Donkey Update 2.0
371,71MTjbTb66A,2022-10-08T10:49:06Z,mexico border crossing to usa...|| usa donkey 2022 || usa donkey border crossing ||,https://www.youtube.com/watch?v=71MTjbTb66A,donkey americaa || donkey 2022 ||Usa donkey america ||donkey ||mexico border crossing to usa punjabiIndia to USA donkey ...,UCu44xaLCz6wnRT3gendMcUw,vinu lifestyle
372,6HJmbNJathk,2022-11-24T07:16:31Z,अमेरिका में क़ेसे कपड़े wash करते ह।/ #Londri#america #usa #donkey#india #bgmi #blackfridaywalmart,https://www.youtube.com/watch?v=6HJmbNJathk,america #usa #donkey #america #india # #blackfridaywalmart # #bgmi #USA donkey #america donkey #bts #comedy #cute ...,UCFXf57dvcJEK6-BCv3-HWaA,Rinku Pandit
373,Ojwu1d3YUDo,2022-12-26T01:28:53Z,USA DONKEY I INDIA TO USA I ਦੋਂਕੀ ਤੋਂ ਪਹਿਲਾ ਤੇ ਬਾਅਦ ਕ ਹੁੰਦਾ ਏ  #shorts,https://www.youtube.com/watch?v=Ojwu1d3YUDo,shorts #usadonkey #usa #usadonkey2022 #freevisaadvisor USA DONKEY I INDIA TO USA I ਦੋਂਕੀ ਤੋਂ ਪਹਿਲਾ ਤੇ ...,UC4mifYMs39uMhHSBeP64dCg,Free Visa Advisor
374,rNQKD7v5kmg,2022-10-09T01:30:16Z,India🇮🇳 To USA 🇺🇲 | Journey Started 🛫| Donkey Route 2022 🤓| 2 नंबरी ✌️| Ankush Malik Vlogs,https://www.youtube.com/watch?v=rNQKD7v5kmg,usa #2numabri #donkey #indiatousa #america #india #indian #abroad #US.,UC1X4PBVhNsyavmtdy2XOZFA,Ankush Malik Vlogs
375,ou3mNiJEkYw,2022-07-25T16:07:22Z,#usa #donkey #india #like,https://www.youtube.com/watch?v=ou3mNiJEkYw,,UCX-75suykFwpix_B94wRiJQ,Bhagwangarh sahil
376,mQHoXCvio3A,2022-12-26T12:57:38Z,America Donkey Update | Usa donkey update | Maxico to usa donkey | Donkey update,https://www.youtube.com/watch?v=mQHoXCvio3A,MAXICO TO USA BORDER DONKEY UPDATE | ARIZONA BORDER | TEXAS BORDER | NEW DONKEY VIDEO USA - MAXICO ...,UCzUuSLnlDg59Zs0Qi2h_QlA,TRUE INDIAN RD
377,SpOo78O0WsQ,2022-10-12T08:05:06Z,usa donkey#donkey shorts usa#usa donkey india us donkey mexico,https://www.youtube.com/watch?v=SpOo78O0WsQ,Pl subscribe our chennal for more information Jassi Backpacker Vlogs Gmail.jasvindersingh46664@gmail.com Pl follow ...,UCdO_wi4TJhvMynJcUOw6UBQ,Jassi backpacker vlogs
378,qg4ApKxjChA,2019-09-24T12:55:16Z,Usa donkey! usa border choosing kar raha india punjabi!,https://www.youtube.com/watch?v=qg4ApKxjChA,Punjabi ਪੈਸੇ ਕਮਾਉਣ ਲਈ ਜਾਨ ਗਵਾ ਰਹੇ ਨੇ! #Usadonkey Indian punjabi #choosingBorder indian man #Punjabi ...,UCNQgGyX-HATBEkuYfYzJ1Nw,Magic Paheliyan
379,BECS9JkSya4,2022-11-30T01:31:58Z,USA DONKEY I INDIA TO USA I #shorts,https://www.youtube.com/watch?v=BECS9JkSya4,shorts #usadonkey #freevisaadvisor #indiatousa USA Donkey I India to USA I #shorts Free Visa Advisor don't promote illegals ...,UC4mifYMs39uMhHSBeP64dCg,Free Visa Advisor
380,3xDyHIdhr8I,2022-12-26T01:30:03Z,India 🇮🇳 To USA 🇺🇸 | Part -03 | Donkey Started 😈| Donkey 2022 | 2 Numbari ✌🏻| America 🇺🇸,https://www.youtube.com/watch?v=3xDyHIdhr8I,Jai Mata Di America #usa     #usa #america #trending #reels #reelitfeelit #trend #explore #explorepage #usa     ...,UC1X4PBVhNsyavmtdy2XOZFA,Ankush Malik Vlogs
381,hx5SqM0rHaE,2022-10-18T06:30:18Z,USA Donkey I india to usa donkey I,https://www.youtube.com/watch?v=hx5SqM0rHaE,usa #usadonkey #usadonkey2022 #freevisaadvisor USA Donkey I india to usa donkey I Free Visa Advisor don't promote illegals ...,UC4mifYMs39uMhHSBeP64dCg,Free Visa Advisor
382,H2k6z0e9smE,2023-02-05T03:00:07Z,Panama 🇵🇦 Jungle Part 01 | पनामा जंगल में क्या है??। Full Details | पहली पहाड़ी 🤯| USA 🇺🇸Donkey,https://www.youtube.com/watch?v=H2k6z0e9smE,,UC1X4PBVhNsyavmtdy2XOZFA,Ankush Malik Vlogs
383,oVChQMoRXRc,2022-06-05T03:33:57Z,India to America Donkey | Mexico Donkey | America Donkey status video | #2numbri #americadonkey,https://www.youtube.com/watch?v=oVChQMoRXRc,,UC2fME6t1CfzM3ov4rTMbLIQ,Canadian Punjabi
384,iVLt8365UEA,2022-11-10T07:38:25Z,America की donkey 🤣😂 #shorts #viral #short #youtubeshorts,https://www.youtube.com/watch?v=iVLt8365UEA,"America की donkey #shorts #viral #short #youtubeshorts australia, singapore, switzerland, germany, instagram se paise ...",UCyyv0HxMVYsucE04er_Vwlg,Vikas Malik Vlogs
385,ElI2-b8X5_k,2023-01-05T08:22:37Z,India 🇮🇳 to USA 🇺🇸 donkey |donkey 2023 #india #usa #donkey,https://www.youtube.com/watch?v=ElI2-b8X5_k,India to USA donkey |donkey 2023 #india #usa #donkey.,UCKfrjWrrDxtd7gmVbmnheTw,Amit Kalyan volgs
386,rpALm0gCnV0,2022-09-15T15:30:10Z,USA Donkey Route I USA donkey 2022 I india to  usa donkey I,https://www.youtube.com/watch?v=rpALm0gCnV0,usa #usadonkey #freevisaadvisor USA Donkey Route I USA donkey 2022 I india to usa donkey I My other Youtube Channel for ...,UC4mifYMs39uMhHSBeP64dCg,Free Visa Advisor
387,TF1PBk-KApo,2022-01-26T06:00:10Z,कनाडा यूएसए बॉर्डर क्रॉसिंग Illegally Go to canada to USA,https://www.youtube.com/watch?v=TF1PBk-KApo,Going to canada or USA illegally is very dangerous. Please don't trust dishonest agent here is the reality what happen 4 Indians ...,UC0MMe35tbS8BDJdEbGILBpA,India Wild Films
388,mqt1_-gTj_4,2022-10-29T06:31:24Z,Maxico Border Crossing To Usa | Usa Donkey 2022 #usadonkey @ashuror22,https://www.youtube.com/watch?v=mqt1_-gTj_4,Maxico Border Crossing To Usa | Usa Donkey 2022 @ashuror22 #maxico #usadonkey #maxicodonkey #maxicobordercrossing ...,UCzUuSLnlDg59Zs0Qi2h_QlA,TRUE INDIAN RD
389,qKTrIilH4wY,2021-01-24T21:39:00Z,"india to Usa ||Story of Refugees In USA , UK , Germany ||",https://www.youtube.com/watch?v=qKTrIilH4wY,"Its Hard to Explain Everything but i hope you will understand well |india to usa donkey route, india to usa donkey map, india to ...",UCnnWrCeFLHkGg82b3ezio9g,Harsh Germany
390,vkWI7Q1s5Ec,2022-09-28T17:45:00Z,usa donkey I india to usa I donkey by truck I #shorts,https://www.youtube.com/watch?v=vkWI7Q1s5Ec,shorts #freevisaadvisor #usdonki #usdonkey #usvisa usa donkey I india to usa I donkey by truck I My other Youtube Channel for ...,UC4mifYMs39uMhHSBeP64dCg,Free Visa Advisor
391,cAo_-efHHek,2022-08-07T05:22:49Z,Usa🇺🇸 donkey wale California#reels# border crossing time# mexico#india to usa donkey#pakke Usa wale#,https://www.youtube.com/watch?v=cAo_-efHHek,,UCKxtKddBhN0JUbYptQBUtpA,Usa Donkey Wale CALIFORNIA
392,S2qokTr_QiE,2023-01-20T00:06:34Z,#haryana #donkey #usa #2numabri #2numberi #america #haryanaale #india #panama #usalifestyle,https://www.youtube.com/watch?v=S2qokTr_QiE,Insta =rishideswal Insta=Honeymaan05 #donkey #haryana #usa #2numabri #2numabri #america #haryanaale #panama ...,UCbxP5ppeghypksQtdbMSzog,Deswal & Maan
393,dEBBpFtQPyM,2022-10-11T03:16:37Z,Mexico to Usa Donkey Border Crossing 🇺🇲 Funny Video 😂 #shorts,https://www.youtube.com/watch?v=dEBBpFtQPyM,Mexico to Usa Donkey Border Crossing Funny Video #shorts #shorts #usadonkey #indiatocanada #indiatousa ...,UCJ2YrlSSzLlLPpHLvlM4dUg,Donkey Update 2.0
394,0PTWcovnhpQ,2022-10-15T11:21:40Z,India In To USA Donkey Full Details | USA Donkey  | इंडिया से अमेरिका तक का सफ़र  | India To USA,https://www.youtube.com/watch?v=0PTWcovnhpQ,usadonkey #usadonkeyfulldetails #yourimmigrationchannel #donkytube #usadonkyindia #donkey2022 इंडिया से ...,UCp9cJSP1E9QGI24QKQFkRcw,Your Immigration Channel
395,kFcrZWoQUlQ,2022-12-20T01:30:22Z,India 🇮🇳 To USA 🇺🇸 | दिल्ली से सफ़र शुरू ✌🏻।First Flight ✈️ | Part- 01 | Ankush Malik Vlogs,https://www.youtube.com/watch?v=kFcrZWoQUlQ,,UC1X4PBVhNsyavmtdy2XOZFA,Ankush Malik Vlogs
396,uYuXOtK9l2k,2022-07-10T07:27:57Z,🇮🇳 ते 🇺🇸 Donkey.. Journey India(🇮🇳) to America(🇺🇸) 2no.  America view comp. India to America,https://www.youtube.com/watch?v=uYuXOtK9l2k,india #America #americawala #usa #jind #usawale #america.,UCqKx8gvu7hw2c1RV5mWmZww,HR Ritoliya
397,bjvkVc8gEjQ,2022-11-08T14:56:13Z,"#subscribe #100k  #indiatocanada.#donkey #canada #usa new status भाई भाई का प्यार,🇨🇦🇺🇲😘",https://www.youtube.com/watch?v=bjvkVc8gEjQ,america wala song munda pind vich vaje america wala full song munda pind vich vaje america munda pind vich vaje america ...,UCX07omthghq5pM4ZEGqMJvg,India to canada
398,AEm7k-99Blo,2023-01-31T09:23:53Z,donkey India to USA 🔥🔥🙏🙏 #2numabri #donkey #usa,https://www.youtube.com/watch?v=AEm7k-99Blo,,UC2h9f177ldBJQdqG1vjC3UA,2 numbari wale
399,xfY1knJ08aA,2022-12-24T02:37:15Z,India 🇮🇳 to USA 🇺🇸 || America Donkey || AT Kyrgyzstan 🇰🇬- 30 °C temperature || #usa donkey,https://www.youtube.com/watch?v=xfY1knJ08aA,,UC_jmCHS4CfP-cUU7KfoQISA,Amit Sharma
400,ElG7bkA3RRg,2022-10-26T15:20:01Z,"India to USA donkey 2022 , Live India boys and girls enter to Mexico border || #shorts #ytshorts",https://www.youtube.com/watch?v=ElG7bkA3RRg,"India to USA donkey 2022 , Live India boys and girls enter to Mexico border || #shorts #ytshorts.",UCu44xaLCz6wnRT3gendMcUw,vinu lifestyle
401,t2bgW3Yic6w,2019-06-18T03:26:48Z,Donkey India to USA with flight in june,https://www.youtube.com/watch?v=t2bgW3Yic6w,This video are copyrighted....,UCP57seAsZQVhveLuq3Xvh9w,Vicky multani
402,nitDmGGXPhE,2022-10-17T06:30:09Z,USA Donkey I India to USA I #shorts,https://www.youtube.com/watch?v=nitDmGGXPhE,shorts #usa #freevisaadvisor USA Donkey I India tao USA I #shorts My other Youtube Channel for : Shorts Free Visa Videos ...,UC4mifYMs39uMhHSBeP64dCg,Free Visa Advisor
403,ij2GWxe39kc,2022-11-06T01:30:11Z,USA Donkey I India to USA I #yt20 #yt20shorts #shorts,https://www.youtube.com/watch?v=ij2GWxe39kc,shorts #yt20 #usadonkey #usadonkey #usadonkey2022 USA Donkey I India to USA I $yt20 #yt20shorts #shorts Free Visa Advisor ...,UC4mifYMs39uMhHSBeP64dCg,Free Visa Advisor
404,yzACNo-bsZI,2020-08-21T04:45:01Z,new video US Mexico border donkey  || USA KI DONKEY.,https://www.youtube.com/watch?v=yzACNo-bsZI,new video US Mexico border donkey USA KI DONKEY. TEACH VISA PUNJABI === https://bit.ly/3aM6jAp ...,UCYyk3C5bP0IVvukAnGibl7w,TEACH VISA
405,oMTMx2TgE6I,2022-10-15T06:30:23Z,USA DONKEY 🇺🇲 VIDEO || AMERICA DONKEY 🇺🇲 VIDEO || Masti Time Turki Airport #usa #shorts #viral #2022,https://www.youtube.com/watch?v=oMTMx2TgE6I,USA DONKEY VIDEO || AMERICA DONKEY VIDEO || Masti Time Turki Airport #usa #shorts #viral #2022 2 Numabri ...,UCtLr-VlUjuxh4zUQA6pu_zg,2 Numbari USA Wala
406,QejIBopPFfo,2023-02-05T02:50:27Z,#2numabri #2numabri #india #donkey #usa #america #usadonkey #usaborder #mexico #panama #donkey 🇺🇸,https://www.youtube.com/watch?v=QejIBopPFfo,Insta= honeymaan05 Insta=rishideswal USA में काम क्यों नहीं मिल रहा कैसे मिलेगा ...,UCbxP5ppeghypksQtdbMSzog,Deswal & Maan
