,videoId,publishedDate,title,videoUrl,description,channelId,channelTitle
407,_jDNyKH5rv8,2022-12-06T08:19:49Z,India to America 🇺🇲 Donkey में Punjabi लड़कों की पिटाई करते हैं 🙏 #usadonkey #indiatousa,https://www.youtube.com/watch?v=_jDNyKH5rv8,India to America Donkey ਵਿੱਚ Punjabi ਮੁੰਡੇਆ ਦੀ ਕੁੱਟ ਮਾਰ ਕਰੀ #usadonkey #indiatousa ...,UCJ2YrlSSzLlLPpHLvlM4dUg,Donkey Update 2.0
408,AXn4vhmja_Y,2023-01-10T12:20:18Z,hungry se Italy ka border India se USA ki donki #usa #donkey #europe #work,https://www.youtube.com/watch?v=AXn4vhmja_Y,,UCWPpho9-QlMvMlu2G24PVNA,Punjab Euero TV 2
409,#NAME?,2023-02-01T09:05:20Z,Nakoli Se Kapoorgana Sumunder Ke Rasste se India 🇮🇳 to usa 🇺🇲 donkey,https://www.youtube.com/watch?v=-btQOmnHUm4,,UCSpetEnE8uaDZ1RKsViSGHg,USA DONKEY 🇺🇸
410,3uETwutQGEI,2022-09-30T14:26:46Z,Europe donkey |europe border crossing|pendu Jatt #donkey #europe #shorts,https://www.youtube.com/watch?v=3uETwutQGEI,Europe donkey |europe border crossing |pendu Jatt #donkey #europe #shorts Europe donkey #usa donkey #uk donkey Australia ...,UC4VGQZ7InyxCUBWgoltQbqg,Pendu Jatt ( ਪੇਂਡੂ ਜੱਟ )
411,6QOgo10Fuc4,2023-01-01T13:24:34Z,🇮🇳 india to USA 🇺🇸 donkey kon kon s raste s jaye jate h complete video #donkey #usa #@ashuror22,https://www.youtube.com/watch?v=6QOgo10Fuc4,How to Get subscriber on YouTube fast | How to Get 1000 subscriber on YouTube.,UCnHSERyeGFQnPlOsRX3XjXQ,USA 🇺🇸 alaa Amitmalik6700
412,6CvbldCsGyI,2023-01-20T12:43:32Z,India 🇮🇳 to America 🇺🇲 [latest video 2023] #donkey #2numbri #youtube #shorts #video #viral #usa🇺🇲🎯⛳️,https://www.youtube.com/watch?v=6CvbldCsGyI,[Finally usa      ⛳️],UCVt0-0UpF2Cgd8BPawWebBw,usa_2numbri_wale56 
413,sAXSqXDKn34,2022-10-10T07:02:47Z,Panama to Usa Donkey 🇺🇲(Part 2) America Donkey 2022 #shorts,https://www.youtube.com/watch?v=sAXSqXDKn34,,UCJ2YrlSSzLlLPpHLvlM4dUg,Donkey Update 2.0
414,S5l992LdpCs,2022-07-27T15:16:37Z,ਆਪਣੇ ਵੀਰ ਅਮਰੀਕਾ ਵਾਲੇ#usa donkey wale#india to usa donkey lover# Usa 🇺🇲 Donkey Wale California 🌎🧳#USA,https://www.youtube.com/watch?v=S5l992LdpCs,,UCKxtKddBhN0JUbYptQBUtpA,Usa Donkey Wale CALIFORNIA
415,y7gJHigj2VI,2022-12-12T01:31:39Z,USA Donkey I India to USA I #shorts,https://www.youtube.com/watch?v=y7gJHigj2VI,shorts #usadonkey #usadonkey2022 #freevisaadvisor USA Donkey I India to USA I #shorts Free Visa Advisor don't promote ...,UC4mifYMs39uMhHSBeP64dCg,Free Visa Advisor
416,8yVv6XYtUTE,2023-02-05T07:33:22Z,कयो होती है मोत 😱😰USA 🇺🇸 Donkey मै जानने के लिये देखें ye video #2numabri #india #donkey,https://www.youtube.com/watch?v=8yVv6XYtUTE,Insta= honeymaan05 Insta=rishideswal USA में काम क्यों नहीं मिल रहा कैसे मिलेगा ...,UCbxP5ppeghypksQtdbMSzog,Deswal & Maan
417,pFWM1BXBy1I,2018-09-12T19:32:31Z,Punjab to America Donkey Laun Wale | #usadonkey. USA final wall jump. #direct Mexico - Hindi Live,https://www.youtube.com/watch?v=pFWM1BXBy1I,"India to USA by #donkey, bhaiyo agar aap america bina valid visa ke jana chahte hoto 1 bar yah video pura dekh lena kyuki ...",UC7lqrExfcwxv53bpa5c4ZKw,Technical JBR
418,6IEE8TsZ5s4,2022-05-22T17:27:13Z,usa donkey 2022 panama jungle india boys 🇺🇸🇮🇳,https://www.youtube.com/watch?v=6IEE8TsZ5s4,,UC_VSIyPfBJgOKcgryJqx2Yw,usa_donkey_wale37
419,WxA_-kjYJVE,2022-12-14T14:14:22Z,USA DONKEY 🇨🇦🇦🇺 || FROM INDIA TO ABROAD || #trending #USA #donkey,https://www.youtube.com/watch?v=WxA_-kjYJVE,,UCSOBfzwqnEk3qUHNgXVi5Dg,From India To Abroad 
420,Ab11QMFo99E,2022-12-09T17:12:37Z,india to usa  panama jungle live vedio #panama #usa #viral #donkey #shortvideo #shortvideo #mexico,https://www.youtube.com/watch?v=Ab11QMFo99E,,UC_-EMPy98yDmd_mFOys1WPQ,usa donkey vlog's
421,K6gVlTy_5Vs,2022-02-18T14:08:04Z,usa donkey part-2 जंगल पार करने के बाद कैसे दीवार कूद कर गए तो आगे क्या हुआ,https://www.youtube.com/watch?v=K6gVlTy_5Vs,donkey #kusum_goyat #haryana #haryana_news #kusam_goyat #haryanvi #viral_video #america kusum goyat new video kusum ...,UCEe65LyUrYC2hn80G85wUXg,Kusum Goyat
422,V0ueOAnvne4,2022-08-21T10:58:43Z,Today&#39;s Texas Border Crossing Live | Donkey America Mexico Border | Mexico To USA Donkey | Awinash,https://www.youtube.com/watch?v=V0ueOAnvne4,Today's Texas Border Crossing Live | Donkey America Mexico Border | Mexico To USA Donkey | Awinash Kumar Vlogs ...,UCkD0qeQexxb9BJSXiWUQVaQ,Awinash Neutral
423,5fX2KgMn9Vg,2022-08-10T10:52:09Z,Usa donkey border crossing | USA Depot kon kon  si county ko kr rhe hai new update,https://www.youtube.com/watch?v=5fX2KgMn9Vg,"Usa donkey border crossing | USA Depot kon kon si county ko kr rhe hai new update Donkey USA , Australia ,Canada for ...",UCkm3kbKLzuuP3nvkkuelmxQ,Usa donkey
424,mVb597qO5ks,2022-08-05T14:27:03Z,Usa Donkey 🇺🇸 Panama Jungle to America Journey Real Story | Circle Punjabi,https://www.youtube.com/watch?v=mVb597qO5ks,Usa Donkey Panama Jungle to America Journey | Real Story | Circle Punjabi Panama Jungle to America Journey Real Story ...,UC-R_DQUHnEOd0JNhZkzpzZQ,Circle Punjabi
425,SwbN4nxMsIk,2022-02-05T06:30:27Z,#usa #cali #maxico #panama #donkey #peg #usa #india #HARYANVIINABROAD #Haryanvi #punjabi #Abroad,https://www.youtube.com/watch?v=SwbN4nxMsIk,,UCVpIYZp4aMYw8GWbLFe2s4A,KURLAN Sports Live
426,x3yVIaJuRcI,2022-10-26T04:30:10Z,USA Donkey I india to usa donkey I #shorts,https://www.youtube.com/watch?v=x3yVIaJuRcI,shorts #usadonkey #usadonkey2022 #viral #shortsvideo #freevisaadvisor USA Donkey I india to usa donkey I #shorts Free Visa ...,UC4mifYMs39uMhHSBeP64dCg,Free Visa Advisor
427,DpAV7amv048,2022-08-02T18:04:51Z,usa donkey new video 2022 🇺🇲 | Mexico border crossing | Indian boys in donkey | 2022 #donkey,https://www.youtube.com/watch?v=DpAV7amv048,Usa donkey video mexico border crossing 2022 boys #usadonkey #donkey #america #indianinamerica #usadonkeyvideo ...,UCypuIdlqQELMH_vKb5FMcbQ,Indian American
428,qoZSg-DErE0,2023-01-01T01:30:16Z,India 🇮🇳 To USA 🇺🇸 | Part- 05 | बस में पुलिस आ गई 😰। Ship 🛳️ Mein Bus 🚌 ko Chda diya🫡।USA,https://www.youtube.com/watch?v=qoZSg-DErE0,Jai Mata Di America #usa     #usa #america #trending #reels #reelitfeelit #trend #explore #explorepage #usa     ...,UC1X4PBVhNsyavmtdy2XOZFA,Ankush Malik Vlogs
429,YsFl-aK6y6w,2022-10-02T04:30:12Z,Donkey America I India to USA I USA Donkey 2022 I  ਜ਼ਿੰਦਗੀ ਨਾਲ ਏਦਾਂ ਖਿਲਵਾੜ ਕਯੋਂ ?,https://www.youtube.com/watch?v=YsFl-aK6y6w,usadonkey #usadonkey #usadonkey2022 #freevisaadvisor Donkey America I India to USA I USA Donkey 2022 I ਜ਼ਿੰਦਗੀ ...,UC4mifYMs39uMhHSBeP64dCg,Free Visa Advisor
430,WfxSFRrtt-4,2022-07-29T13:33:46Z,USA donkey 2022 | Mexico border crossing • indian boys | USA donkey 2022,https://www.youtube.com/watch?v=WfxSFRrtt-4,usa #usadonkey #america Usa donkey video mexico border crossing 2022 boys #usadonkey #donkey #america ...,UCypuIdlqQELMH_vKb5FMcbQ,Indian American
431,0XfVsJvWnWM,2022-12-27T05:16:46Z,Maxico to usa Donkey Latest Update | Maxico Border से भी भगाने लगे,https://www.youtube.com/watch?v=0XfVsJvWnWM,Maxico to usa Donkey Latest Update | Maxico Border से भी भगाने लगे MAXICO TO USA BORDER DONKEY UPDATE ...,UCzUuSLnlDg59Zs0Qi2h_QlA,TRUE INDIAN RD
432,ooi8XonMsMk,2023-01-27T15:05:14Z,INDIA 🇮🇳 TO USA 🇺🇸 DONKEY | कितना खर्चा आता है  | Agent Kaha Se ? | US Donkey Full Details,https://www.youtube.com/watch?v=ooi8XonMsMk,usadonkey americadonkey #usadonkey #usadiwarkudnekebad #usadonkey2023 INDIA TO USA DONKEY | America ...,UCp9cJSP1E9QGI24QKQFkRcw,Your Immigration Channel
433,cL75CTeftro,2022-12-18T04:51:57Z,Usa camp jail me kya kya hota h😣||USA me entry k baad kya hota h#usaborder #usacamp #border #donkey,https://www.youtube.com/watch?v=cL75CTeftro,In this video about 2 number america mexico border crossing experience . USA police station & Camp Related My experience ...,UCxe-tfucj4BB_4MxnoHd4Vw,2 number wale
434,tl41dxWioqg,2022-06-29T11:22:55Z,USA Real Sad story of USA Donkey | USA DONKEY TRUTH | MEXICO TO USA,https://www.youtube.com/watch?v=tl41dxWioqg,"ਅਮਰੀਕਾ Donkey ਦਾ ਅਸਲ ਸੱਚ ਕੀ ਹੈ America ਪਹੁੰਚੇ 46 ਲੋਕਾਂ ਦੀ ਮੌਤ, ਟਰੱਕ ਅੰਦਰੋਂ ...",UCRE9zegAYAOchRkZqfS-djg,Paramount e Services
435,ZHz43q8ACH4,2022-10-26T01:30:07Z,USA Donkey I india to usa donkey I #shorts,https://www.youtube.com/watch?v=ZHz43q8ACH4,shorts #usadonkey #usadonkey2022 #usa #freevisaadvisor USA Donkey I india to usa donkey I #shorts Free Visa Advisor don't ...,UC4mifYMs39uMhHSBeP64dCg,Free Visa Advisor
436,YPC9iEonxA8,2021-07-07T10:35:06Z,DONKEY TO AMERICA | A FILM BY VIKRANT MANN |AVTAR DEEPAK |SANJAY SHARMA &amp; RAM CHOPRA PRESENTS,https://www.youtube.com/watch?v=YPC9iEonxA8,Sanjay Sharma and Ram Chopra Presents Title song 'Donkey To Amrika' from Movie based on true story named as 'Amrika My ...,UCQGeL6ZjFkwkaQBNbD2YFCQ,Yaronkar
437,vWuO-5zTgmk,2022-07-29T11:11:05Z,USA Donkey 2022🇺🇸|new update|India to Usa|#donkey #usa |panama camp 3,https://www.youtube.com/watch?v=vWuO-5zTgmk,USA Donkey 2022 | new update | India to Usa |#usa #donkey | Panama camp 3 plz subscribe my channel ...,UCGX2FGGulDSJHaEMa0uNOfg,Nishu Deswal Hr31
438,AreGQm3cXcU,2022-09-07T03:03:12Z,USA donkey | India to usa donkey | #shorts #2022 #viral #viralshorts #like 🙏🇺🇸🇮🇳,https://www.youtube.com/watch?v=AreGQm3cXcU,"USA donkey | India to usa donkey | #shorts #2022 #viral #viralshorts #like Please like, share and subscribe my ...",UCYY8iT5dhTG-ZX_lg1WeL_w,USA ala
439,vTnfMvk-XXE,2022-11-08T14:58:10Z,Live Usa donkey Border Crossing Mexico to America India to America donkey 2022 Many People Cross...,https://www.youtube.com/watch?v=vTnfMvk-XXE,Live Usa donkey Border Crossing Mexico to America India to America donkey 2022 Many People Cross... #usadonkey ...,UCsBQzotAtrLc7ca6ohLYaQw,Passion Mafia
440,bZaR9pn0oBQ,2021-06-20T07:16:43Z,Donkey india to usa indian part 2 ਬੰਦੇ ਦੀ ਹਾਲਤ ਦੂਜੇ😂 ਦੇਸ਼ ਚ Donkey maxico to usa 😁y aa koi chakkr ਨੀ,https://www.youtube.com/watch?v=bZaR9pn0oBQ,india#usa#donkey#border#crossing#Punjabi#funny.,UClqV3vx82_HYiBjPbqtUlIw,Life Luck game
441,VVzDDoZEK6o,2022-12-22T01:30:18Z,USA Donkey India to USA I ਅਮਰੀਕਾ ਬਾਰਡਰ ਤੇ ਕਿ ਹਾਲ ਹੈ  #shorts,https://www.youtube.com/watch?v=VVzDDoZEK6o,shorts #usadonkey #usadonkey2022 #usa #freevisaadvisor USA Donkey India to USA I ਅਮਰੀਕਾ ਬਾਰਡਰ ਤੇ ਕਿ ...,UC4mifYMs39uMhHSBeP64dCg,Free Visa Advisor
442,8LHmwX9Pq9I,2022-05-10T00:26:14Z,usa donkey 😔😔 //dream usa //indian boys,https://www.youtube.com/watch?v=8LHmwX9Pq9I,,UC8sMmsqMJN3BLB-AlI4hSlw,ER. YAGYA PANCHAL
443,2JtMr8TTG5g,2022-05-12T06:15:01Z,LATEST USA DONKEY UPDATE | US ki #donkey Information Punjabi | ਅਮਰੀਕਾ ਕੀ ਡੌਕੀ || INDIAN se US 2022 .,https://www.youtube.com/watch?v=2JtMr8TTG5g,LATEST USA DONKEY UPDATE || US ki #donkey information punjabi2022 || INDIAN se US 2022. ਅਮਰੀਕਾ ਕੀ ਡੌਕੀ.,UCEFJ74BQdQ7kGHXX2D8nfRA,Teach visa Punjabi
444,P7ZcPEdxTyI,2022-08-03T08:17:58Z,जंगल के रास्ते 14 बार विदेश जाने की कौशिश करने वाले लड़के की आप बीती सुनकर आंखों में आसूं आ जाएंगे,https://www.youtube.com/watch?v=P7ZcPEdxTyI,जंगल के रास्ते 14 बार विदेश जाने की कौशिश करने वाले लड़के की आप बीती ...,UC-pw4kZhpHvpvK2O2XJfFoA,खास हरियाणा Khas Haryana
445,tjBdtgHTgPg,2022-07-29T13:31:51Z,USA Donkey video 2022 | Danger situations in america donkey 🇺🇲 | india to america donkey video,https://www.youtube.com/watch?v=tjBdtgHTgPg,Usa donkey video mexico border crossing 2022 boys #usadonkey #donkey #america #indianinamerica #usadonkeyvideo ...,UCypuIdlqQELMH_vKb5FMcbQ,Indian American
446,_xE-Dg28feU,2022-06-07T02:59:33Z,donkey America,https://www.youtube.com/watch?v=_xE-Dg28feU,,UCBrfoGKn3_b5FkbeBWIm2aA,A-M karnal Ala America 🇱🇷
447,MyRFQpEoE-s,2023-01-04T01:30:06Z,India 🇮🇳 To USA 🇺🇸 | Part - 06 | Brazil 🇧🇷 से Bolivia 🇧🇴 के लिए चल पड़े 😈| USA Donkey 2022,https://www.youtube.com/watch?v=MyRFQpEoE-s,Jai Mata Di America #usa     #usa #america #trending #reels #reelitfeelit #trend #explore #explorepage #usa     ...,UC1X4PBVhNsyavmtdy2XOZFA,Ankush Malik Vlogs
448,pVVm19MXPtE,2018-08-22T13:15:31Z,Donkey india to usa new song,https://www.youtube.com/watch?v=pVVm19MXPtE,This video are copyright act....,UCP57seAsZQVhveLuq3Xvh9w,Vicky multani
449,gmsz_CTXwi4,2023-02-02T13:00:24Z,Today Mexico To Usa Border Crossing 🇺🇲 | America Donkey | Usa Donkey Border Crossing,https://www.youtube.com/watch?v=gmsz_CTXwi4,Mexico To Usa Border Crossing | Usa Donkey 2023 | Usa Donkey Border Crossing | America Donkey #usaborder ...,UCJ2YrlSSzLlLPpHLvlM4dUg,Donkey Update 2.0
450,GfvH4229rwA,2022-02-15T09:39:36Z,#farming #farmer #trending #Usa #donkey #haryanvi #haryana #punjab #india #chandigarh #canada #usa,https://www.youtube.com/watch?v=GfvH4229rwA,,UCVpIYZp4aMYw8GWbLFe2s4A,KURLAN Sports Live
451,InAZp29U5so,2022-07-25T10:59:05Z,ਪਨਾਮਾ ਜੰਗਲ #Panama jungle# 🇺🇲Usa donkey # india to usa donkey# Usa🇺🇲 Donkey Wale 🇺🇲CALIFORNIA#,https://www.youtube.com/watch?v=InAZp29U5so,,UCKxtKddBhN0JUbYptQBUtpA,Usa Donkey Wale CALIFORNIA
452,t8w36Jb6Ass,2022-06-08T08:28:48Z,Usa donkey HARYANVI.      #usa #donkey #usadonkey #internationalstudents #haryanvi #choudhary #india,https://www.youtube.com/watch?v=t8w36Jb6Ass,,UCrKfq2DGFUAVee9UGstfTmw,love ror
453,AP6OyY_yon0,2022-08-15T08:51:57Z,Pakistan🇵🇰 or India🇮🇳 Sy America🇺🇸 Danki Haqeeqt | Mexico To America Donkey | AdeelJameelGlobal,https://www.youtube.com/watch?v=AP6OyY_yon0,Hi Dosto Ic Video Mai apko dekhaya Hai Kesy America Danki Lagai ja rhi hai Log Illegal jany k liye Kya kuch kr rhy Hain. Pakistan ...,UCJ1cVJGjqdMr3sLCj43pBrg,Adeel JaMeel Global
454,Iis7LvHS4IE,2022-10-30T07:13:13Z,America ki donkey || USA ki donkey || us Mexico border || Brazil deport Pakistani Indian,https://www.youtube.com/watch?v=Iis7LvHS4IE,America ki donkey || USA ki donkey || us Mexico border || Brazil deport Pakistani Indian Hassan lifetv == https://bit.ly/36i6Tpy ...,UCEFJ74BQdQ7kGHXX2D8nfRA,Teach visa Punjabi
456,_S6Tm1wIZ6s,2022-08-30T15:40:13Z,USA donkey 🇺🇸by ship 🛳 ||America donkey || #usa #donkey #shorts,https://www.youtube.com/watch?v=_S6Tm1wIZ6s,USA donkey by ship ||America donkey || #usa #donkey #shorts channel link:- ...,UCGX2FGGulDSJHaEMa0uNOfg,Nishu Deswal Hr31
457,myKtn4MkqRg,2022-03-07T02:55:58Z,USA Donkey in panamas prelious jungle #usa #donkey #india #hrd #punjabi #views #viral #shorts,https://www.youtube.com/watch?v=myKtn4MkqRg,,UCJEPGRrGXIVJgGdCcpUBnfA,jaat
458,01wk1Bx3giU,2022-09-24T15:30:20Z,Full Video Of donkey #america,https://www.youtube.com/watch?v=01wk1Bx3giU,america #donkey #usa #us #2022 #2numabri #students #mexico #méxico #mexican #india #punjabi #haryana #gujarat ...,UCjTHIkgghGqhlrGoTHBljbg,Scammer 2.O
460,o2cmPNZRog0,2022-11-05T05:10:26Z,"Usa Donkey New Video 2022 🇺🇲,| America donkey | Usa Border Crossing 2022",https://www.youtube.com/watch?v=o2cmPNZRog0,"Today Usa Border Crossing Punjabi ,| America Donkey | Usa Donkey 2022 #usadonkey #americadonkey #indiatousa ...",UCJ2YrlSSzLlLPpHLvlM4dUg,Donkey Update 2.0
461,4AwY7myJTtI,2022-08-13T19:03:16Z,Usa donkey 2022,https://www.youtube.com/watch?v=4AwY7myJTtI,usa donkey usa donkey 2022 usa ki donkey usa #usaborder #usadonkey usa donkey border crossing passion mafia usa donkey ...,UCypuIdlqQELMH_vKb5FMcbQ,Indian American
462,qKr0lrvuHWk,2023-02-01T03:02:54Z,USA 🇺🇸 DONKEY WITH ASHU ROR,https://www.youtube.com/watch?v=qKr0lrvuHWk,"USA DONKEY WITH ASHU ROR Link :- https://www.instagram.com/ashu_ror_22 Tags, #panamajungle #usadonkey ...",UCKw8osbjurLZYFcwYp7SD5A,ASHU ROR
463,t6Dg_R0KExg,2023-01-11T01:31:13Z,India Airport to America wali meri jaan 🥰 @DonkeyAmericaki #usa #donkey #viral #jaan #bhai #dost,https://www.youtube.com/watch?v=t6Dg_R0KExg,,UCgsSAyzq8dgIJ3FT8DEtGYQ,Donkey America ki
464,uLa4c12S4lw,2022-12-07T01:55:28Z,USA Donkey I India to USA I #shorts,https://www.youtube.com/watch?v=uLa4c12S4lw,shorts #shortsvideo #usadonkey #usadonkey2022 #freevisaadvisor USA Donkey I India to USA I #shorts Free Visa Advisor don't ...,UC4mifYMs39uMhHSBeP64dCg,Free Visa Advisor
465,4l57KHaOpP8,2023-01-03T05:12:52Z,India🇮🇳 to America🇺🇸||Panama jangle🏕️||usa donkey||Part-2 panama ki full video,https://www.youtube.com/watch?v=4l57KHaOpP8,americadonkey #panamadonkey#usadonkey.,UCEaVLTk3MN1kBClMF6K6GBw,R LATHWAL VLOG
468,uzRcf1MTHfU,2017-10-12T16:54:07Z,CBS Reports | Darien Gap: Desperate Journey to America,https://www.youtube.com/watch?v=uzRcf1MTHfU,"A dangerous 60-mile stretch of jungle separates Colombia and Panama. It's known as the Darien Gap, and thousands cross it ...",UC8p1vwvWtl6T73JiExfWs1g,CBS News
469,iOpxJlIgoBA,2022-08-15T08:04:07Z,USA DONKEY 🇺🇸 INDIA TO USA JOURNEY NISHU DESWAL HR31 ||INDIA SE USA JANE MAI KITNA TIME LAGTA HAI,https://www.youtube.com/watch?v=iOpxJlIgoBA,USA DONKEY INDIA TO USA JOURNEY NISHU DESWAL HR31 ||INDIA SE USA JANE MAI KITNA TIME LAGTA HAI ...,UCGX2FGGulDSJHaEMa0uNOfg,Nishu Deswal Hr31
470,hngv4YU45cM,2020-03-15T07:39:20Z,America ki Donkey  in 2021 | Usa ki Donkey Information in Punjabi,https://www.youtube.com/watch?v=hngv4YU45cM,USA (America) ki Donkey |India to Us America Donkey | USA ki Donkey information in Punjabi (USA DONKEY).Pakistan India to ...,UCEFJ74BQdQ7kGHXX2D8nfRA,Teach visa Punjabi
472,6WxGGWdV168,2022-08-26T11:13:14Z,mexico border crossing to usa...|| usa donkey 2022 || usa donkey border crossing || donkey ||,https://www.youtube.com/watch?v=6WxGGWdV168,donkey americaa || donkey 2022 ||Usa donkey america ||donkey ||mexico border crossing to usa punjabiIndia to USA donkey ...,UCu44xaLCz6wnRT3gendMcUw,vinu lifestyle
473,Mra4HsNVSF4,2022-06-28T09:02:54Z,USA Donkey 2022 New Video | Mexico border crossing | Indian boys in donkey |2022 #americadonkeyvideo,https://www.youtube.com/watch?v=Mra4HsNVSF4,Usa donkey video mexico border crossing 2022 #usadonkey #donkey #america #indianinamerica #usadonkeyvideo #america ...,UCypuIdlqQELMH_vKb5FMcbQ,Indian American
474,Z9mROrgUnvM,2022-10-07T01:31:53Z,USA Donkey I india to usa donkey I ਇਹ ਜੰਗਲੇ ਮੌਤ ਦਾ ਜੰਗਲ ਏ,https://www.youtube.com/watch?v=Z9mROrgUnvM,shorts #shortsvideo #usadonkey #usadonkey2022 #freevisaadvisor USA Donkey I india to usa donkey I ਇਹ ਜੰਗਲੇ ਮੌਤ ...,UC4mifYMs39uMhHSBeP64dCg,Free Visa Advisor
475,AsP7Dy0FUYc,2023-01-08T03:25:00Z,Live USA donkey Route New Update Today India to America Entry via Mexico 2023  information Punjabi,https://www.youtube.com/watch?v=AsP7Dy0FUYc,USA donkey Route New Update Today India to America Entry via Mexico 2023 Full information Punjabi #usadonkey2023 ...,UCsBQzotAtrLc7ca6ohLYaQw,Passion Mafia
476,7-WpwHEwwDU,2020-06-22T09:42:47Z,Brazil to USA  (America) ki Donkey | Donkey Flight (hindi) | USA ki Donkey --Brazil ki Donkey.,https://www.youtube.com/watch?v=7-WpwHEwwDU,Brazil to USA (America) ki Donkey . Donkey Flight (punjabi).USA ki Donkey --Brazil ki Donkey big news in 2020..Brazil to USA by ...,UCYyk3C5bP0IVvukAnGibl7w,TEACH VISA
478,NkbHKjNMvFs,2023-01-07T03:15:01Z,Usa donkey 2023 shorts Live in Panama Saboga New Route India to Amrica donkey,https://www.youtube.com/watch?v=NkbHKjNMvFs,Usa donkey 2023 shorts Live in Panama Saboga New Route India to Amrica donkey #usadonkey2023 #passion mafia #live usa ...,UCsBQzotAtrLc7ca6ohLYaQw,Passion Mafia
479,YTPnL2So-SI,2023-01-21T08:40:19Z,USA Donkey I go to India to Usa.              Donkey update||,https://www.youtube.com/watch?v=YTPnL2So-SI,my all friends and family members my uncle and you i will be there by tomorrow by Monday by evening and you i am in your ...,UCleeoAtODOrzwv9TOxSl5gA,Manoj dey
480,G6_hzbbwJJs,2022-08-04T05:40:31Z,USA Donkey New Video 2022 | Mexico border crossing | Indian boys in donkey | 2022,https://www.youtube.com/watch?v=G6_hzbbwJJs,Usa donkey video mexico border crossing 2022 Ror boys #usadonkey #donkey #america #indianinamerica #usadonkeyvideo ...,UCypuIdlqQELMH_vKb5FMcbQ,Indian American
481,s0TVIdtEU3w,2023-02-03T05:42:02Z,Today boys girls 👧 200 plus Mexico to America border crossing 2023 live || usa border || donkey,https://www.youtube.com/watch?v=s0TVIdtEU3w,donkey americaa || donkey 2022 ||Usa donkey america ||donkey ||mexico border crossing to usa punjabiIndia to USA donkey ...,UCc3JmivcpjAGnd1-p-ldtaQ,Technical gill
482,UxJjhR27baw,2023-01-21T07:30:05Z,(Part 3) Today Mexico To Usa Border Crossing 🇺🇲 | America Donkey | Usa Donkey Border Crossing,https://www.youtube.com/watch?v=UxJjhR27baw,Hello Everyone Please My Content Share Other Platform ...,UCJ2YrlSSzLlLPpHLvlM4dUg,Donkey Update 2.0
484,2irzhzxDM_g,2023-01-17T07:51:14Z,#america #donkey #usa #panama #2numabri #donkeyusa #store #indian #jobinusa #donkeyroute #haryanvi,https://www.youtube.com/watch?v=2irzhzxDM_g,,UCxe-tfucj4BB_4MxnoHd4Vw,2 number wale
485,VzfS9jdRk4o,2018-08-09T22:31:41Z,Mexico se usa boder par,https://www.youtube.com/watch?v=VzfS9jdRk4o,,UCO6pIFkW0-S9BzkeokU4zlQ,Indian Immigrants
486,DXmndjtjUoI,2022-11-28T15:13:18Z,Usa donkey checking immigration guatemala #panama #usa #viral #donkey #india #haryana #trending,https://www.youtube.com/watch?v=DXmndjtjUoI,,UC_-EMPy98yDmd_mFOys1WPQ,usa donkey vlog's
487,H6hT59isNt4,2022-12-24T12:47:16Z,2 Numbari USA 🇺🇲 Wala @DonkeyAmericaki #donkey #usa #trendingvideo #2numbari,https://www.youtube.com/watch?v=H6hT59isNt4,donkey america america donkey donkey donkey usa panama jungle donker usa usa donkey haryana donkey process panama ...,UCgsSAyzq8dgIJ3FT8DEtGYQ,Donkey America ki
488,34AzvUjc2ws,2022-01-19T06:44:08Z,Donki क्या होता हैं ? Story of Panama Jungle #panamajungle #americadunki #usamexicoborder #srkmovie,https://www.youtube.com/watch?v=34AzvUjc2ws,यह कहानी है पनामा के जंगलों की। जो जंगल पता नहीं कितने इंसानो को खा ...,UC-8Cd4G3WIpQX5wUCwhEmMQ,Incredible  Hindi
489,MRLzAGZEWk0,2022-07-03T07:31:57Z,🤣Cute donkey marriage 🤣 #viral #india #nepal #usa,https://www.youtube.com/watch?v=MRLzAGZEWk0,,UCxAvvRokgxlOcC58SFmo_vg,LENGTHIEST NAME FOR MY YOUTUBE CHANNEL IN INDIA
490,Mk9OxAy766Q,2023-01-14T05:03:46Z,panama jangal donkey usa donkey india to Mexico #shorts,https://www.youtube.com/watch?v=Mk9OxAy766Q,panama jangal donkey usa donkey india to Mexico #shorts.,UCFWpvAdpy7c7eUTEDNmpdnA,technical youtuber
491,iUw1ITOnNiE,2023-01-19T12:47:02Z,🇺🇸#haryana 🇺🇸#donkey #usa #2numabri #2numberi #america #haryanaale #india #panama #usalifestyle,https://www.youtube.com/watch?v=iUw1ITOnNiE,Insta =rishideswal Insta=Honeymaan05 #donkey #haryana #usa #2numabri #2numabri #america #haryanaale #panama ...,UCbxP5ppeghypksQtdbMSzog,Deswal & Maan
492,2lREN8jYoGQ,2022-04-14T10:12:48Z,India to America VIA Donkey 🇺🇸 @donker #donkey,https://www.youtube.com/watch?v=2lREN8jYoGQ,Donkey by punjabi and haryanvi boy........ #donkey #panama #students #student.,UCXMfqD7XTZbc-9XlLIALJXg,IELTS WALE 🇨🇦
493,8bKaEWm_l8E,2022-08-03T06:51:36Z,USA Donkey new video 2022 • New update • haryana to USA • panama camp •#donkey,https://www.youtube.com/watch?v=8bKaEWm_l8E,USA Donkey 2022 New video New America Donkey Video 2022 Mexico border crossing america entry by donkey | Indian boys ...,UCypuIdlqQELMH_vKb5FMcbQ,Indian American
494,FIldvEu9cLE,2023-01-05T02:51:34Z,USA 🇺🇲Donkey 2 numbri INDIA to USA #shorts #donkey,https://www.youtube.com/watch?v=FIldvEu9cLE,USA Canada and Mexico donkey video for you guys plz like subscribe for.,UC0QkUqktfBZ7orWHCuy2KVA,Deep_01
495,u4u-_piR3ug,2022-05-04T02:00:09Z,America ki donkey in August | india to usa | PUNJAB TO USA |,https://www.youtube.com/watch?v=u4u-_piR3ug,,UCBGjXFBZMjZ3GodrxmnMHrw,mohit traveller vlogs 2046
496,rBJVD6wCOV4,2022-08-17T05:37:11Z,USA Mexico Border Donkey Latest Update Condition | America Donkey Crossing | Awinash Neutral,https://www.youtube.com/watch?v=rBJVD6wCOV4,USA Mexico Border Donkey Latest Update Condition | America Donkey Crossing | Awinash Neutral Informations provided ...,UCkD0qeQexxb9BJSXiWUQVaQ,Awinash Neutral
497,sKC6oMIVzEs,2022-11-27T01:30:23Z,USA DONKEY 🇺🇲 VIDEO || AMERICA CAMP || PERU TO AMERICA DONKEY VIDEO #usa #trending #shorts #viral,https://www.youtube.com/watch?v=sKC6oMIVzEs,USA DONKEY VIDEO || AMERICA CAMP || PERU TO AMERICA DONKEY VIDEO #usa #trending #shorts #viral 2 Numabri ...,UCtLr-VlUjuxh4zUQA6pu_zg,2 Numbari USA Wala
498,eVNWQ2wabIs,2022-10-27T03:30:09Z,USA Donkey I india to usa donkey I ਦੋਂਕੀ ਚ ਬੱਚਿਆਂ ਦੀ ਜਾਂ ਤੇ ਬਣ ਆਈ I ਦਿਲ ਦਹਲ ਗਯਾ ਵੇਖ ਕੇ I,https://www.youtube.com/watch?v=eVNWQ2wabIs,shorts #usadonkey #usadonkey2022 #usa #freevisaadvisor USA Donkey I india to usa donkey I ਦੋਂਕੀ ਚ ਬੱਚਿਆਂ ਦੀ ...,UC4mifYMs39uMhHSBeP64dCg,Free Visa Advisor
